numero,enteCommittente,categoria,pubblicazione,scadenza,valore:number,descrizione,url,datarss
1797048,AZIENDA OSPEDALIERA DI RILIEVO NAZIONALE E DI ALTA SPECIALIZZAZIONE - GARIBALDI CATANIA,Varie,2017-11-29,11/12/2017,100000.00,"Noleggio di apparecchiature per il trasporto di campioni istologici, bando numero: 1797048",https://www.acquistinretepa.it/opencms/opencms/main/impresa/strumenti/dettaglio.jsp?idT=1797048&tipoVis=descr&nome=Noleggio+di+apparecchiature+per+il+trasporto+di+campioni+istologici&frompage=rdoAperte.jsp&orderBy=pubblicazione&sort=desc&__pagina=63&__element=paginazione,"Wed, 29 Nov 2017 02:00:00 +0200"
1796494,ARPA - CALABRIA,Varie,2017-11-29,08/01/2018,106557.38,"Fornitura di materiali di consumo (vetreria e plasticheria) in uso presso i Laboratori Chimici, Fisici e Bionaturalistici dei 5 Dipartimenti Provinciali Arpacal, di cui all’allegata distinta, in esecuzione della Delibera n. 899 del 23/11/2017 - CIG: 7292878150, bando numero: 1796494",https://www.acquistinretepa.it/opencms/opencms/main/impresa/strumenti/dettaglio.jsp?idT=1796494&tipoVis=descr&nome=Fornitura+di+materiali+di+consumo+%28vetreria+e+plasticheria%29+in+uso+presso+i+Laboratori+Chimici%2C+Fisici+e+Bionaturalistici+dei+5+Dipartimenti+Provinciali+Arpacal%2C+di+cui+all%3Fallegata+distinta%2C+in+esecuzione+della+Delibera+n.+899+del+23%2F11%2F2017+-+CIG%3A+7292878150&frompage=rdoAperte.jsp&orderBy=pubblicazione&sort=desc&__pagina=63&__element=paginazione,"Wed, 29 Nov 2017 02:00:00 +0200"
1792220,POLITECNICO DI TORINO,Varie,2017-11-29,11/12/2017,1000.00,"Politecnico di Torino Amministrazione Centrale - Acquisto Tavolo riunioni, bando numero: 1792220",https://www.acquistinretepa.it/opencms/opencms/main/impresa/strumenti/dettaglio.jsp?idT=1792220&tipoVis=descr&nome=Politecnico+di+Torino+Amministrazione+Centrale+-+Acquisto+Tavolo+riunioni&frompage=rdoAperte.jsp&orderBy=pubblicazione&sort=desc&__pagina=63&__element=paginazione,"Wed, 29 Nov 2017 02:00:00 +0200"
1770820,ASL NAPOLI 1 CENTRO,Varie,2017-11-29,18/12/2017,22000.00,"Fornitura di N.4 Monitor/Defibrillatori portatili e di N.1 Defibrillatore per l' UUOOCC di Cardiologia-UTIC dei PP.OO. PELLEGRINI-S.G. BOSCO(GC), bando numero: 1770820",https://www.acquistinretepa.it/opencms/opencms/main/impresa/strumenti/dettaglio.jsp?idT=1770820&tipoVis=descr&nome=Fornitura+di+N.4+Monitor%2FDefibrillatori+portatili+e+di+N.1+Defibrillatore+per+l%27+UUOOCC+di+Cardiologia-UTIC+dei+PP.OO.+PELLEGRINI-S.G.+BOSCO%28GC%29&frompage=rdoAperte.jsp&orderBy=pubblicazione&sort=desc&__pagina=63&__element=paginazione,"Wed, 29 Nov 2017 02:00:00 +0200"
1792228,ASL TO 3,Varie,2017-11-29,12/12/2017,28800.00,"SET DRENAGGIO PNEUMOTORACICO IPERTESO PER IMPIEGO PREOSPEDALIERO, bando numero: 1792228",https://www.acquistinretepa.it/opencms/opencms/main/impresa/strumenti/dettaglio.jsp?idT=1792228&tipoVis=descr&nome=SET+DRENAGGIO+PNEUMOTORACICO+IPERTESO+PER+IMPIEGO+PREOSPEDALIERO&frompage=rdoAperte.jsp&orderBy=pubblicazione&sort=desc&__pagina=64&__element=paginazione,"Wed, 29 Nov 2017 02:00:00 +0200"
1796910,MINISTERO DELLA DIFESA,Lavori di manutenzione,2017-11-29,13/12/2017,1536.52,"LAVORI DI REALIZZAZIONE DI UNA NUOVA LINEA ELETTRICA COME DA SPECIFICHE TECNICHE IN ALLEGATO ""A"", bando numero: 1796910",https://www.acquistinretepa.it/opencms/opencms/main/impresa/strumenti/dettaglio.jsp?idT=1796910&tipoVis=descr&nome=LAVORI+DI+REALIZZAZIONE+DI+UNA+NUOVA+LINEA+ELETTRICA+COME+DA+SPECIFICHE+TECNICHE+IN+ALLEGATO+%22A%22&frompage=rdoAperte.jsp&orderBy=pubblicazione&sort=desc&__pagina=64&__element=paginazione,"Wed, 29 Nov 2017 02:00:00 +0200"
1796903,COMUNE DI NUGHEDU SAN NICOLÒ,Varie,2017-11-29,07/12/2017,3000.00,"Acquisto e trasporto macchina spargisale, bando numero: 1796903",https://www.acquistinretepa.it/opencms/opencms/main/impresa/strumenti/dettaglio.jsp?idT=1796903&tipoVis=descr&nome=Acquisto+e+trasporto+macchina+spargisale&frompage=rdoAperte.jsp&orderBy=pubblicazione&sort=desc&__pagina=64&__element=paginazione,"Wed, 29 Nov 2017 02:00:00 +0200"
1790292,MINISTERO DELLA DIFESA,Varie,2017-11-29,07/12/2017,5921.31,"Fasc.1213/17 – Lotto 4 – INDAGINE RIBANDITA - Fornitura di una stazione di verniciatura completa di banco di impregnazione per l’ammodernamento delle officine della Sezione Sistema Nave dell’Arsenale Militare Marittimo di Taranto, bando numero: 1790292",https://www.acquistinretepa.it/opencms/opencms/main/impresa/strumenti/dettaglio.jsp?idT=1790292&tipoVis=descr&nome=Fasc.1213%2F17+%3F+Lotto+4+%3F+INDAGINE+RIBANDITA+-+Fornitura+di+una+stazione+di+verniciatura+completa+di+banco+di+impregnazione+per+l%3Fammodernamento+delle+officine+della+Sezione+Sistema+Nave+dell%3FArsenale+Militare+Marittimo+di+Taranto&frompage=rdoAperte.jsp&orderBy=pubblicazione&sort=desc&__pagina=64&__element=paginazione,"Wed, 29 Nov 2017 02:00:00 +0200"
1791819,MINISTERO DELLA DIFESA,Varie,2017-11-29,06/12/2017,25000.00,"FASC. 1242/17 - Fornitura a richiesta di materiale a catalogo per attività di saldatura del settore scafo sulle UU.NN. In sosta, bando numero: 1791819",https://www.acquistinretepa.it/opencms/opencms/main/impresa/strumenti/dettaglio.jsp?idT=1791819&tipoVis=descr&nome=FASC.+1242%2F17+-+Fornitura+a+richiesta+di+materiale+a+catalogo+per+attivit%E0+di+saldatura+del+settore+scafo+sulle+UU.NN.+In+sosta&frompage=rdoAperte.jsp&orderBy=pubblicazione&sort=desc&__pagina=64&__element=paginazione,"Wed, 29 Nov 2017 02:00:00 +0200"
1796803,MINISTERO DELLA DIFESA,Varie,2017-11-29,13/12/2017,7380.34,"LAVORI DI MESSA IN SICUREZZA L81/08 MEDIANTE POTATURA ABBATTIMENTO ALBERI COME DA SPECIFICHE TECNICHE IN ALLEGATO ""A"", bando numero: 1796803",https://www.acquistinretepa.it/opencms/opencms/main/impresa/strumenti/dettaglio.jsp?idT=1796803&tipoVis=descr&nome=LAVORI+DI+MESSA+IN+SICUREZZA+L81%2F08+MEDIANTE+POTATURA+ABBATTIMENTO+ALBERI+COME+DA+SPECIFICHE+TECNICHE+IN+ALLEGATO+%22A%22&frompage=rdoAperte.jsp&orderBy=pubblicazione&sort=desc&__pagina=64&__element=paginazione,"Wed, 29 Nov 2017 02:00:00 +0200"
1791982,MINISTERO DELLA DIFESA,Lavori di manutenzione,2017-11-29,11/12/2017,4900.00,"SOSTITUZIONE DELLA CELLA PROTEZIONE TRASFORMATORE GUASTA DI CABINA MEDIA TENSIONE, bando numero: 1791982",https://www.acquistinretepa.it/opencms/opencms/main/impresa/strumenti/dettaglio.jsp?idT=1791982&tipoVis=descr&nome=SOSTITUZIONE+DELLA+CELLA+PROTEZIONE+TRASFORMATORE+GUASTA+DI+CABINA+MEDIA+TENSIONE&frompage=rdoAperte.jsp&orderBy=pubblicazione&sort=desc&__pagina=64&__element=paginazione,"Wed, 29 Nov 2017 02:00:00 +0200"
1795244,PRESIDENZA DEL CONSIGLIO DEI MINISTRI,Varie,2017-11-29,11/12/2017,132500.00,"Acquisizione ed aggiornamento delle licenze VMware per l'infrastruttura di rete dipartimentale., bando numero: 1795244",https://www.acquistinretepa.it/opencms/opencms/main/impresa/strumenti/dettaglio.jsp?idT=1795244&tipoVis=descr&nome=Acquisizione+ed+aggiornamento+delle+licenze+VMware+per+l%27infrastruttura+di+rete+dipartimentale.&frompage=rdoAperte.jsp&orderBy=pubblicazione&sort=desc&__pagina=64&__element=paginazione,"Wed, 29 Nov 2017 02:00:00 +0200"
1796775,MINISTERO DELL'ISTRUZIONE DELL'UNIVERSITA' E DELLA RICERCA,Varie,2017-11-29,06/12/2017,600.00,"MATERIALE FACILE CONSUMO LAB_SCIENZE 29/11/2017, bando numero: 1796775",https://www.acquistinretepa.it/opencms/opencms/main/impresa/strumenti/dettaglio.jsp?idT=1796775&tipoVis=descr&nome=MATERIALE+FACILE+CONSUMO+LAB_SCIENZE+29%2F11%2F2017&frompage=rdoAperte.jsp&orderBy=pubblicazione&sort=desc&__pagina=64&__element=paginazione,"Wed, 29 Nov 2017 02:00:00 +0200"
1793972,ASL TO 4,Varie,2017-11-29,15/12/2017,45000.00,"FORNITURA DI UN SISTEMA PASSAMALATI OCCORRENTE AL BLOCCO OPERATORIO DEL P.O. DI CUORGNE', bando numero: 1793972",https://www.acquistinretepa.it/opencms/opencms/main/impresa/strumenti/dettaglio.jsp?idT=1793972&tipoVis=descr&nome=FORNITURA+DI+UN+SISTEMA+PASSAMALATI+OCCORRENTE+AL+BLOCCO+OPERATORIO+DEL+P.O.+DI+CUORGNE%27&frompage=rdoAperte.jsp&orderBy=pubblicazione&sort=desc&__pagina=64&__element=paginazione,"Wed, 29 Nov 2017 02:00:00 +0200"
1796142,MINISTERO DELL'ECONOMIA E DELLE FINANZE,Varie,2017-11-29,12/12/2017,49180.00,"Allestimento autosoccorso su veicolo IVECO EUROCARGO 100E18., bando numero: 1796142",https://www.acquistinretepa.it/opencms/opencms/main/impresa/strumenti/dettaglio.jsp?idT=1796142&tipoVis=descr&nome=Allestimento+autosoccorso+su+veicolo+IVECO+EUROCARGO+100E18.&frompage=rdoAperte.jsp&orderBy=pubblicazione&sort=desc&__pagina=65&__element=paginazione,"Wed, 29 Nov 2017 02:00:00 +0200"
1793311,MINISTERO DELLA DIFESA,Varie,2017-11-29,09/12/2017,1679.00,"Fasc.1252/17 – Fornitura di luminarie per servizi vari di Marinarsen Taranto, bando numero: 1793311",https://www.acquistinretepa.it/opencms/opencms/main/impresa/strumenti/dettaglio.jsp?idT=1793311&tipoVis=descr&nome=Fasc.1252%2F17+%3F+Fornitura+di+luminarie+per+servizi+vari+di+Marinarsen+Taranto&frompage=rdoAperte.jsp&orderBy=pubblicazione&sort=desc&__pagina=65&__element=paginazione,"Wed, 29 Nov 2017 02:00:00 +0200"
1795175,MINISTERO DELL'INTERNO,Varie,2017-11-29,21/12/2017,75000.00,"PR.179.017.A.3 - Acquisto e aggiornamento tecnologico di licenze d’uso McAfee,  con connessi servizi di supporto, per la corretta operatività del “Sistema APFIS” del Servizio Polizia Scientifica della Direzione Centrale Anticrimine., bando numero: 1795175",https://www.acquistinretepa.it/opencms/opencms/main/impresa/strumenti/dettaglio.jsp?idT=1795175&tipoVis=descr&nome=PR.179.017.A.3+-+Acquisto+e+aggiornamento+tecnologico+di+licenze+d%3Fuso+McAfee%2C++con+connessi+servizi+di+supporto%2C+per+la+corretta+operativit%E0+del+%3FSistema+APFIS%3F+del+Servizio+Polizia+Scientifica+della+Direzione+Centrale+Anticrimine.&frompage=rdoAperte.jsp&orderBy=pubblicazione&sort=desc&__pagina=65&__element=paginazione,"Wed, 29 Nov 2017 02:00:00 +0200"
1785628,MINISTERO DELL'INTERNO,Varie,2017-11-29,14/12/2017,105000.00,"Lettore dosimetri TLD, bando numero: 1785628",https://www.acquistinretepa.it/opencms/opencms/main/impresa/strumenti/dettaglio.jsp?idT=1785628&tipoVis=descr&nome=Lettore+dosimetri+TLD&frompage=rdoAperte.jsp&orderBy=pubblicazione&sort=desc&__pagina=65&__element=paginazione,"Wed, 29 Nov 2017 02:00:00 +0200"
1796626,C.N.R. CONSIGLIO NAZIONALE DELLE RICERCHE,Varie,2017-11-29,06/12/2017,1460.00,"Prodotti e reagenti chimici, bando numero: 1796626",https://www.acquistinretepa.it/opencms/opencms/main/impresa/strumenti/dettaglio.jsp?idT=1796626&tipoVis=descr&nome=Prodotti+e+reagenti+chimici&frompage=rdoAperte.jsp&orderBy=pubblicazione&sort=desc&__pagina=65&__element=paginazione,"Wed, 29 Nov 2017 02:00:00 +0200"
1796633,MINISTERO DELLA DIFESA,Varie,2017-11-29,13/12/2017,26.00,"FORNITURA DI SALVIETTINE CLINELL IN BARATTOLI COME DA SPECIFICHE TECNICHE IN ALLEGATO ""A"", bando numero: 1796633",https://www.acquistinretepa.it/opencms/opencms/main/impresa/strumenti/dettaglio.jsp?idT=1796633&tipoVis=descr&nome=FORNITURA+DI+SALVIETTINE+CLINELL+IN+BARATTOLI+COME+DA+SPECIFICHE+TECNICHE+IN+ALLEGATO+%22A%22&frompage=rdoAperte.jsp&orderBy=pubblicazione&sort=desc&__pagina=65&__element=paginazione,"Wed, 29 Nov 2017 02:00:00 +0200"
1796575,MINISTERO DELLA DIFESA,Varie,2017-11-29,07/12/2017,56940.00,"FASC. 5674/17 – Servizi di rinnovamento/ammodernamento dei macchinari d’officina di Nave Mimbelli (Lotto A e B non aggiudicabili separatamente), bando numero: 1796575",https://www.acquistinretepa.it/opencms/opencms/main/impresa/strumenti/dettaglio.jsp?idT=1796575&tipoVis=descr&nome=FASC.+5674%2F17+%3F+Servizi+di+rinnovamento%2Fammodernamento+dei+macchinari+d%3Fofficina+di+Nave+Mimbelli+%28Lotto+A+e+B+non+aggiudicabili+separatamente%29&frompage=rdoAperte.jsp&orderBy=pubblicazione&sort=desc&__pagina=65&__element=paginazione,"Wed, 29 Nov 2017 02:00:00 +0200"
1796660,AZIENDA OSPEDALIERA SANTOBONO PAUSILIPON NAPOLI,Varie,2017-11-29,06/12/2017,19000.00,"FORNITURA DI MATERIALE DI CONSUMO PER IL SISTEMA DI STABILIZZAZIONE CRANICA DORO PER LA C.O. DI NEUROCHIRURGIA DEL P.O. SANTOBONO, bando numero: 1796660",https://www.acquistinretepa.it/opencms/opencms/main/impresa/strumenti/dettaglio.jsp?idT=1796660&tipoVis=descr&nome=FORNITURA+DI+MATERIALE+DI+CONSUMO+PER+IL+SISTEMA+DI+STABILIZZAZIONE+CRANICA+DORO+PER+LA+C.O.+DI+NEUROCHIRURGIA+DEL+P.O.+SANTOBONO&frompage=rdoAperte.jsp&orderBy=pubblicazione&sort=desc&__pagina=65&__element=paginazione,"Wed, 29 Nov 2017 02:00:00 +0200"
1783712,C.N.R. CONSIGLIO NAZIONALE DELLE RICERCHE,Varie,2017-11-29,12/12/2017,500.00,"Acquisto superscript vilo, bando numero: 1783712",https://www.acquistinretepa.it/opencms/opencms/main/impresa/strumenti/dettaglio.jsp?idT=1783712&tipoVis=descr&nome=Acquisto+superscript+vilo&frompage=rdoAperte.jsp&orderBy=pubblicazione&sort=desc&__pagina=65&__element=paginazione,"Wed, 29 Nov 2017 02:00:00 +0200"
1787917,ASL SALERNO,Varie,2017-11-29,11/12/2017,1500.00,"ACQUISTO VENTILATORE POLMONARE CPAP con umidificatore integrato , memoria compliance e AHI - corredato di materiale di consumo per un anno paz A.V. DI ANGRI, bando numero: 1787917",https://www.acquistinretepa.it/opencms/opencms/main/impresa/strumenti/dettaglio.jsp?idT=1787917&tipoVis=descr&nome=ACQUISTO+VENTILATORE+POLMONARE+CPAP+con+umidificatore+integrato+%2C+memoria+compliance+e+AHI+-+corredato+di+materiale+di+consumo+per+un+anno+paz+A.V.+DI+ANGRI&frompage=rdoAperte.jsp&orderBy=pubblicazione&sort=desc&__pagina=65&__element=paginazione,"Wed, 29 Nov 2017 02:00:00 +0200"
1796599,MINISTERO DELLA DIFESA,Varie,2017-11-29,06/12/2017,1410.00,"AN 63/17 - FORNITURA ARREDI OFFICINA (TERZO esperimento), bando numero: 1796599",https://www.acquistinretepa.it/opencms/opencms/main/impresa/strumenti/dettaglio.jsp?idT=1796599&tipoVis=descr&nome=AN+63%2F17+-+FORNITURA+ARREDI+OFFICINA+%28TERZO+esperimento%29&frompage=rdoAperte.jsp&orderBy=pubblicazione&sort=desc&__pagina=66&__element=paginazione,"Wed, 29 Nov 2017 02:00:00 +0200"
1787891,ASL SALERNO,Varie,2017-11-29,11/12/2017,1500.00,"ACQUISTO VENTILATORE POLMONARE CPAP con umidificatore integrato , memoria compliance e AHI - corredato di materiale di consumo per un anno paz A.G. DI SCAFATI, bando numero: 1787891",https://www.acquistinretepa.it/opencms/opencms/main/impresa/strumenti/dettaglio.jsp?idT=1787891&tipoVis=descr&nome=ACQUISTO+VENTILATORE+POLMONARE+CPAP+con+umidificatore+integrato+%2C+memoria+compliance+e+AHI+-+corredato+di+materiale+di+consumo+per+un+anno+paz+A.G.+DI+SCAFATI&frompage=rdoAperte.jsp&orderBy=pubblicazione&sort=desc&__pagina=66&__element=paginazione,"Wed, 29 Nov 2017 02:00:00 +0200"
1795711,AZIENDA OSPEDALIERA PISANA,Varie,2017-11-29,06/12/2017,5500.00,"Fornitura di strumentazione per la manutenzione e verifiche elettriche come da Capitolato tecnico allegato, bando numero: 1795711",https://www.acquistinretepa.it/opencms/opencms/main/impresa/strumenti/dettaglio.jsp?idT=1795711&tipoVis=descr&nome=Fornitura+di+strumentazione+per+la+manutenzione+e+verifiche+elettriche+come+da+Capitolato+tecnico+allegato&frompage=rdoAperte.jsp&orderBy=pubblicazione&sort=desc&__pagina=66&__element=paginazione,"Wed, 29 Nov 2017 02:00:00 +0200"
1770741,ASL SALERNO,Varie,2017-11-29,11/12/2017,1500.00,"ACQUISTO VENTILATORE POLMONARE CPAP con umidificatore integrato , memoria compliance e AHI - corredato di materiale di consumo per un anno paz D.T. DI SCAFATI, bando numero: 1770741",https://www.acquistinretepa.it/opencms/opencms/main/impresa/strumenti/dettaglio.jsp?idT=1770741&tipoVis=descr&nome=ACQUISTO+VENTILATORE+POLMONARE+CPAP+con+umidificatore+integrato+%2C+memoria+compliance+e+AHI+-+corredato+di+materiale+di+consumo+per+un+anno+paz+D.T.+DI+SCAFATI&frompage=rdoAperte.jsp&orderBy=pubblicazione&sort=desc&__pagina=66&__element=paginazione,"Wed, 29 Nov 2017 02:00:00 +0200"
1796186,MINISTERO DELLA GIUSTIZIA,Varie,2017-11-29,06/12/2017,350.00,"Poltrona direzionale schienale alto tessuto nero, bando numero: 1796186",https://www.acquistinretepa.it/opencms/opencms/main/impresa/strumenti/dettaglio.jsp?idT=1796186&tipoVis=descr&nome=Poltrona+direzionale+schienale+alto+tessuto+nero&frompage=rdoAperte.jsp&orderBy=pubblicazione&sort=desc&__pagina=66&__element=paginazione,"Wed, 29 Nov 2017 02:00:00 +0200"
1787922,ASL SALERNO,Varie,2017-11-29,11/12/2017,1500.00,"ACQUISTO VENTILATORE POLMONARE CPAP con umidificatore integrato , memoria compliance e AHI - corredato di materiale di consumo per un anno paz N.A. DI SCAFATI, bando numero: 1787922",https://www.acquistinretepa.it/opencms/opencms/main/impresa/strumenti/dettaglio.jsp?idT=1787922&tipoVis=descr&nome=ACQUISTO+VENTILATORE+POLMONARE+CPAP+con+umidificatore+integrato+%2C+memoria+compliance+e+AHI+-+corredato+di+materiale+di+consumo+per+un+anno+paz+N.A.+DI+SCAFATI&frompage=rdoAperte.jsp&orderBy=pubblicazione&sort=desc&__pagina=66&__element=paginazione,"Wed, 29 Nov 2017 02:00:00 +0200"
1787929,ASL SALERNO,Varie,2017-11-29,11/12/2017,1500.00,"ACQUISTO VENTILATORE POLMONARE CPAP con umidificatore integrato , memoria compliance e AHI - corredato di materiale di consumo per un anno paz R.G. DI ANGRI, bando numero: 1787929",https://www.acquistinretepa.it/opencms/opencms/main/impresa/strumenti/dettaglio.jsp?idT=1787929&tipoVis=descr&nome=ACQUISTO+VENTILATORE+POLMONARE+CPAP+con+umidificatore+integrato+%2C+memoria+compliance+e+AHI+-+corredato+di+materiale+di+consumo+per+un+anno+paz+R.G.+DI+ANGRI&frompage=rdoAperte.jsp&orderBy=pubblicazione&sort=desc&__pagina=66&__element=paginazione,"Wed, 29 Nov 2017 02:00:00 +0200"
1789620,AZIENDA SANITARIA UNICA REGIONALE MARCHE,Varie,2017-11-29,07/12/2017,800.00,"ACQUISTO DISTRUGGIDOCUMENTI PER LE ESIGENZE DELL'AREA VASTA 3 DI MACERATA, bando numero: 1789620",https://www.acquistinretepa.it/opencms/opencms/main/impresa/strumenti/dettaglio.jsp?idT=1789620&tipoVis=descr&nome=ACQUISTO+DISTRUGGIDOCUMENTI+PER+LE+ESIGENZE+DELL%27AREA+VASTA+3+DI+MACERATA&frompage=rdoAperte.jsp&orderBy=pubblicazione&sort=desc&__pagina=66&__element=paginazione,"Wed, 29 Nov 2017 02:00:00 +0200"
1787935,ASL SALERNO,Varie,2017-11-29,11/12/2017,10000.00,"ACQUISTO DI UN SISTEMA MYAIRVO 2 - UMIDIFICATORE ATTIVO CON GENERATORE DI FLUSSO INTEGRATO PER UTILIZZO DOMICILIARE,  PIU’CONSUMABILI  FABBISOGNO ANNUO,  PER PAZ. C.E.   DI SCAFATI, bando numero: 1787935",https://www.acquistinretepa.it/opencms/opencms/main/impresa/strumenti/dettaglio.jsp?idT=1787935&tipoVis=descr&nome=ACQUISTO+DI+UN+SISTEMA+MYAIRVO+2+-+UMIDIFICATORE+ATTIVO+CON+GENERATORE+DI+FLUSSO+INTEGRATO+PER+UTILIZZO+DOMICILIARE%2C++PIU%3FCONSUMABILI++FABBISOGNO+ANNUO%2C++PER+PAZ.+C.E.+++DI+SCAFATI&frompage=rdoAperte.jsp&orderBy=pubblicazione&sort=desc&__pagina=66&__element=paginazione,"Wed, 29 Nov 2017 02:00:00 +0200"
1794568,ASL SALERNO,Varie,2017-11-29,11/12/2017,967.60,"Stampati vari DS 69 CAPACCIO/ROCCADASPIDE, bando numero: 1794568",https://www.acquistinretepa.it/opencms/opencms/main/impresa/strumenti/dettaglio.jsp?idT=1794568&tipoVis=descr&nome=Stampati+vari+DS+69+CAPACCIO%2FROCCADASPIDE&frompage=rdoAperte.jsp&orderBy=pubblicazione&sort=desc&__pagina=66&__element=paginazione,"Wed, 29 Nov 2017 02:00:00 +0200"
1795402,PROVINCIA DI GROSSETO,Varie,2017-11-29,15/12/2017,118800.00,"Servizio invernale di sgombero neve  e spargimento cloruri, bando numero: 1795402",https://www.acquistinretepa.it/opencms/opencms/main/impresa/strumenti/dettaglio.jsp?idT=1795402&tipoVis=descr&nome=Servizio+invernale+di+sgombero+neve++e+spargimento+cloruri&frompage=rdoAperte.jsp&orderBy=pubblicazione&sort=desc&__pagina=67&__element=paginazione,"Wed, 29 Nov 2017 02:00:00 +0200"
1796455,AZIENDA SANITARIA UNICA REGIONALE MARCHE,Varie,2017-11-29,07/12/2017,6500.00,"OFTALMOSCOPIO BINOCULARE INDIRETTO -OMEGA 500-, bando numero: 1796455",https://www.acquistinretepa.it/opencms/opencms/main/impresa/strumenti/dettaglio.jsp?idT=1796455&tipoVis=descr&nome=OFTALMOSCOPIO+BINOCULARE+INDIRETTO+-OMEGA+500-&frompage=rdoAperte.jsp&orderBy=pubblicazione&sort=desc&__pagina=67&__element=paginazione,"Wed, 29 Nov 2017 02:00:00 +0200"
1795611,ASL SALERNO,Varie,2017-11-29,13/12/2017,1500.00,"Acquisto carrozzine per disabili per il DS 68, bando numero: 1795611",https://www.acquistinretepa.it/opencms/opencms/main/impresa/strumenti/dettaglio.jsp?idT=1795611&tipoVis=descr&nome=Acquisto+carrozzine+per+disabili+per+il+DS+68&frompage=rdoAperte.jsp&orderBy=pubblicazione&sort=desc&__pagina=67&__element=paginazione,"Wed, 29 Nov 2017 02:00:00 +0200"
1774542,MINISTERO DELLA GIUSTIZIA,Varie,2017-11-29,07/12/2017,1.00,"Materiali per formazione wc ambienti socialità ""Complesso A "", bando numero: 1774542",https://www.acquistinretepa.it/opencms/opencms/main/impresa/strumenti/dettaglio.jsp?idT=1774542&tipoVis=descr&nome=Materiali+per+formazione+wc+ambienti+socialit%E0+%22Complesso+A+%22&frompage=rdoAperte.jsp&orderBy=pubblicazione&sort=desc&__pagina=67&__element=paginazione,"Wed, 29 Nov 2017 02:00:00 +0200"
1795348,MINISTERO DELLA GIUSTIZIA,Varie,2017-11-29,07/12/2017,122.15,"Servizi postali Uffici di Catanzaro, Cosenza, Crotone, bando numero: 1795348",https://www.acquistinretepa.it/opencms/opencms/main/impresa/strumenti/dettaglio.jsp?idT=1795348&tipoVis=descr&nome=Servizi+postali+Uffici+di+Catanzaro%2C+Cosenza%2C+Crotone&frompage=rdoAperte.jsp&orderBy=pubblicazione&sort=desc&__pagina=67&__element=paginazione,"Wed, 29 Nov 2017 02:00:00 +0200"
1796470,MINISTERO DELL'ISTRUZIONE DELL'UNIVERSITA' E DELLA RICERCA,Varie,2017-11-29,06/12/2017,500.00,"Stereomicroscopio binoculare LABORATORIO SCIENZE, bando numero: 1796470",https://www.acquistinretepa.it/opencms/opencms/main/impresa/strumenti/dettaglio.jsp?idT=1796470&tipoVis=descr&nome=Stereomicroscopio+binoculare+LABORATORIO+SCIENZE&frompage=rdoAperte.jsp&orderBy=pubblicazione&sort=desc&__pagina=67&__element=paginazione,"Wed, 29 Nov 2017 02:00:00 +0200"
1795988,AZIENDA SANITARIA UNICA REGIONALE MARCHE,Varie,2017-11-29,07/12/2017,39900.00,"MICROSCOPIO ENDOTELIALE, bando numero: 1795988",https://www.acquistinretepa.it/opencms/opencms/main/impresa/strumenti/dettaglio.jsp?idT=1795988&tipoVis=descr&nome=MICROSCOPIO+ENDOTELIALE&frompage=rdoAperte.jsp&orderBy=pubblicazione&sort=desc&__pagina=67&__element=paginazione,"Wed, 29 Nov 2017 02:00:00 +0200"
1796312,MINISTERO DELLE INFRASTRUTTURE E DEI TRASPORTI,Lavori di manutenzione,2017-11-29,07/12/2017,140068.39,"CAPACI (PA) Lavori  di abbattimento barriere architettoniche ed adeguamento al D. Lgs. 81/2008 dell’immobile confiscato sito in via Isola delle Femmine, 16 da adibire a Stazione dei Carabinieri  e annessi alloggi di servizio., bando numero: 1796312",https://www.acquistinretepa.it/opencms/opencms/main/impresa/strumenti/dettaglio.jsp?idT=1796312&tipoVis=descr&nome=CAPACI+%28PA%29+Lavori++di+abbattimento+barriere+architettoniche+ed+adeguamento+al+D.+Lgs.+81%2F2008+dell%3Fimmobile+confiscato+sito+in+via+Isola+delle+Femmine%2C+16+da+adibire+a+Stazione+dei+Carabinieri++e+annessi+alloggi+di+servizio.&frompage=rdoAperte.jsp&orderBy=pubblicazione&sort=desc&__pagina=67&__element=paginazione,"Wed, 29 Nov 2017 02:00:00 +0200"
1796480,MINISTERO DELLA GIUSTIZIA,Varie,2017-11-29,07/12/2017,655.00,"FDCIGE.MP.15/2017 - Materiale igienico sanitario, bando numero: 1796480",https://www.acquistinretepa.it/opencms/opencms/main/impresa/strumenti/dettaglio.jsp?idT=1796480&tipoVis=descr&nome=FDCIGE.MP.15%2F2017+-+Materiale+igienico+sanitario&frompage=rdoAperte.jsp&orderBy=pubblicazione&sort=desc&__pagina=67&__element=paginazione,"Wed, 29 Nov 2017 02:00:00 +0200"
1793302,AZIENDA OSPEDALIERA UNIVERSITARIA FEDERICO II,Varie,2017-11-29,11/12/2017,2800.00,"ER3- SISTEMA DI FISSAGGIO CANNULA PER TRACHEOSTOMIA, bando numero: 1793302",https://www.acquistinretepa.it/opencms/opencms/main/impresa/strumenti/dettaglio.jsp?idT=1793302&tipoVis=descr&nome=ER3-+SISTEMA+DI+FISSAGGIO+CANNULA+PER+TRACHEOSTOMIA&frompage=rdoAperte.jsp&orderBy=pubblicazione&sort=desc&__pagina=67&__element=paginazione,"Wed, 29 Nov 2017 02:00:00 +0200"
1796437,MINISTERO DELLA DIFESA,Varie,2017-11-29,13/12/2017,455.70,"FORNITURA DI CONTENITORI GASTRONOMICI IN ACCIAIO COME DA SPECIFICHE TECNICHE IN ALLEGATO ""A"", bando numero: 1796437",https://www.acquistinretepa.it/opencms/opencms/main/impresa/strumenti/dettaglio.jsp?idT=1796437&tipoVis=descr&nome=FORNITURA+DI+CONTENITORI+GASTRONOMICI+IN+ACCIAIO+COME+DA+SPECIFICHE+TECNICHE+IN+ALLEGATO+%22A%22&frompage=rdoAperte.jsp&orderBy=pubblicazione&sort=desc&__pagina=68&__element=paginazione,"Wed, 29 Nov 2017 02:00:00 +0200"
1795980,AZIENDA OSPEDALIERA PAPARDO,Varie,2017-11-29,15/12/2017,6720.00,"ARREDI TECNICI PER LA UO DI ANATOMIA PATOLOGICA, bando numero: 1795980",https://www.acquistinretepa.it/opencms/opencms/main/impresa/strumenti/dettaglio.jsp?idT=1795980&tipoVis=descr&nome=ARREDI+TECNICI+PER+LA+UO+DI+ANATOMIA+PATOLOGICA&frompage=rdoAperte.jsp&orderBy=pubblicazione&sort=desc&__pagina=68&__element=paginazione,"Wed, 29 Nov 2017 02:00:00 +0200"
1796405,COMUNE DI ARZANO,Lavori di manutenzione,2017-11-29,14/12/2017,12900.00,"Determina a contrarre per l'avvio di Procedura una richiesta d’offerta (RdO) sul MePA/Consip per l'affidamento per  mesi 18  del servizio manutenzione della segnaletica orizzontale e verticale per la rete stradale comunale, realizzazione di circa n. 35 stalli di sosta disabili(segnaletica orizzontale), installazione di n. 50 segnali verticali da acquistarsi separatamente, bando numero: 1796405",https://www.acquistinretepa.it/opencms/opencms/main/impresa/strumenti/dettaglio.jsp?idT=1796405&tipoVis=descr&nome=Determina+a+contrarre+per+l%27avvio+di+Procedura+una+richiesta+d%3Fofferta+%28RdO%29+sul+MePA%2FConsip+per+l%27affidamento+per++mesi+18++del+servizio+manutenzione+della+segnaletica+orizzontale+e+verticale+per+la+rete+stradale+comunale%2C+realizzazione+di+circa+n.+35+stalli+di+sosta+disabili%28segnaletica+orizzontale%29%2C+installazione+di+n.+50+segnali+verticali+da+acquistarsi+separatamente&frompage=rdoAperte.jsp&orderBy=pubblicazione&sort=desc&__pagina=68&__element=paginazione,"Wed, 29 Nov 2017 02:00:00 +0200"
