numero,enteCommittente,categoria,pubblicazione,scadenza,valore:number,descrizione,url,datarss
1788683,AZIENDA OSPEDALIERA SAN CAMILLO FORLANINI ROMA,Varie,2017-11-27,14/12/2017,40000.00,"Fornitura di n. 1 ecocardiografo (lotto n.1) e n. 1 ecotomografo multidisciplinare (lotto n.2) per le esigenze del Pronto Soccorso, bando numero: 1788683",https://www.acquistinretepa.it/opencms/opencms/main/impresa/strumenti/dettaglio.jsp?idT=1788683&tipoVis=descr&nome=Fornitura+di+n.+1+ecocardiografo+%28lotto+n.1%29+e+n.+1+ecotomografo+multidisciplinare+%28lotto+n.2%29+per+le+esigenze+del+Pronto+Soccorso&frompage=rdoAperte.jsp&orderBy=pubblicazione&sort=desc&__pagina=88&__element=paginazione,"Mon, 27 Nov 2017 02:00:00 +0200"
1789060,COMUNE DI CECINA,Varie,2017-11-27,12/12/2017,150426.22,"Comune di Cecina. Servizio di conduzione e manutenzione degli impianti termici comunali per due anni., bando numero: 1789060",https://www.acquistinretepa.it/opencms/opencms/main/impresa/strumenti/dettaglio.jsp?idT=1789060&tipoVis=descr&nome=Comune+di+Cecina.+Servizio+di+conduzione+e+manutenzione+degli+impianti+termici+comunali+per+due+anni.&frompage=rdoAperte.jsp&orderBy=pubblicazione&sort=desc&__pagina=89&__element=paginazione,"Mon, 27 Nov 2017 02:00:00 +0200"
1787502,AZIENDA OSPEDALIERA SAN CAMILLO FORLANINI ROMA,Varie,2017-11-27,07/12/2017,5400.00,"Fornitura di n. 300 Dosimetri C39 (NUOVA GARA), bando numero: 1787502",https://www.acquistinretepa.it/opencms/opencms/main/impresa/strumenti/dettaglio.jsp?idT=1787502&tipoVis=descr&nome=Fornitura+di+n.+300+Dosimetri+C39+%28NUOVA+GARA%29&frompage=rdoAperte.jsp&orderBy=pubblicazione&sort=desc&__pagina=89&__element=paginazione,"Mon, 27 Nov 2017 02:00:00 +0200"
1787434,UNIVERSITA' DEGLI STUDI DI BARI,Varie,2017-11-27,06/12/2017,1150.00,"Macchinari e attrezzature tecnico scientifico - codice bilancio 302020301 (Asuspro B9440UA-GV0005R), bando numero: 1787434",https://www.acquistinretepa.it/opencms/opencms/main/impresa/strumenti/dettaglio.jsp?idT=1787434&tipoVis=descr&nome=Macchinari+e+attrezzature+tecnico+scientifico+-+codice+bilancio+302020301+%28Asuspro+B9440UA-GV0005R%29&frompage=rdoAperte.jsp&orderBy=pubblicazione&sort=desc&__pagina=89&__element=paginazione,"Mon, 27 Nov 2017 02:00:00 +0200"
1790948,AZIENDA SANITARIA PROVINCIALE DI CALTANISSETTA,Varie,2017-11-27,07/12/2017,129169.20,"FORNITURA DI APPARECCHI ELETTRICI ED ELETTROMEDICALI, bando numero: 1790948",https://www.acquistinretepa.it/opencms/opencms/main/impresa/strumenti/dettaglio.jsp?idT=1790948&tipoVis=descr&nome=FORNITURA+DI+APPARECCHI+ELETTRICI+ED+ELETTROMEDICALI&frompage=rdoAperte.jsp&orderBy=pubblicazione&sort=desc&__pagina=89&__element=paginazione,"Mon, 27 Nov 2017 02:00:00 +0200"
1789254,AZIENDA OSPEDALIERA CITTA' DELLA SALUTE E DELLA SCIENZA DI TORINO,Varie,2017-11-27,15/12/2017,4152.00,"DISPOSITIVI PER OFTALMOSCOPIA, bando numero: 1789254",https://www.acquistinretepa.it/opencms/opencms/main/impresa/strumenti/dettaglio.jsp?idT=1789254&tipoVis=descr&nome=DISPOSITIVI+PER+OFTALMOSCOPIA&frompage=rdoAperte.jsp&orderBy=pubblicazione&sort=desc&__pagina=89&__element=paginazione,"Mon, 27 Nov 2017 02:00:00 +0200"
1790888,AZIENDA SANITARIA PROVINCIALE DI ENNA,Varie,2017-11-27,11/12/2017,260.00,"Fornitura di un apparecchio aerosol PARI BOY SX, bando numero: 1790888",https://www.acquistinretepa.it/opencms/opencms/main/impresa/strumenti/dettaglio.jsp?idT=1790888&tipoVis=descr&nome=Fornitura+di+un+apparecchio+aerosol+PARI+BOY+SX&frompage=rdoAperte.jsp&orderBy=pubblicazione&sort=desc&__pagina=89&__element=paginazione,"Mon, 27 Nov 2017 02:00:00 +0200"
1788750,CAMERA DI COMMERCIO DI COSENZA,Varie,2017-11-27,11/12/2017,4597.77,"MOBILI E ARREDI, bando numero: 1788750",https://www.acquistinretepa.it/opencms/opencms/main/impresa/strumenti/dettaglio.jsp?idT=1788750&tipoVis=descr&nome=MOBILI+E+ARREDI&frompage=rdoAperte.jsp&orderBy=pubblicazione&sort=desc&__pagina=89&__element=paginazione,"Mon, 27 Nov 2017 02:00:00 +0200"
1790809,MINISTERO DELL'ISTRUZIONE DELL'UNIVERSITA' E DELLA RICERCA,Varie,2017-11-27,07/12/2017,1020.00,"FORNITURA LOTTO 5 – STAMPANTE 3D CON ACCESSORI PER PROGETTO “ATELIER CREATIVI”, bando numero: 1790809",https://www.acquistinretepa.it/opencms/opencms/main/impresa/strumenti/dettaglio.jsp?idT=1790809&tipoVis=descr&nome=FORNITURA+LOTTO+5+%3F+STAMPANTE+3D+CON+ACCESSORI+PER+PROGETTO+%3FATELIER+CREATIVI%3F&frompage=rdoAperte.jsp&orderBy=pubblicazione&sort=desc&__pagina=89&__element=paginazione,"Mon, 27 Nov 2017 02:00:00 +0200"
1790571,COMUNE DI MOTTOLA,Varie,2017-11-27,06/12/2017,4000.00,"ADEGUAMENTO A NORME ISOLE ECOLOGICHE, bando numero: 1790571",https://www.acquistinretepa.it/opencms/opencms/main/impresa/strumenti/dettaglio.jsp?idT=1790571&tipoVis=descr&nome=ADEGUAMENTO+A+NORME+ISOLE+ECOLOGICHE&frompage=rdoAperte.jsp&orderBy=pubblicazione&sort=desc&__pagina=89&__element=paginazione,"Mon, 27 Nov 2017 02:00:00 +0200"
1790540,FONDAZIONE ISTITUTO G.GIGLIO DI CEFALU',Varie,2017-11-27,07/12/2017,4200.00,"Filtri pluriuso per container Aesculap, bando numero: 1790540",https://www.acquistinretepa.it/opencms/opencms/main/impresa/strumenti/dettaglio.jsp?idT=1790540&tipoVis=descr&nome=Filtri+pluriuso+per+container+Aesculap&frompage=rdoAperte.jsp&orderBy=pubblicazione&sort=desc&__pagina=89&__element=paginazione,"Mon, 27 Nov 2017 02:00:00 +0200"
1789407,MINISTERO DELLE INFRASTRUTTURE E DEI TRASPORTI,Varie,2017-11-27,11/12/2017,38500.00,"Materiale informatico per il CCISS, bando numero: 1789407",https://www.acquistinretepa.it/opencms/opencms/main/impresa/strumenti/dettaglio.jsp?idT=1789407&tipoVis=descr&nome=Materiale+informatico+per+il+CCISS&frompage=rdoAperte.jsp&orderBy=pubblicazione&sort=desc&__pagina=90&__element=paginazione,"Mon, 27 Nov 2017 02:00:00 +0200"
1790552,MINISTERO DELL'ISTRUZIONE DELL'UNIVERSITA' E DELLA RICERCA,Varie,2017-11-27,07/12/2017,1300.00,"FORNITURA LOTTO 4 – MATERIALE FOTOGRAFICO PER PROGETTO “ATELIER CREATIVI”, bando numero: 1790552",https://www.acquistinretepa.it/opencms/opencms/main/impresa/strumenti/dettaglio.jsp?idT=1790552&tipoVis=descr&nome=FORNITURA+LOTTO+4+%3F+MATERIALE+FOTOGRAFICO+PER+PROGETTO+%3FATELIER+CREATIVI%3F&frompage=rdoAperte.jsp&orderBy=pubblicazione&sort=desc&__pagina=90&__element=paginazione,"Mon, 27 Nov 2017 02:00:00 +0200"
1790511,MINISTERO DELL'INTERNO,Varie,2017-11-27,12/01/2018,5200.00,"Fornitura di un servizio di assistenza software per il Laboratorio di Automotive del Servizio Polizia Stradale, bando numero: 1790511",https://www.acquistinretepa.it/opencms/opencms/main/impresa/strumenti/dettaglio.jsp?idT=1790511&tipoVis=descr&nome=Fornitura+di+un+servizio+di+assistenza+software+per+il+Laboratorio+di+Automotive+del+Servizio+Polizia+Stradale&frompage=rdoAperte.jsp&orderBy=pubblicazione&sort=desc&__pagina=90&__element=paginazione,"Mon, 27 Nov 2017 02:00:00 +0200"
1788662,AZIENDA OSPEDALIERA UNIVERSITARIA G. MARTINO DI MESSINA,Varie,2017-11-27,11/12/2017,2950.00,"Acquisto materiale consumabile per la diagnosi del cortisolo salivare/urinario, bando numero: 1788662",https://www.acquistinretepa.it/opencms/opencms/main/impresa/strumenti/dettaglio.jsp?idT=1788662&tipoVis=descr&nome=Acquisto+materiale+consumabile+per+la+diagnosi+del+cortisolo+salivare%2Furinario&frompage=rdoAperte.jsp&orderBy=pubblicazione&sort=desc&__pagina=90&__element=paginazione,"Mon, 27 Nov 2017 02:00:00 +0200"
1774314,MINISTERO DELLE INFRASTRUTTURE E DEI TRASPORTI,Varie,2017-11-27,06/12/2017,3600.00,"N. 40 (QUARANTA) ROTOLI ETICHETTE DYMO CODICE 11352 PER PROTOCOLLO INFORMATICO, bando numero: 1774314",https://www.acquistinretepa.it/opencms/opencms/main/impresa/strumenti/dettaglio.jsp?idT=1774314&tipoVis=descr&nome=N.+40+%28QUARANTA%29+ROTOLI+ETICHETTE+DYMO+CODICE+11352+PER+PROTOCOLLO+INFORMATICO&frompage=rdoAperte.jsp&orderBy=pubblicazione&sort=desc&__pagina=90&__element=paginazione,"Mon, 27 Nov 2017 02:00:00 +0200"
1790184,MINISTERO DELLE INFRASTRUTTURE E DEI TRASPORTI,Varie,2017-11-27,06/12/2017,3600.00,"N. 12 OROLOGI PER ATTIVITÀ SPORTIVA OUTDOOR DOTATI DI GPS GARMIN FENIX 3, bando numero: 1790184",https://www.acquistinretepa.it/opencms/opencms/main/impresa/strumenti/dettaglio.jsp?idT=1790184&tipoVis=descr&nome=N.+12+OROLOGI+PER+ATTIVIT%C0+SPORTIVA+OUTDOOR+DOTATI+DI+GPS+GARMIN+FENIX+3&frompage=rdoAperte.jsp&orderBy=pubblicazione&sort=desc&__pagina=90&__element=paginazione,"Mon, 27 Nov 2017 02:00:00 +0200"
1790295,MINISTERO DELL'INTERNO,Varie,2017-11-27,06/12/2017,15041.00,"Manutenzione licenze Adobe Altova, bando numero: 1790295",https://www.acquistinretepa.it/opencms/opencms/main/impresa/strumenti/dettaglio.jsp?idT=1790295&tipoVis=descr&nome=Manutenzione+licenze+Adobe+Altova&frompage=rdoAperte.jsp&orderBy=pubblicazione&sort=desc&__pagina=90&__element=paginazione,"Mon, 27 Nov 2017 02:00:00 +0200"
1790474,UNIVERSITA' PER STRANIERI DI PERUGIA,Varie,2017-11-27,11/12/2017,28000.00,"Rdo Surface Hub 84, bando numero: 1790474",https://www.acquistinretepa.it/opencms/opencms/main/impresa/strumenti/dettaglio.jsp?idT=1790474&tipoVis=descr&nome=Rdo+Surface+Hub+84&frompage=rdoAperte.jsp&orderBy=pubblicazione&sort=desc&__pagina=90&__element=paginazione,"Mon, 27 Nov 2017 02:00:00 +0200"
1787494,MINISTERO DELLA DIFESA,Varie,2017-11-27,06/12/2017,2049.18,"DPI 131^ Sq. R.R., bando numero: 1787494",https://www.acquistinretepa.it/opencms/opencms/main/impresa/strumenti/dettaglio.jsp?idT=1787494&tipoVis=descr&nome=DPI+131%5E+Sq.+R.R.&frompage=rdoAperte.jsp&orderBy=pubblicazione&sort=desc&__pagina=90&__element=paginazione,"Mon, 27 Nov 2017 02:00:00 +0200"
1787617,MINISTERO DELLA DIFESA,Varie,2017-11-27,06/12/2017,409.83,"MATERIALE PULIZIE 131^ Sq. R.R., bando numero: 1787617",https://www.acquistinretepa.it/opencms/opencms/main/impresa/strumenti/dettaglio.jsp?idT=1787617&tipoVis=descr&nome=MATERIALE+PULIZIE+131%5E+Sq.+R.R.&frompage=rdoAperte.jsp&orderBy=pubblicazione&sort=desc&__pagina=90&__element=paginazione,"Mon, 27 Nov 2017 02:00:00 +0200"
1781809,UNIVERSITA' DEGLI STUDI DI ROMA LA SAPIENZA,Varie,2017-11-27,11/12/2017,310.00,"Acquisto pubblicazioni Biblioteca DIAG  Nardi (Didattica), bando numero: 1781809",https://www.acquistinretepa.it/opencms/opencms/main/impresa/strumenti/dettaglio.jsp?idT=1781809&tipoVis=descr&nome=Acquisto+pubblicazioni+Biblioteca+DIAG++Nardi+%28Didattica%29&frompage=rdoAperte.jsp&orderBy=pubblicazione&sort=desc&__pagina=91&__element=paginazione,"Mon, 27 Nov 2017 02:00:00 +0200"
1789055,AZIENDA OSPEDALIERA OSPEDALI RIUNITI VILLA SOFIA-CERVELLO,Varie,2017-11-27,11/12/2017,92425.00,"Fornitura di tamponi nasali ed auricolari, bando numero: 1789055",https://www.acquistinretepa.it/opencms/opencms/main/impresa/strumenti/dettaglio.jsp?idT=1789055&tipoVis=descr&nome=Fornitura+di+tamponi+nasali+ed+auricolari&frompage=rdoAperte.jsp&orderBy=pubblicazione&sort=desc&__pagina=91&__element=paginazione,"Mon, 27 Nov 2017 02:00:00 +0200"
1790392,MINISTERO DELL'INTERNO,Varie,2017-11-27,11/12/2017,500.00,"Fornitura di n.1 batteria ricaricabile per defibrillatore Saver One Ami Italia e N.1 Set di rianimazione, bando numero: 1790392",https://www.acquistinretepa.it/opencms/opencms/main/impresa/strumenti/dettaglio.jsp?idT=1790392&tipoVis=descr&nome=Fornitura+di+n.1+batteria+ricaricabile+per+defibrillatore+Saver+One+Ami+Italia+e+N.1+Set+di+rianimazione&frompage=rdoAperte.jsp&orderBy=pubblicazione&sort=desc&__pagina=91&__element=paginazione,"Mon, 27 Nov 2017 02:00:00 +0200"
1790402,AZIENDA OSPEDALIERA CITTA' DELLA SALUTE E DELLA SCIENZA DI TORINO,Varie,2017-11-27,06/12/2017,82500.00,"FORNITURA IN URGENZA DI N° 1 FACOVITRECTOMO E RELATIVO MATERIALE DI CONSUMO - REF.:M.PIA STURARO_TEL. 011/633.3091_msturaro@cittadellasalute.to.it, bando numero: 1790402",https://www.acquistinretepa.it/opencms/opencms/main/impresa/strumenti/dettaglio.jsp?idT=1790402&tipoVis=descr&nome=FORNITURA+IN+URGENZA+DI+N%B0+1+FACOVITRECTOMO+E+RELATIVO+MATERIALE+DI+CONSUMO+-+REF.%3AM.PIA+STURARO_TEL.+011%2F633.3091_msturaro%40cittadellasalute.to.it&frompage=rdoAperte.jsp&orderBy=pubblicazione&sort=desc&__pagina=91&__element=paginazione,"Mon, 27 Nov 2017 02:00:00 +0200"
1790304,AZIENDA SANITARIA PROVINCIALE DI CALTANISSETTA,Varie,2017-11-27,07/12/2017,20491.80,"FORNITURA POLTRONA ODONTOIATRICA POLIAMBULATORIO DI GELA, bando numero: 1790304",https://www.acquistinretepa.it/opencms/opencms/main/impresa/strumenti/dettaglio.jsp?idT=1790304&tipoVis=descr&nome=FORNITURA+POLTRONA+ODONTOIATRICA+POLIAMBULATORIO+DI+GELA&frompage=rdoAperte.jsp&orderBy=pubblicazione&sort=desc&__pagina=91&__element=paginazione,"Mon, 27 Nov 2017 02:00:00 +0200"
1790296,MINISTERO DELL'INTERNO,Varie,2017-11-27,11/12/2017,500.00,"Fornitura di asciugamani, bando numero: 1790296",https://www.acquistinretepa.it/opencms/opencms/main/impresa/strumenti/dettaglio.jsp?idT=1790296&tipoVis=descr&nome=Fornitura+di+asciugamani&frompage=rdoAperte.jsp&orderBy=pubblicazione&sort=desc&__pagina=91&__element=paginazione,"Mon, 27 Nov 2017 02:00:00 +0200"
1790277,AZIENDA SANITARIA PROVINCIALE DI CATANIA,Varie,2017-11-27,21/12/2017,135273.41,"Procedura di gara per la realizzazione di un Sistema di Accoglienza e segnaletica presso il PO di Caltagirone, bando numero: 1790277",https://www.acquistinretepa.it/opencms/opencms/main/impresa/strumenti/dettaglio.jsp?idT=1790277&tipoVis=descr&nome=Procedura+di+gara+per+la+realizzazione+di+un+Sistema+di+Accoglienza+e+segnaletica+presso+il+PO+di+Caltagirone&frompage=rdoAperte.jsp&orderBy=pubblicazione&sort=desc&__pagina=91&__element=paginazione,"Mon, 27 Nov 2017 02:00:00 +0200"
1782816,COMUNE DI PRIVERNO,Varie,2017-11-27,18/12/2017,70000.00,"AFFIDAMENTO DEL SERVIZIO DI TESORERIA COMUNALE, bando numero: 1782816",https://www.acquistinretepa.it/opencms/opencms/main/impresa/strumenti/dettaglio.jsp?idT=1782816&tipoVis=descr&nome=AFFIDAMENTO+DEL+SERVIZIO+DI+TESORERIA+COMUNALE&frompage=rdoAperte.jsp&orderBy=pubblicazione&sort=desc&__pagina=91&__element=paginazione,"Mon, 27 Nov 2017 02:00:00 +0200"
1788625,MINISTERO DELLO SVILUPPO ECONOMICO,Varie,2017-11-24,07/12/2017,35000.00,"Acquisto di materiale di consumo per apparati copia-stampa, bando numero: 1788625",https://www.acquistinretepa.it/opencms/opencms/main/impresa/strumenti/dettaglio.jsp?idT=1788625&tipoVis=descr&nome=Acquisto+di+materiale+di+consumo+per+apparati+copia-stampa&frompage=rdoAperte.jsp&orderBy=pubblicazione&sort=desc&__pagina=91&__element=paginazione,"Fri, 24 Nov 2017 02:00:00 +0200"
1788544,POLITECNICO DI TORINO,Varie,2017-11-24,13/12/2017,66090.00,"Procedura negoziata sotto soglia comunitaria, ai sensi dell’art. 36, comma 2, lett. B del D. Lgs. 50/2016, per l’affidamento della fornitura di oscilloscopi digitali, generatori di segnali e alimentatori per il Dipartimento di Elettronica e Telecomunicazioni - DET, bando numero: 1788544",https://www.acquistinretepa.it/opencms/opencms/main/impresa/strumenti/dettaglio.jsp?idT=1788544&tipoVis=descr&nome=Procedura+negoziata+sotto+soglia+comunitaria%2C+ai+sensi+dell%3Fart.+36%2C+comma+2%2C+lett.+B+del+D.+Lgs.+50%2F2016%2C+per+l%3Faffidamento+della+fornitura+di+oscilloscopi+digitali%2C+generatori+di+segnali+e+alimentatori+per+il+Dipartimento+di+Elettronica+e+Telecomunicazioni+-+DET&frompage=rdoAperte.jsp&orderBy=pubblicazione&sort=desc&__pagina=91&__element=paginazione,"Fri, 24 Nov 2017 02:00:00 +0200"
1788480,POLITECNICO DI TORINO,Varie,2017-11-24,11/12/2017,67900.00,"Politecnico di Torino Amministrazione Centrale - Procedura negoziata sotto soglia comunitaria, ai sensi dell’art. 36, comma 2, lett. B del D. Lgs. 50/2016, per l’affidamento della fornitura di PC Desktop e Monitor per il laboratorio del dipartimento di Elettronica e Telecomunicazioni - DET, bando numero: 1788480",https://www.acquistinretepa.it/opencms/opencms/main/impresa/strumenti/dettaglio.jsp?idT=1788480&tipoVis=descr&nome=Politecnico+di+Torino+Amministrazione+Centrale+-+Procedura+negoziata+sotto+soglia+comunitaria%2C+ai+sensi+dell%3Fart.+36%2C+comma+2%2C+lett.+B+del+D.+Lgs.+50%2F2016%2C+per+l%3Faffidamento+della+fornitura+di+PC+Desktop+e+Monitor+per+il+laboratorio+del+dipartimento+di+Elettronica+e+Telecomunicazioni+-+DET&frompage=rdoAperte.jsp&orderBy=pubblicazione&sort=desc&__pagina=92&__element=paginazione,"Fri, 24 Nov 2017 02:00:00 +0200"
1774286,AZIENDA SANITARIA PROVINCIALE DI COSENZA,Varie,2017-11-24,15/12/2017,20000.00,"MATERIALE ODONTOIATRICO (LOTTO UNICO), bando numero: 1774286",https://www.acquistinretepa.it/opencms/opencms/main/impresa/strumenti/dettaglio.jsp?idT=1774286&tipoVis=descr&nome=MATERIALE+ODONTOIATRICO+%28LOTTO+UNICO%29&frompage=rdoAperte.jsp&orderBy=pubblicazione&sort=desc&__pagina=92&__element=paginazione,"Fri, 24 Nov 2017 02:00:00 +0200"
1783384,ASL SALERNO,Varie,2017-11-24,12/12/2017,9500.00,"Acquisto ventiilatori polmonari bilevel per assistiti DSB 68, bando numero: 1783384",https://www.acquistinretepa.it/opencms/opencms/main/impresa/strumenti/dettaglio.jsp?idT=1783384&tipoVis=descr&nome=Acquisto+ventiilatori+polmonari+bilevel+per+assistiti+DSB+68&frompage=rdoAperte.jsp&orderBy=pubblicazione&sort=desc&__pagina=92&__element=paginazione,"Fri, 24 Nov 2017 02:00:00 +0200"
1789825,C.N.R. CONSIGLIO NAZIONALE DELLE RICERCHE,Varie,2017-11-24,06/12/2017,231.00,"Generatore e amplificatore di radiofrequenza, bando numero: 1789825",https://www.acquistinretepa.it/opencms/opencms/main/impresa/strumenti/dettaglio.jsp?idT=1789825&tipoVis=descr&nome=Generatore+e+amplificatore+di+radiofrequenza&frompage=rdoAperte.jsp&orderBy=pubblicazione&sort=desc&__pagina=92&__element=paginazione,"Fri, 24 Nov 2017 02:00:00 +0200"
1789126,ARPA - LOMBARDIA,Varie,2017-11-24,13/12/2017,9000.00,"N. 1 Sonda telescopica con accessori per ispezioni condotte interrate - UO APC Dip. Bs Mn - Ferrari, bando numero: 1789126",https://www.acquistinretepa.it/opencms/opencms/main/impresa/strumenti/dettaglio.jsp?idT=1789126&tipoVis=descr&nome=N.+1+Sonda+telescopica+con+accessori+per+ispezioni+condotte+interrate+-+UO+APC+Dip.+Bs+Mn+-+Ferrari&frompage=rdoAperte.jsp&orderBy=pubblicazione&sort=desc&__pagina=92&__element=paginazione,"Fri, 24 Nov 2017 02:00:00 +0200"
1784540,AZIENDA PUBBLICA DI SERVIZI ALLA PERSONA CITTÃ  DI PIACENZA,Varie,2017-11-24,07/12/2017,2700.00,"Fornitura snack salati per Bar interno ASP Città di Piacenza (spese di consegna comprese) per anni 2, bando numero: 1784540",https://www.acquistinretepa.it/opencms/opencms/main/impresa/strumenti/dettaglio.jsp?idT=1784540&tipoVis=descr&nome=Fornitura+snack+salati+per+Bar+interno+ASP+Citt%E0+di+Piacenza+%28spese+di+consegna+comprese%29+per+anni+2&frompage=rdoAperte.jsp&orderBy=pubblicazione&sort=desc&__pagina=92&__element=paginazione,"Fri, 24 Nov 2017 02:00:00 +0200"
1786107,UNIVERSITA' DEGLI STUDI DI TORINO,Varie,2017-11-24,11/12/2017,35000.00,"Manutenzione correttiva, evolutiva e adeguativa di siti tematici, bando numero: 1786107",https://www.acquistinretepa.it/opencms/opencms/main/impresa/strumenti/dettaglio.jsp?idT=1786107&tipoVis=descr&nome=Manutenzione+correttiva%2C+evolutiva+e+adeguativa+di+siti+tematici&frompage=rdoAperte.jsp&orderBy=pubblicazione&sort=desc&__pagina=92&__element=paginazione,"Fri, 24 Nov 2017 02:00:00 +0200"
1789613,COMUNE DI MARINO,Varie,2017-11-24,13/12/2017,39600.00,"INDIZIONE DI GARA TELEMATICA RDO PER  CONFERIMENTO DELL’INCARICO AI SOGGETTI ESTERNI PER L'ESECUZIONE DEL SERVIZIO POSTALE PER LA CORRISPONDENZA DEL COMUNE DI MARINO, bando numero: 1789613",https://www.acquistinretepa.it/opencms/opencms/main/impresa/strumenti/dettaglio.jsp?idT=1789613&tipoVis=descr&nome=INDIZIONE+DI+GARA+TELEMATICA+RDO+PER++CONFERIMENTO+DELL%3FINCARICO+AI+SOGGETTI+ESTERNI+PER+L%27ESECUZIONE+DEL+SERVIZIO+POSTALE+PER+LA+CORRISPONDENZA+DEL+COMUNE+DI+MARINO&frompage=rdoAperte.jsp&orderBy=pubblicazione&sort=desc&__pagina=92&__element=paginazione,"Fri, 24 Nov 2017 02:00:00 +0200"
1789567,AZIENDA OSPEDALIERA SANTOBONO PAUSILIPON NAPOLI,Varie,2017-11-24,11/12/2017,1000.00,"SCANNER, bando numero: 1789567",https://www.acquistinretepa.it/opencms/opencms/main/impresa/strumenti/dettaglio.jsp?idT=1789567&tipoVis=descr&nome=SCANNER&frompage=rdoAperte.jsp&orderBy=pubblicazione&sort=desc&__pagina=92&__element=paginazione,"Fri, 24 Nov 2017 02:00:00 +0200"
1788149,AEEG - AUTORITA' PER L'ENERGIA ELETTRICA ED IL GAS,Varie,2017-11-24,21/12/2017,13250.00,"Servizio di data entry relativo ai reclami idrici a supporto della Direzione Tutela Utenti dei Servizi Ambientali dell’Autorità, bando numero: 1788149",https://www.acquistinretepa.it/opencms/opencms/main/impresa/strumenti/dettaglio.jsp?idT=1788149&tipoVis=descr&nome=Servizio+di+data+entry+relativo+ai+reclami+idrici+a+supporto+della+Direzione+Tutela+Utenti+dei+Servizi+Ambientali+dell%3FAutorit%E0&frompage=rdoAperte.jsp&orderBy=pubblicazione&sort=desc&__pagina=92&__element=paginazione,"Fri, 24 Nov 2017 02:00:00 +0200"
1789198,ASL 4 Teramo,Varie,2017-11-24,10/01/2018,75000.00,"Procedura negoziata ex art. 36 c. 2 lett. b) D. Lgs. 50/2016 per l'affidamento della fornitura di lampade scialitiche per le esigenze del Blocco Operatorio dei PP.OO. di Teramo e Giulianova, bando numero: 1789198",https://www.acquistinretepa.it/opencms/opencms/main/impresa/strumenti/dettaglio.jsp?idT=1789198&tipoVis=descr&nome=Procedura+negoziata+ex+art.+36+c.+2+lett.+b%29+D.+Lgs.+50%2F2016+per+l%27affidamento+della+fornitura+di+lampade+scialitiche+per+le+esigenze+del+Blocco+Operatorio+dei+PP.OO.+di+Teramo+e+Giulianova&frompage=rdoAperte.jsp&orderBy=pubblicazione&sort=desc&__pagina=93&__element=paginazione,"Fri, 24 Nov 2017 02:00:00 +0200"
1789520,UNIVERSITA' DEGLI STUDI MAGNA GRAECIA DI CATANZARO,Varie,2017-11-24,15/12/2017,35000.00,"FORNITURA SEMESTRALE DI GAS TECNICI COMPRESSI E LIQUEFATTI, bando numero: 1789520",https://www.acquistinretepa.it/opencms/opencms/main/impresa/strumenti/dettaglio.jsp?idT=1789520&tipoVis=descr&nome=FORNITURA+SEMESTRALE+DI+GAS+TECNICI+COMPRESSI+E+LIQUEFATTI&frompage=rdoAperte.jsp&orderBy=pubblicazione&sort=desc&__pagina=93&__element=paginazione,"Fri, 24 Nov 2017 02:00:00 +0200"
1778089,POLITECNICO DI MILANO,Varie,2017-11-24,15/12/2017,199900.00,"FORNITURA DI APPARATI ALLIED TELESIS PER PROGETTI RELATIVI AD EDIFICI DEL POLITECNICO E SOSTITUZIONE APPARATI GUASTI/OBSOLETI  RDA 5730 - LER, bando numero: 1778089",https://www.acquistinretepa.it/opencms/opencms/main/impresa/strumenti/dettaglio.jsp?idT=1778089&tipoVis=descr&nome=FORNITURA+DI+APPARATI+ALLIED+TELESIS+PER+PROGETTI+RELATIVI+AD+EDIFICI+DEL+POLITECNICO+E+SOSTITUZIONE+APPARATI+GUASTI%2FOBSOLETI++RDA+5730+-+LER&frompage=rdoAperte.jsp&orderBy=pubblicazione&sort=desc&__pagina=93&__element=paginazione,"Fri, 24 Nov 2017 02:00:00 +0200"
1789461,COMUNE DI TRAPANI,Lavori di manutenzione,2017-11-24,06/12/2017,36029.28,"Lavori edili di tamponatura ed apertura loculi cimiteriali dipendenti da colombari comunali anno 2018, bando numero: 1789461",https://www.acquistinretepa.it/opencms/opencms/main/impresa/strumenti/dettaglio.jsp?idT=1789461&tipoVis=descr&nome=Lavori+edili+di+tamponatura+ed+apertura+loculi+cimiteriali+dipendenti+da+colombari+comunali+anno+2018&frompage=rdoAperte.jsp&orderBy=pubblicazione&sort=desc&__pagina=93&__element=paginazione,"Fri, 24 Nov 2017 02:00:00 +0200"
1787469,MINISTERO DELLA DIFESA,Varie,2017-11-24,06/12/2017,480.91,"Fornitura generi di consumo in occasione festa madonna di Loreto e auguri di Natale e Capodanno., bando numero: 1787469",https://www.acquistinretepa.it/opencms/opencms/main/impresa/strumenti/dettaglio.jsp?idT=1787469&tipoVis=descr&nome=Fornitura+generi+di+consumo+in+occasione+festa+madonna+di+Loreto+e+auguri+di+Natale+e+Capodanno.&frompage=rdoAperte.jsp&orderBy=pubblicazione&sort=desc&__pagina=93&__element=paginazione,"Fri, 24 Nov 2017 02:00:00 +0200"
1780623,AZIENDA OSPEDALIERA DI RILIEVO NAZIONALE E DI ALTA SPECIALIZZAZIONE - CIVICO BENFRATELLI DI CRISTINA PALERMO,Varie,2017-11-24,12/12/2017,37183.28,"FORNITURA DI FARMACI NON PRESENTI NELLA GARA REGIONALE, bando numero: 1780623",https://www.acquistinretepa.it/opencms/opencms/main/impresa/strumenti/dettaglio.jsp?idT=1780623&tipoVis=descr&nome=FORNITURA+DI+FARMACI+NON+PRESENTI+NELLA+GARA+REGIONALE&frompage=rdoAperte.jsp&orderBy=pubblicazione&sort=desc&__pagina=93&__element=paginazione,"Fri, 24 Nov 2017 02:00:00 +0200"
1787511,AZIENDA SANITARIA PROVINCIALE DI TRAPANI,Varie,2017-11-24,12/12/2017,14000.00,"Acquisto garza tagliata non sterile in compresse di puro cotone da 1 kg, bando numero: 1787511",https://www.acquistinretepa.it/opencms/opencms/main/impresa/strumenti/dettaglio.jsp?idT=1787511&tipoVis=descr&nome=Acquisto+garza+tagliata+non+sterile+in+compresse+di+puro+cotone+da+1+kg&frompage=rdoAperte.jsp&orderBy=pubblicazione&sort=desc&__pagina=93&__element=paginazione,"Fri, 24 Nov 2017 02:00:00 +0200"
1785145,C.N.R. CONSIGLIO NAZIONALE DELLE RICERCHE,Varie,2017-11-24,10/12/2017,1950.00,"Tablet per gestione dei sistemi di previsione in remoto - SOS Piattaforme, bando numero: 1785145",https://www.acquistinretepa.it/opencms/opencms/main/impresa/strumenti/dettaglio.jsp?idT=1785145&tipoVis=descr&nome=Tablet+per+gestione+dei+sistemi+di+previsione+in+remoto+-+SOS+Piattaforme&frompage=rdoAperte.jsp&orderBy=pubblicazione&sort=desc&__pagina=93&__element=paginazione,"Fri, 24 Nov 2017 02:00:00 +0200"
