numero,enteCommittente,categoria,pubblicazione,scadenza,valore:number,descrizione,url,datarss
1911093,FONDAZIONE ISTITUTO G.GIGLIO DI CEFALU',Varie,2018-03-28,18/04/2018,4250.00,"Dispositivi vari per l'U.O. di Ostetricia e Ginecologia, bando numero: 1911093",https://www.acquistinretepa.it/opencms/opencms/main/impresa/strumenti/dettaglio.jsp?idT=1911093&tipoVis=descr&nome=Dispositivi+vari+per+l%27U.O.+di+Ostetricia+e+Ginecologia&frompage=rdoAperte.jsp&orderBy=pubblicazione&sort=desc&__pagina=20&__element=paginazione,"Wed, 28 Mar 2018 02:00:00 +0200"
1911302,AZIENDA OSPEDALIERA PUGLIESE CIACCIO CATANZARO,Varie,2018-03-28,18/04/2018,9400.00,"ARREDI PER SERVIZIO PSICHIATRICO E CURA, bando numero: 1911302",https://www.acquistinretepa.it/opencms/opencms/main/impresa/strumenti/dettaglio.jsp?idT=1911302&tipoVis=descr&nome=ARREDI+PER+SERVIZIO+PSICHIATRICO+E+CURA&frompage=rdoAperte.jsp&orderBy=pubblicazione&sort=desc&__pagina=21&__element=paginazione,"Wed, 28 Mar 2018 02:00:00 +0200"
1911314,POLITECNICO DI TORINO,Varie,2018-03-28,05/04/2018,5000.00,"POLITO/DIMEAS/eM fornitura centralina di controllo, bando numero: 1911314",https://www.acquistinretepa.it/opencms/opencms/main/impresa/strumenti/dettaglio.jsp?idT=1911314&tipoVis=descr&nome=POLITO%2FDIMEAS%2FeM+fornitura+centralina+di+controllo&frompage=rdoAperte.jsp&orderBy=pubblicazione&sort=desc&__pagina=21&__element=paginazione,"Wed, 28 Mar 2018 02:00:00 +0200"
1906923,COMUNE DI PUTIGNANO,2,2018-03-28,16/04/2018,175000.00,"Servizio di corrispondenza postale, bando numero: 1906923",https://www.acquistinretepa.it/opencms/opencms/main/impresa/strumenti/dettaglio.jsp?idT=1906923&tipoVis=descr&nome=Servizio+di+corrispondenza+postale&frompage=rdoAperte.jsp&orderBy=pubblicazione&sort=desc&__pagina=21&__element=paginazione,"Wed, 28 Mar 2018 02:00:00 +0200"
1909983,AZIENDA OSPEDALIERA SAN CAMILLO FORLANINI ROMA,2,2018-03-28,20/04/2018,13000.00,"Affidamento per il periodo di 12 mesi del servizio di assistenza del sistema di elaborazione, gestione e archiviazione di immagini in standard DICOM angiografiche indetto dall’Azienda Ospedaliera San Camillo – Forlanini, bando numero: 1909983",https://www.acquistinretepa.it/opencms/opencms/main/impresa/strumenti/dettaglio.jsp?idT=1909983&tipoVis=descr&nome=Affidamento+per+il+periodo+di+12+mesi+del+servizio+di+assistenza+del+sistema+di+elaborazione%2C+gestione+e+archiviazione+di+immagini+in+standard+DICOM+angiografiche+indetto+dall%3FAzienda+Ospedaliera+San+Camillo+%3F+Forlanini&frompage=rdoAperte.jsp&orderBy=pubblicazione&sort=desc&__pagina=21&__element=paginazione,"Wed, 28 Mar 2018 02:00:00 +0200"
1909966,AZIENDA OSPEDALIERA SAN CAMILLO FORLANINI ROMA,2,2018-03-28,20/04/2018,22000.00,"Affidamento per il periodo di 12 del servizio di assistenza del sistema DNLAB per le esigenze della U.O.C. Microbiologia e Virologia dell’Azienda Ospedaliera San Camillo Forlanini., bando numero: 1909966",https://www.acquistinretepa.it/opencms/opencms/main/impresa/strumenti/dettaglio.jsp?idT=1909966&tipoVis=descr&nome=Affidamento+per+il+periodo+di+12+del+servizio+di+assistenza+del+sistema+DNLAB+per+le+esigenze+della+U.O.C.+Microbiologia+e+Virologia+dell%3FAzienda+Ospedaliera+San+Camillo+Forlanini.&frompage=rdoAperte.jsp&orderBy=pubblicazione&sort=desc&__pagina=21&__element=paginazione,"Wed, 28 Mar 2018 02:00:00 +0200"
1909991,AZIENDA OSPEDALIERA SAN CAMILLO FORLANINI ROMA,2,2018-03-28,20/04/2018,22000.00,"Affidamento per il periodo di 12 mesi del servizio assistenza della cartella clinica nefrologica e monitoraggio dialisi per l’Azienda Ospedaliera San Camillo Forlanini., bando numero: 1909991",https://www.acquistinretepa.it/opencms/opencms/main/impresa/strumenti/dettaglio.jsp?idT=1909991&tipoVis=descr&nome=Affidamento+per+il+periodo+di+12+mesi+del+servizio+assistenza+della+cartella+clinica+nefrologica+e+monitoraggio+dialisi+per+l%3FAzienda+Ospedaliera+San+Camillo+Forlanini.&frompage=rdoAperte.jsp&orderBy=pubblicazione&sort=desc&__pagina=21&__element=paginazione,"Wed, 28 Mar 2018 02:00:00 +0200"
1911247,C.N.R. CONSIGLIO NAZIONALE DELLE RICERCHE,Varie,2018-03-28,04/04/2018,8000.00,"LICENZE PERPETUE DI TIPO ACCADEMICOa, bando numero: 1911247",https://www.acquistinretepa.it/opencms/opencms/main/impresa/strumenti/dettaglio.jsp?idT=1911247&tipoVis=descr&nome=LICENZE+PERPETUE+DI+TIPO+ACCADEMICOa&frompage=rdoAperte.jsp&orderBy=pubblicazione&sort=desc&__pagina=21&__element=paginazione,"Wed, 28 Mar 2018 02:00:00 +0200"
1909864,MINISTERO DELLA GIUSTIZIA,Varie,2018-03-28,16/04/2018,135000.00,"FORNITURA SWITCH FIBER CHANNEL E RELATIVI SERVIZI PRESSO IL CED NAZIONALE DI ROMA BALDUINA, bando numero: 1909864",https://www.acquistinretepa.it/opencms/opencms/main/impresa/strumenti/dettaglio.jsp?idT=1909864&tipoVis=descr&nome=FORNITURA+SWITCH+FIBER+CHANNEL+E+RELATIVI+SERVIZI+PRESSO+IL+CED+NAZIONALE+DI+ROMA+BALDUINA&frompage=rdoAperte.jsp&orderBy=pubblicazione&sort=desc&__pagina=21&__element=paginazione,"Wed, 28 Mar 2018 02:00:00 +0200"
1911280,AZIENDA OSPEDALIERA PUGLIESE CIACCIO CATANZARO,Varie,2018-03-28,18/04/2018,2500.00,"ASPIRATORE CHIRURGICO PER CARDIOLOGIA UTIC, bando numero: 1911280",https://www.acquistinretepa.it/opencms/opencms/main/impresa/strumenti/dettaglio.jsp?idT=1911280&tipoVis=descr&nome=ASPIRATORE+CHIRURGICO+PER+CARDIOLOGIA+UTIC&frompage=rdoAperte.jsp&orderBy=pubblicazione&sort=desc&__pagina=21&__element=paginazione,"Wed, 28 Mar 2018 02:00:00 +0200"
1907339,COMUNE DI QUARTU SANT'ELENA,2,2018-03-28,16/04/2018,121950.82,"GESTIONE DEI SERVIZI CIMITERIALI NEL CIMITERO DEL COMUNE DI QUARTU SANT'ELENA, bando numero: 1907339",https://www.acquistinretepa.it/opencms/opencms/main/impresa/strumenti/dettaglio.jsp?idT=1907339&tipoVis=descr&nome=GESTIONE+DEI+SERVIZI+CIMITERIALI+NEL+CIMITERO+DEL+COMUNE+DI+QUARTU+SANT%27ELENA&frompage=rdoAperte.jsp&orderBy=pubblicazione&sort=desc&__pagina=21&__element=paginazione,"Wed, 28 Mar 2018 02:00:00 +0200"
1908414,REGIONE AUTONOMA VALLE D'AOSTA,Varie,2018-03-28,13/04/2018,6500.00,"Fornitura di un’apparecchiatura tecnica specialistica necessaria per le attività di elaborazione immagini e ottimizzazione per la stampa e di layout e impaginazione ad uso del Centro fotocomposizione della Struttura organizzativa stato giuridico, formazione e servizi generali, bando numero: 1908414",https://www.acquistinretepa.it/opencms/opencms/main/impresa/strumenti/dettaglio.jsp?idT=1908414&tipoVis=descr&nome=Fornitura+di+un%3Fapparecchiatura+tecnica+specialistica+necessaria+per+le+attivit%E0+di+elaborazione+immagini+e+ottimizzazione+per+la+stampa+e+di+layout+e+impaginazione+ad+uso+del+Centro+fotocomposizione+della+Struttura+organizzativa+stato+giuridico%2C+formazione+e+servizi+generali&frompage=rdoAperte.jsp&orderBy=pubblicazione&sort=desc&__pagina=22&__element=paginazione,"Wed, 28 Mar 2018 02:00:00 +0200"
1911252,AZIENDA OSPEDALIERA PUGLIESE CIACCIO CATANZARO,2,2018-03-28,17/04/2018,5000.00,"N.2 CAMPIONATORI VOLUMETRICI SAS, bando numero: 1911252",https://www.acquistinretepa.it/opencms/opencms/main/impresa/strumenti/dettaglio.jsp?idT=1911252&tipoVis=descr&nome=N.2+CAMPIONATORI+VOLUMETRICI+SAS&frompage=rdoAperte.jsp&orderBy=pubblicazione&sort=desc&__pagina=22&__element=paginazione,"Wed, 28 Mar 2018 02:00:00 +0200"
1911139,AZIENDA PUBBLICA DI SERVIZI ALLA PERSONA CITTÃ  DI PIACENZA,Varie,2018-03-28,17/04/2018,34000.00,"Fornitura a corpo per anni 2 di prodotti freschi, surgelati e gelati per Bar interno dell'ASP Città di Piacenza, bando numero: 1911139",https://www.acquistinretepa.it/opencms/opencms/main/impresa/strumenti/dettaglio.jsp?idT=1911139&tipoVis=descr&nome=Fornitura+a+corpo+per+anni+2+di+prodotti+freschi%2C+surgelati+e+gelati+per+Bar+interno+dell%27ASP+Citt%E0+di+Piacenza&frompage=rdoAperte.jsp&orderBy=pubblicazione&sort=desc&__pagina=22&__element=paginazione,"Wed, 28 Mar 2018 02:00:00 +0200"
1911229,AZIENDA OSPEDALIERA PUGLIESE CIACCIO CATANZARO,Varie,2018-03-28,17/04/2018,2500.00,"BIOLUMINOMETRO, bando numero: 1911229",https://www.acquistinretepa.it/opencms/opencms/main/impresa/strumenti/dettaglio.jsp?idT=1911229&tipoVis=descr&nome=BIOLUMINOMETRO&frompage=rdoAperte.jsp&orderBy=pubblicazione&sort=desc&__pagina=22&__element=paginazione,"Wed, 28 Mar 2018 02:00:00 +0200"
1911061,POLITECNICO DI TORINO,Varie,2018-03-28,06/04/2018,7150.00,"D.E.T. POLITECNICO DI TORINO - CIG  ZF922F95CA - MATERIALE DI CONSUMO - FOAM BIADESIVO E MATRICE DI ELETTRODI SEMI-RIUTILIZZABILE, bando numero: 1911061",https://www.acquistinretepa.it/opencms/opencms/main/impresa/strumenti/dettaglio.jsp?idT=1911061&tipoVis=descr&nome=D.E.T.+POLITECNICO+DI+TORINO+-+CIG++ZF922F95CA+-+MATERIALE+DI+CONSUMO+-+FOAM+BIADESIVO+E+MATRICE+DI+ELETTRODI+SEMI-RIUTILIZZABILE&frompage=rdoAperte.jsp&orderBy=pubblicazione&sort=desc&__pagina=22&__element=paginazione,"Wed, 28 Mar 2018 02:00:00 +0200"
1911126,I.R.C.C.S. ISTITUTO NAZIONALE TUMORI FONDAZIONE PASCALE NAPOLI,Varie,2018-03-28,11/04/2018,2592.00,"AFFIDAMENTO DELLA FORNITURA, IN SOMM/NE ANNUA, DI 900 FIALE DEL P.A. NISTATINA OS SOSP DA 100 ML, bando numero: 1911126",https://www.acquistinretepa.it/opencms/opencms/main/impresa/strumenti/dettaglio.jsp?idT=1911126&tipoVis=descr&nome=AFFIDAMENTO+DELLA+FORNITURA%2C+IN+SOMM%2FNE+ANNUA%2C+DI+900+FIALE+DEL+P.A.+NISTATINA+OS+SOSP+DA+100+ML&frompage=rdoAperte.jsp&orderBy=pubblicazione&sort=desc&__pagina=22&__element=paginazione,"Wed, 28 Mar 2018 02:00:00 +0200"
1911197,AZIENDA OSPEDALIERA PUGLIESE CIACCIO CATANZARO,Varie,2018-03-28,17/04/2018,5000.00,"OCCHIALI OPERATORI DI INGRANDIMENTO, bando numero: 1911197",https://www.acquistinretepa.it/opencms/opencms/main/impresa/strumenti/dettaglio.jsp?idT=1911197&tipoVis=descr&nome=OCCHIALI+OPERATORI+DI+INGRANDIMENTO&frompage=rdoAperte.jsp&orderBy=pubblicazione&sort=desc&__pagina=22&__element=paginazione,"Wed, 28 Mar 2018 02:00:00 +0200"
1910371,AZIENDA OSPEDALIERA OSPEDALI RIUNITI MARCHE NORD,Varie,2018-03-28,13/04/2018,24590.17,"PROV/69 - TELEMETRIE (GIORGI), bando numero: 1910371",https://www.acquistinretepa.it/opencms/opencms/main/impresa/strumenti/dettaglio.jsp?idT=1910371&tipoVis=descr&nome=PROV%2F69+-+TELEMETRIE+%28GIORGI%29&frompage=rdoAperte.jsp&orderBy=pubblicazione&sort=desc&__pagina=22&__element=paginazione,"Wed, 28 Mar 2018 02:00:00 +0200"
1900041,ALSIA - AGENZIA LUCANA DI SVILUPPO E DI INNOVAZIONE IN AGRICOLTURA,Varie,2018-03-28,11/04/2018,13330.00,"Fornitura di kit per agricoltori e tecnici per la valutazione del suolo – Materiale Laboratorio., bando numero: 1900041",https://www.acquistinretepa.it/opencms/opencms/main/impresa/strumenti/dettaglio.jsp?idT=1900041&tipoVis=descr&nome=Fornitura+di+kit+per+agricoltori+e+tecnici+per+la+valutazione+del+suolo+%3F+Materiale+Laboratorio.&frompage=rdoAperte.jsp&orderBy=pubblicazione&sort=desc&__pagina=22&__element=paginazione,"Wed, 28 Mar 2018 02:00:00 +0200"
1897637,ALSIA - AGENZIA LUCANA DI SVILUPPO E DI INNOVAZIONE IN AGRICOLTURA,Varie,2018-03-28,11/04/2018,3500.00,"Fornitura di kit per agricoltori e tecnici per la valutazione del suolo – cancelleria e Consumo., bando numero: 1897637",https://www.acquistinretepa.it/opencms/opencms/main/impresa/strumenti/dettaglio.jsp?idT=1897637&tipoVis=descr&nome=Fornitura+di+kit+per+agricoltori+e+tecnici+per+la+valutazione+del+suolo+%3F+cancelleria+e+Consumo.&frompage=rdoAperte.jsp&orderBy=pubblicazione&sort=desc&__pagina=22&__element=paginazione,"Wed, 28 Mar 2018 02:00:00 +0200"
1911164,AZIENDA OSPEDALIERA PUGLIESE CIACCIO CATANZARO,Varie,2018-03-28,19/04/2018,25000.00,"N. 1 lavastrumenti per Blocco Operatorio, bando numero: 1911164",https://www.acquistinretepa.it/opencms/opencms/main/impresa/strumenti/dettaglio.jsp?idT=1911164&tipoVis=descr&nome=N.+1+lavastrumenti+per+Blocco+Operatorio&frompage=rdoAperte.jsp&orderBy=pubblicazione&sort=desc&__pagina=23&__element=paginazione,"Wed, 28 Mar 2018 02:00:00 +0200"
1910963,POLITECNICO DI TORINO,Varie,2018-03-28,20/04/2018,25000.00,"DET_POLITECNICO DI TORINO -CIG_ZC822F5C76- Fornitura di n. 6 armadi rack per sala server dipartimentale e realizzazione del corridoio caldo- DIP, bando numero: 1910963",https://www.acquistinretepa.it/opencms/opencms/main/impresa/strumenti/dettaglio.jsp?idT=1910963&tipoVis=descr&nome=DET_POLITECNICO+DI+TORINO+-CIG_ZC822F5C76-+Fornitura+di+n.+6+armadi+rack+per+sala+server+dipartimentale+e+realizzazione+del+corridoio+caldo-+DIP&frompage=rdoAperte.jsp&orderBy=pubblicazione&sort=desc&__pagina=23&__element=paginazione,"Wed, 28 Mar 2018 02:00:00 +0200"
1904038,C.N.R. CONSIGLIO NAZIONALE DELLE RICERCHE,2,2018-03-28,20/04/2018,5000.00,"PROLUNGAMENTO DEI CAMINI DI ESPULSIONE DELLE CAPPE CHIMICHE, bando numero: 1904038",https://www.acquistinretepa.it/opencms/opencms/main/impresa/strumenti/dettaglio.jsp?idT=1904038&tipoVis=descr&nome=PROLUNGAMENTO+DEI+CAMINI+DI+ESPULSIONE+DELLE+CAPPE+CHIMICHE&frompage=rdoAperte.jsp&orderBy=pubblicazione&sort=desc&__pagina=23&__element=paginazione,"Wed, 28 Mar 2018 02:00:00 +0200"
1911073,AZIENDA OSPEDALIERA PUGLIESE CIACCIO CATANZARO,Varie,2018-03-28,13/04/2018,3700.00,"N. 20 Paraventi a 3 sezioni - in tubolare d’alluminio montata su piedini, bando numero: 1911073",https://www.acquistinretepa.it/opencms/opencms/main/impresa/strumenti/dettaglio.jsp?idT=1911073&tipoVis=descr&nome=N.+20+Paraventi+a+3+sezioni+-+in+tubolare+d%3Falluminio+montata+su+piedini&frompage=rdoAperte.jsp&orderBy=pubblicazione&sort=desc&__pagina=23&__element=paginazione,"Wed, 28 Mar 2018 02:00:00 +0200"
1911110,MINISTERO DELLA DIFESA,Varie,2018-03-28,04/04/2018,4918.00,"ACQUISTO BOTTIGLIE DI ACQUA DA LT.1 E LT.2 - 2° ESPERIMENTO, bando numero: 1911110",https://www.acquistinretepa.it/opencms/opencms/main/impresa/strumenti/dettaglio.jsp?idT=1911110&tipoVis=descr&nome=ACQUISTO+BOTTIGLIE+DI+ACQUA+DA+LT.1+E+LT.2+-+2%B0+ESPERIMENTO&frompage=rdoAperte.jsp&orderBy=pubblicazione&sort=desc&__pagina=23&__element=paginazione,"Wed, 28 Mar 2018 02:00:00 +0200"
1910036,UNIVERSITA' DEGLI STUDI DI PALERMO,Varie,2018-03-28,09/04/2018,768.60,"Acquisto di Prodotti chimici Prof. Frenda, bando numero: 1910036",https://www.acquistinretepa.it/opencms/opencms/main/impresa/strumenti/dettaglio.jsp?idT=1910036&tipoVis=descr&nome=Acquisto+di+Prodotti+chimici+Prof.+Frenda&frompage=rdoAperte.jsp&orderBy=pubblicazione&sort=desc&__pagina=23&__element=paginazione,"Wed, 28 Mar 2018 02:00:00 +0200"
1909404,INRCA - OSPEDALE GERIATRICO U. SESTILI ANCONA,Varie,2018-03-28,16/04/2018,1800.00,"NOLEGGIO BIENNALE N. 1 NOTEBOOK E N. 1 MONITOR DIREZIONE SCIENTIFICA, bando numero: 1909404",https://www.acquistinretepa.it/opencms/opencms/main/impresa/strumenti/dettaglio.jsp?idT=1909404&tipoVis=descr&nome=NOLEGGIO+BIENNALE+N.+1+NOTEBOOK+E+N.+1+MONITOR+DIREZIONE+SCIENTIFICA&frompage=rdoAperte.jsp&orderBy=pubblicazione&sort=desc&__pagina=23&__element=paginazione,"Wed, 28 Mar 2018 02:00:00 +0200"
1910340,ASL NAPOLI 1 CENTRO,Varie,2018-03-28,10/04/2018,90800.00,"Fornitura annuale, in somministrazione di pellicole radiografiche tradizionali, mammografiche e liquidi di sviluppo e fissaggio ocorrenti per Strutture Sanitarie della A.S.L. Napoli 1 Centro, bando numero: 1910340",https://www.acquistinretepa.it/opencms/opencms/main/impresa/strumenti/dettaglio.jsp?idT=1910340&tipoVis=descr&nome=Fornitura+annuale%2C+in+somministrazione+di+pellicole+radiografiche+tradizionali%2C+mammografiche+e+liquidi+di+sviluppo+e+fissaggio+ocorrenti+per+Strutture+Sanitarie+della+A.S.L.+Napoli+1+Centro&frompage=rdoAperte.jsp&orderBy=pubblicazione&sort=desc&__pagina=23&__element=paginazione,"Wed, 28 Mar 2018 02:00:00 +0200"
1910381,AZIENDA OSPEDALIERA OSPEDALI RIUNITI MARCHE NORD,Varie,2018-03-28,18/04/2018,205000.00,"PROV/72 - ECOGRAFI (GIORGI), bando numero: 1910381",https://www.acquistinretepa.it/opencms/opencms/main/impresa/strumenti/dettaglio.jsp?idT=1910381&tipoVis=descr&nome=PROV%2F72+-+ECOGRAFI+%28GIORGI%29&frompage=rdoAperte.jsp&orderBy=pubblicazione&sort=desc&__pagina=23&__element=paginazione,"Wed, 28 Mar 2018 02:00:00 +0200"
1910767,AZIENDA SPECIALE DELLA CAMERA DI COMMERCIO DI BENEVENTO - VALISANNIO,2,2018-03-28,09/04/2018,39500.00,"Affidamento servizi area Camera di Commercio di Benevento CIBUS Parma  2018, bando numero: 1910767",https://www.acquistinretepa.it/opencms/opencms/main/impresa/strumenti/dettaglio.jsp?idT=1910767&tipoVis=descr&nome=Affidamento+servizi+area+Camera+di+Commercio+di+Benevento+CIBUS+Parma++2018&frompage=rdoAperte.jsp&orderBy=pubblicazione&sort=desc&__pagina=23&__element=paginazione,"Wed, 28 Mar 2018 02:00:00 +0200"
1897986,I.N.F.N. - ISTITUTO NAZIONALE DI FISICA NUCLEARE,2,2018-03-28,06/04/2018,600.00,"Fornitura di Corso di formazione ""Aukom 1"", bando numero: 1897986",https://www.acquistinretepa.it/opencms/opencms/main/impresa/strumenti/dettaglio.jsp?idT=1897986&tipoVis=descr&nome=Fornitura+di+Corso+di+formazione+%22Aukom+1%22&frompage=rdoAperte.jsp&orderBy=pubblicazione&sort=desc&__pagina=24&__element=paginazione,"Wed, 28 Mar 2018 02:00:00 +0200"
1910580,COMUNE DI MILANO,Varie,2018-03-28,06/04/2018,80.00,"CORONA D'ALLORO, bando numero: 1910580",https://www.acquistinretepa.it/opencms/opencms/main/impresa/strumenti/dettaglio.jsp?idT=1910580&tipoVis=descr&nome=CORONA+D%27ALLORO&frompage=rdoAperte.jsp&orderBy=pubblicazione&sort=desc&__pagina=24&__element=paginazione,"Wed, 28 Mar 2018 02:00:00 +0200"
1910869,AZIENDA OSPEDALIERA CITTA' DELLA SALUTE E DELLA SCIENZA DI TORINO,2,2018-03-28,02/05/2018,170000.00,"FORNITURA DEL SERVIZIO DI MANUTENZIONE, ASSISTENZA DEL CENTRALINO TELEFONICO PER 12 MESI - REF.:M.PIA STURARO_TEL. 011/633.3091_msturaro@cittadellasalute.to.it, bando numero: 1910869",https://www.acquistinretepa.it/opencms/opencms/main/impresa/strumenti/dettaglio.jsp?idT=1910869&tipoVis=descr&nome=FORNITURA+DEL+SERVIZIO+DI+MANUTENZIONE%2C+ASSISTENZA+DEL+CENTRALINO+TELEFONICO+PER+12+MESI+-+REF.%3AM.PIA+STURARO_TEL.+011%2F633.3091_msturaro%40cittadellasalute.to.it&frompage=rdoAperte.jsp&orderBy=pubblicazione&sort=desc&__pagina=24&__element=paginazione,"Wed, 28 Mar 2018 02:00:00 +0200"
1910397,FONDAZIONE ISTITUTO G.GIGLIO DI CEFALU',Varie,2018-03-28,17/04/2018,5640.00,"Rotoli asciugamani, bando numero: 1910397",https://www.acquistinretepa.it/opencms/opencms/main/impresa/strumenti/dettaglio.jsp?idT=1910397&tipoVis=descr&nome=Rotoli+asciugamani&frompage=rdoAperte.jsp&orderBy=pubblicazione&sort=desc&__pagina=24&__element=paginazione,"Wed, 28 Mar 2018 02:00:00 +0200"
1908869,COMUNE DI GRUGLIASCO,2,2018-03-28,10/04/2018,321800.00,"TURISMO SOCIALE PER LA TERZA ETA' ANNO 2018, bando numero: 1908869",https://www.acquistinretepa.it/opencms/opencms/main/impresa/strumenti/dettaglio.jsp?idT=1908869&tipoVis=descr&nome=TURISMO+SOCIALE+PER+LA+TERZA+ETA%27+ANNO+2018&frompage=rdoAperte.jsp&orderBy=pubblicazione&sort=desc&__pagina=24&__element=paginazione,"Wed, 28 Mar 2018 02:00:00 +0200"
1910665,POLITECNICO DI TORINO,Varie,2018-03-28,17/04/2018,32800.00,"POLITECNICO DI TORINO - Amministrazione Centrale - Fornitura di materiale informatico vario, bando numero: 1910665",https://www.acquistinretepa.it/opencms/opencms/main/impresa/strumenti/dettaglio.jsp?idT=1910665&tipoVis=descr&nome=POLITECNICO+DI+TORINO+-+Amministrazione+Centrale+-+Fornitura+di+materiale+informatico+vario&frompage=rdoAperte.jsp&orderBy=pubblicazione&sort=desc&__pagina=24&__element=paginazione,"Wed, 28 Mar 2018 02:00:00 +0200"
1910868,MINISTERO DELL'ISTRUZIONE DELL'UNIVERSITA' E DELLA RICERCA,Varie,2018-03-28,06/04/2018,400.00,"Misuratore Laser Leica Disto D2 e batterie mini stilo, bando numero: 1910868",https://www.acquistinretepa.it/opencms/opencms/main/impresa/strumenti/dettaglio.jsp?idT=1910868&tipoVis=descr&nome=Misuratore+Laser+Leica+Disto+D2+e+batterie+mini+stilo&frompage=rdoAperte.jsp&orderBy=pubblicazione&sort=desc&__pagina=24&__element=paginazione,"Wed, 28 Mar 2018 02:00:00 +0200"
1910815,I.R.C.C.S. ISTITUTO NAZIONALE TUMORI FONDAZIONE PASCALE NAPOLI,Varie,2018-03-28,06/04/2018,28000.00,"GARA PER LA FORNITURA DI UN IMPIANTO AUDIO VIDEO PER LA SALA CONSIGLIO DELL'iSTITUTO, bando numero: 1910815",https://www.acquistinretepa.it/opencms/opencms/main/impresa/strumenti/dettaglio.jsp?idT=1910815&tipoVis=descr&nome=GARA+PER+LA+FORNITURA+DI+UN+IMPIANTO+AUDIO+VIDEO+PER+LA+SALA+CONSIGLIO+DELL%27iSTITUTO&frompage=rdoAperte.jsp&orderBy=pubblicazione&sort=desc&__pagina=24&__element=paginazione,"Wed, 28 Mar 2018 02:00:00 +0200"
1910858,AZIENDA OSPEDALIERA DI RILIEVO NAZIONALE E DI ALTA SPECIALIZZAZIONE - CIVICO - DI CRISTINA - BENFRATELLI - PALERMO,Varie,2018-03-28,10/04/2018,2500.00,"Fornitura di n. 7 poltrone ergonomiche per il centralino aziendale, bando numero: 1910858",https://www.acquistinretepa.it/opencms/opencms/main/impresa/strumenti/dettaglio.jsp?idT=1910858&tipoVis=descr&nome=Fornitura+di+n.+7+poltrone+ergonomiche+per+il+centralino+aziendale&frompage=rdoAperte.jsp&orderBy=pubblicazione&sort=desc&__pagina=24&__element=paginazione,"Wed, 28 Mar 2018 02:00:00 +0200"
1910788,MINISTERO DELL'ISTRUZIONE DELL'UNIVERSITA' E DELLA RICERCA,Varie,2018-03-28,09/04/2018,11803.28,"Atelier Creativi, bando numero: 1910788",https://www.acquistinretepa.it/opencms/opencms/main/impresa/strumenti/dettaglio.jsp?idT=1910788&tipoVis=descr&nome=Atelier+Creativi&frompage=rdoAperte.jsp&orderBy=pubblicazione&sort=desc&__pagina=24&__element=paginazione,"Wed, 28 Mar 2018 02:00:00 +0200"
1910160,I.R.C.C.S. ISTITUTI FISIOTERAPICI OSPITALIERI ROMA,Varie,2018-03-28,13/04/2018,138500.00,"Materiali e sistemi per la raccolta di unità di sangue, la produzione e la conservazione di emocomponenti, bando numero: 1910160",https://www.acquistinretepa.it/opencms/opencms/main/impresa/strumenti/dettaglio.jsp?idT=1910160&tipoVis=descr&nome=Materiali+e+sistemi+per+la+raccolta+di+unit%E0+di+sangue%2C+la+produzione+e+la+conservazione+di+emocomponenti&frompage=rdoAperte.jsp&orderBy=pubblicazione&sort=desc&__pagina=25&__element=paginazione,"Wed, 28 Mar 2018 02:00:00 +0200"
1910829,AZIENDA OSPEDALIERA CITTA' DELLA SALUTE E DELLA SCIENZA DI TORINO,Varie,2018-03-28,23/04/2018,1500.00,"FORNITURA DI N° 1 SCHERMO DI HESS, bando numero: 1910829",https://www.acquistinretepa.it/opencms/opencms/main/impresa/strumenti/dettaglio.jsp?idT=1910829&tipoVis=descr&nome=FORNITURA+DI+N%B0+1+SCHERMO+DI+HESS&frompage=rdoAperte.jsp&orderBy=pubblicazione&sort=desc&__pagina=25&__element=paginazione,"Wed, 28 Mar 2018 02:00:00 +0200"
1910827,UNIVERSITA' DEGLI STUDI DI PADOVA,Varie,2018-03-28,09/04/2018,2700.00,"Materiale informatico prof. S.L., bando numero: 1910827",https://www.acquistinretepa.it/opencms/opencms/main/impresa/strumenti/dettaglio.jsp?idT=1910827&tipoVis=descr&nome=Materiale+informatico+prof.+S.L.&frompage=rdoAperte.jsp&orderBy=pubblicazione&sort=desc&__pagina=25&__element=paginazione,"Wed, 28 Mar 2018 02:00:00 +0200"
1910823,UNIVERSITA' DEGLI STUDI DI ROMA LA SAPIENZA,Varie,2018-03-28,11/04/2018,3700.00,"Acquisto materiale consumabile per laboratorio Prof.ssa Francesca Cutruzzolà, bando numero: 1910823",https://www.acquistinretepa.it/opencms/opencms/main/impresa/strumenti/dettaglio.jsp?idT=1910823&tipoVis=descr&nome=Acquisto+materiale+consumabile+per+laboratorio+Prof.ssa+Francesca+Cutruzzol%E0&frompage=rdoAperte.jsp&orderBy=pubblicazione&sort=desc&__pagina=25&__element=paginazione,"Wed, 28 Mar 2018 02:00:00 +0200"
1910856,UNIVERSITA' DEGLI STUDI DI PALERMO,Varie,2018-03-28,18/04/2018,5000.00,"Filtri carbone attivo, bando numero: 1910856",https://www.acquistinretepa.it/opencms/opencms/main/impresa/strumenti/dettaglio.jsp?idT=1910856&tipoVis=descr&nome=Filtri+carbone+attivo&frompage=rdoAperte.jsp&orderBy=pubblicazione&sort=desc&__pagina=25&__element=paginazione,"Wed, 28 Mar 2018 02:00:00 +0200"
1910429,AZIENDA UNIVERSITARIA POLICLINICO NAPOLI,Varie,2018-03-28,12/04/2018,28000.00,"ACQUISTO SISTEMA ECOGRAFICO PORTATILE PER LE ESIGENZE DEL SERVIZIO DI PATOLOGIA SPECIALE ODONTOSTOMATOLOGICA, bando numero: 1910429",https://www.acquistinretepa.it/opencms/opencms/main/impresa/strumenti/dettaglio.jsp?idT=1910429&tipoVis=descr&nome=ACQUISTO+SISTEMA+ECOGRAFICO+PORTATILE+PER+LE+ESIGENZE+DEL+SERVIZIO+DI+PATOLOGIA+SPECIALE+ODONTOSTOMATOLOGICA&frompage=rdoAperte.jsp&orderBy=pubblicazione&sort=desc&__pagina=25&__element=paginazione,"Wed, 28 Mar 2018 02:00:00 +0200"
1910802,AZIENDA OSPEDALIERA CITTA' DELLA SALUTE E DELLA SCIENZA DI TORINO,Varie,2018-03-28,07/05/2018,48000.00,"FORNITURA IN NOLEGGIO, PER MESI 84, DI N. 1 SISTEMA PER URODINAMICA - REF.:M.PIA STURARO_TEL. 011/633.3091_msturaro@cittadellasalute.to.it, bando numero: 1910802",https://www.acquistinretepa.it/opencms/opencms/main/impresa/strumenti/dettaglio.jsp?idT=1910802&tipoVis=descr&nome=FORNITURA+IN+NOLEGGIO%2C+PER+MESI+84%2C+DI+N.+1+SISTEMA+PER+URODINAMICA+-+REF.%3AM.PIA+STURARO_TEL.+011%2F633.3091_msturaro%40cittadellasalute.to.it&frompage=rdoAperte.jsp&orderBy=pubblicazione&sort=desc&__pagina=25&__element=paginazione,"Wed, 28 Mar 2018 02:00:00 +0200"
1827256,UNIVERSITA' DEGLI STUDI DI ROMA LA SAPIENZA,Varie,2018-03-28,09/04/2018,3300.00,"Acquisto materiali consumabili plotter, bando numero: 1827256",https://www.acquistinretepa.it/opencms/opencms/main/impresa/strumenti/dettaglio.jsp?idT=1827256&tipoVis=descr&nome=Acquisto+materiali+consumabili+plotter&frompage=rdoAperte.jsp&orderBy=pubblicazione&sort=desc&__pagina=25&__element=paginazione,"Wed, 28 Mar 2018 02:00:00 +0200"
1910818,AZIENDA OSPEDALIERA DI RILIEVO NAZIONALE E DI ALTA SPECIALIZZAZIONE - CIVICO - DI CRISTINA - BENFRATELLI - PALERMO,Varie,2018-03-28,10/04/2018,2500.00,"FORNITURA E POSA IN OPERA DI N. 1 ELETTROCARDIOGRAFO DA DESTINARE ALL'U.O. DI NEGROLOGIA E DIALISI DELL'ARNAS, bando numero: 1910818",https://www.acquistinretepa.it/opencms/opencms/main/impresa/strumenti/dettaglio.jsp?idT=1910818&tipoVis=descr&nome=FORNITURA+E+POSA+IN+OPERA+DI+N.+1+ELETTROCARDIOGRAFO+DA+DESTINARE+ALL%27U.O.+DI+NEGROLOGIA+E+DIALISI+DELL%27ARNAS&frompage=rdoAperte.jsp&orderBy=pubblicazione&sort=desc&__pagina=25&__element=paginazione,"Wed, 28 Mar 2018 02:00:00 +0200"
