numero,enteCommittente,categoria,pubblicazione,scadenza,valore:number,descrizione,url,datarss
1900776,AZIENDA OSPEDALIERA UNIVERSITARIA FEDERICO II,Varie,2018-03-20,03/04/2018,2500.00,"GARA 3760 - FORNITURA N.2000 FACCIALI FILTRANTI FFP3 PER LA PROTEZIONE DA RISCHIO BIOLOGICO, bando numero: 1900776",https://www.acquistinretepa.it/opencms/opencms/main/impresa/strumenti/dettaglio.jsp?idT=1900776&tipoVis=descr&nome=GARA+3760+-+FORNITURA+N.2000+FACCIALI+FILTRANTI+FFP3+PER+LA+PROTEZIONE+DA+RISCHIO+BIOLOGICO&frompage=rdoAperte.jsp&orderBy=pubblicazione&sort=desc&__pagina=71&__element=paginazione,"Tue, 20 Mar 2018 02:00:00 +0200"
1901759,AZIENDA OSPEDALIERA UNIVERSITARIA FEDERICO II,Varie,2018-03-20,02/04/2018,10000.00,"FORNITURA 1 ELETTROBISTURI, bando numero: 1901759",https://www.acquistinretepa.it/opencms/opencms/main/impresa/strumenti/dettaglio.jsp?idT=1901759&tipoVis=descr&nome=FORNITURA+1+ELETTROBISTURI&frompage=rdoAperte.jsp&orderBy=pubblicazione&sort=desc&__pagina=71&__element=paginazione,"Tue, 20 Mar 2018 02:00:00 +0200"
1852624,PRESIDENZA DEL CONSIGLIO DEI MINISTRI,2,2018-03-20,20/04/2018,217300.00,"Procedura negoziata sotto soglia per l'affidamento della gestione del servizio di micronido aziendale della Presidenza del Consiglio dei Ministri presso la sede di via della Mercede n. 96 Roma, bando numero: 1852624",https://www.acquistinretepa.it/opencms/opencms/main/impresa/strumenti/dettaglio.jsp?idT=1852624&tipoVis=descr&nome=Procedura+negoziata+sotto+soglia+per+l%27affidamento+della+gestione+del+servizio+di+micronido+aziendale+della+Presidenza+del+Consiglio+dei+Ministri+presso+la+sede+di+via+della+Mercede+n.+96+Roma&frompage=rdoAperte.jsp&orderBy=pubblicazione&sort=desc&__pagina=71&__element=paginazione,"Tue, 20 Mar 2018 02:00:00 +0200"
1902059,UNIVERSITA' DEGLI STUDI DI NAPOLI FEDERICO II,10,2018-03-20,05/04/2018,8080.00,"ACQUISTO ED INSTALLAZIONE DI TENDE TIPO VENEZIA, bando numero: 1902059",https://www.acquistinretepa.it/opencms/opencms/main/impresa/strumenti/dettaglio.jsp?idT=1902059&tipoVis=descr&nome=ACQUISTO+ED+INSTALLAZIONE+DI+TENDE+TIPO+VENEZIA&frompage=rdoAperte.jsp&orderBy=pubblicazione&sort=desc&__pagina=71&__element=paginazione,"Tue, 20 Mar 2018 02:00:00 +0200"
1901218,ASL 4 Teramo,Varie,2018-03-20,10/04/2018,5000.00,"Fornitura di n. 1 Bilirubinometro e di n. 1 Saturimentro per UOC Pediatria e Neonatologia P.O. Teramo, bando numero: 1901218",https://www.acquistinretepa.it/opencms/opencms/main/impresa/strumenti/dettaglio.jsp?idT=1901218&tipoVis=descr&nome=Fornitura+di+n.+1+Bilirubinometro+e+di+n.+1+Saturimentro+per+UOC+Pediatria+e+Neonatologia+P.O.+Teramo&frompage=rdoAperte.jsp&orderBy=pubblicazione&sort=desc&__pagina=71&__element=paginazione,"Tue, 20 Mar 2018 02:00:00 +0200"
1901263,UNIVERSITA' DEGLI STUDI DI ROMA LA SAPIENZA,2,2018-03-20,09/04/2018,4000.00,"Fornitura Videocitofono Centro Crea, bando numero: 1901263",https://www.acquistinretepa.it/opencms/opencms/main/impresa/strumenti/dettaglio.jsp?idT=1901263&tipoVis=descr&nome=Fornitura+Videocitofono+Centro+Crea&frompage=rdoAperte.jsp&orderBy=pubblicazione&sort=desc&__pagina=71&__element=paginazione,"Tue, 20 Mar 2018 02:00:00 +0200"
1901894,COMUNE DI GAETA,2,2018-03-20,22/04/2018,144000.00,"Servizi di stampa, imbustamento, e rendicontazione verbali infrazione al codice della strada elevati dal 01/01/2018 fino al 31/12/2019, bando numero: 1901894",https://www.acquistinretepa.it/opencms/opencms/main/impresa/strumenti/dettaglio.jsp?idT=1901894&tipoVis=descr&nome=Servizi+di+stampa%2C+imbustamento%2C+e+rendicontazione+verbali+infrazione+al+codice+della+strada+elevati+dal+01%2F01%2F2018+fino+al+31%2F12%2F2019&frompage=rdoAperte.jsp&orderBy=pubblicazione&sort=desc&__pagina=71&__element=paginazione,"Tue, 20 Mar 2018 02:00:00 +0200"
1901757,ASL VC,Varie,2018-03-20,03/04/2018,11000.00,"Fornitura di n. 1 Autorefrattometro occorrente all'ASL VC, bando numero: 1901757",https://www.acquistinretepa.it/opencms/opencms/main/impresa/strumenti/dettaglio.jsp?idT=1901757&tipoVis=descr&nome=Fornitura+di+n.+1+Autorefrattometro+occorrente+all%27ASL+VC&frompage=rdoAperte.jsp&orderBy=pubblicazione&sort=desc&__pagina=71&__element=paginazione,"Tue, 20 Mar 2018 02:00:00 +0200"
1901828,UNIVERSITA' DEGLI STUDI DELLA CAMPANIA - LUIGI VANVITELLI,2,2018-03-20,07/04/2018,9800.00,"Servizio di prelievo, trasporto, Smaltimento finale, certificazione di analisi dei rifiuti speciali pericoloso e non, bando numero: 1901828",https://www.acquistinretepa.it/opencms/opencms/main/impresa/strumenti/dettaglio.jsp?idT=1901828&tipoVis=descr&nome=Servizio+di+prelievo%2C+trasporto%2C+Smaltimento+finale%2C+certificazione+di+analisi+dei+rifiuti+speciali+pericoloso+e+non&frompage=rdoAperte.jsp&orderBy=pubblicazione&sort=desc&__pagina=71&__element=paginazione,"Tue, 20 Mar 2018 02:00:00 +0200"
1900630,MINISTERO DELL'ISTRUZIONE DELL'UNIVERSITA' E DELLA RICERCA,Varie,2018-03-20,03/04/2018,1515.00,"FORNITURA CARTA FORMATO A4 E A3 PER ATTIVITA' DIDATTICA ED AMMINISTRATIVA, bando numero: 1900630",https://www.acquistinretepa.it/opencms/opencms/main/impresa/strumenti/dettaglio.jsp?idT=1900630&tipoVis=descr&nome=FORNITURA+CARTA+FORMATO+A4+E+A3+PER+ATTIVITA%27+DIDATTICA+ED+AMMINISTRATIVA&frompage=rdoAperte.jsp&orderBy=pubblicazione&sort=desc&__pagina=71&__element=paginazione,"Tue, 20 Mar 2018 02:00:00 +0200"
1901740,AZIENDA SANITARIA PROVINCIALE DI AGRIGENTO,2,2018-03-20,09/04/2018,47078.80,"Servizio di ritiro e spedizione raccomandate, bando numero: 1901740",https://www.acquistinretepa.it/opencms/opencms/main/impresa/strumenti/dettaglio.jsp?idT=1901740&tipoVis=descr&nome=Servizio+di+ritiro+e+spedizione+raccomandate&frompage=rdoAperte.jsp&orderBy=pubblicazione&sort=desc&__pagina=72&__element=paginazione,"Tue, 20 Mar 2018 02:00:00 +0200"
1901054,ASL VC,Varie,2018-03-20,03/04/2018,4000.00,"Fornitura di n. 1 Impedenziometro occorrente all'ASL VC, bando numero: 1901054",https://www.acquistinretepa.it/opencms/opencms/main/impresa/strumenti/dettaglio.jsp?idT=1901054&tipoVis=descr&nome=Fornitura+di+n.+1+Impedenziometro+occorrente+all%27ASL+VC&frompage=rdoAperte.jsp&orderBy=pubblicazione&sort=desc&__pagina=72&__element=paginazione,"Tue, 20 Mar 2018 02:00:00 +0200"
1901178,MINISTERO DELLA DIFESA,Varie,2018-03-20,05/04/2018,3196.72,"Fornitura Materiale per la gestione rifiuti speciali e solidi, bando numero: 1901178",https://www.acquistinretepa.it/opencms/opencms/main/impresa/strumenti/dettaglio.jsp?idT=1901178&tipoVis=descr&nome=Fornitura+Materiale+per+la+gestione+rifiuti+speciali+e+solidi&frompage=rdoAperte.jsp&orderBy=pubblicazione&sort=desc&__pagina=72&__element=paginazione,"Tue, 20 Mar 2018 02:00:00 +0200"
1901268,ISTITUTO ZOOPROFILATTICO SPERIMENTALE DELLA LOMBARDIA E DELL'EMILIA R,Varie,2018-03-20,05/04/2018,149947.20,"IZSLER - FORNITURA QUADRIENNALE DI PIASTRE ELISA 96 POZZETTI FONDO PIATTO A MARCHIO NUNC PER USO SPECIALISTICO - FASC. 186/2018 - REFERENTE DOTT.SSA ALESSANDRA APOLLARO (TEL.030.2290621), bando numero: 1901268",https://www.acquistinretepa.it/opencms/opencms/main/impresa/strumenti/dettaglio.jsp?idT=1901268&tipoVis=descr&nome=IZSLER+-+FORNITURA+QUADRIENNALE+DI+PIASTRE+ELISA+96+POZZETTI+FONDO+PIATTO+A+MARCHIO+NUNC+PER+USO+SPECIALISTICO+-+FASC.+186%2F2018+-+REFERENTE+DOTT.SSA+ALESSANDRA+APOLLARO+%28TEL.030.2290621%29&frompage=rdoAperte.jsp&orderBy=pubblicazione&sort=desc&__pagina=72&__element=paginazione,"Tue, 20 Mar 2018 02:00:00 +0200"
1901425,CAMERA DI COMMERCIO DI TORINO,Varie,2018-03-20,04/04/2018,9212.27,"FORNITURA DI CARTA RICICLATA E CARTA VERGINE PER FOTOCOPIE FORMATO A4 GR. 80 PER LA CCIAA DI TORINO, bando numero: 1901425",https://www.acquistinretepa.it/opencms/opencms/main/impresa/strumenti/dettaglio.jsp?idT=1901425&tipoVis=descr&nome=FORNITURA+DI+CARTA+RICICLATA+E+CARTA+VERGINE+PER+FOTOCOPIE+FORMATO+A4+GR.+80+PER+LA+CCIAA+DI+TORINO&frompage=rdoAperte.jsp&orderBy=pubblicazione&sort=desc&__pagina=72&__element=paginazione,"Tue, 20 Mar 2018 02:00:00 +0200"
1901444,AZIENDA SANITARIA PROVINCIALE DI VIBO VALENTIA,Varie,2018-03-20,20/04/2018,145000.00,"Ambulanze soccorso avanzato, bando numero: 1901444",https://www.acquistinretepa.it/opencms/opencms/main/impresa/strumenti/dettaglio.jsp?idT=1901444&tipoVis=descr&nome=Ambulanze+soccorso+avanzato&frompage=rdoAperte.jsp&orderBy=pubblicazione&sort=desc&__pagina=72&__element=paginazione,"Tue, 20 Mar 2018 02:00:00 +0200"
1901311,COMUNE DI CERIGNOLA,2,2018-03-20,10/04/2018,76116.07,"SERVIZIO DI ASSISTENZA DOMICILIARE INTEGRATA RISERVATA AD UTENTI UNDER 65 ANNI (A.D.I.), bando numero: 1901311",https://www.acquistinretepa.it/opencms/opencms/main/impresa/strumenti/dettaglio.jsp?idT=1901311&tipoVis=descr&nome=SERVIZIO+DI+ASSISTENZA+DOMICILIARE+INTEGRATA+RISERVATA+AD+UTENTI+UNDER+65+ANNI+%28A.D.I.%29&frompage=rdoAperte.jsp&orderBy=pubblicazione&sort=desc&__pagina=72&__element=paginazione,"Tue, 20 Mar 2018 02:00:00 +0200"
1901428,CONSIGLIO DI BACINO LAGUNA DI VENEZIA,2,2018-03-20,19/04/2018,7200.00,"SERVIZIO BIENNALE DI PULIZIA DEGLI UFFICI DELL'ENTE, bando numero: 1901428",https://www.acquistinretepa.it/opencms/opencms/main/impresa/strumenti/dettaglio.jsp?idT=1901428&tipoVis=descr&nome=SERVIZIO+BIENNALE+DI+PULIZIA+DEGLI+UFFICI+DELL%27ENTE&frompage=rdoAperte.jsp&orderBy=pubblicazione&sort=desc&__pagina=72&__element=paginazione,"Tue, 20 Mar 2018 02:00:00 +0200"
1901302,COMUNE DI ACERRA,2,2018-03-20,06/04/2018,0.01,"Servizio di smaltimento e/o recupero dei rifiuti inerti - C.E.R. 17.01.07, bando numero: 1901302",https://www.acquistinretepa.it/opencms/opencms/main/impresa/strumenti/dettaglio.jsp?idT=1901302&tipoVis=descr&nome=Servizio+di+smaltimento+e%2Fo+recupero+dei+rifiuti+inerti+-+C.E.R.+17.01.07&frompage=rdoAperte.jsp&orderBy=pubblicazione&sort=desc&__pagina=72&__element=paginazione,"Tue, 20 Mar 2018 02:00:00 +0200"
1901340,REGIONE SICILIA,Varie,2018-03-20,03/04/2018,983.61,"Acquisto beni di consumo e accessori informatici per il contigente L.T.I., bando numero: 1901340",https://www.acquistinretepa.it/opencms/opencms/main/impresa/strumenti/dettaglio.jsp?idT=1901340&tipoVis=descr&nome=Acquisto+beni+di+consumo+e+accessori+informatici+per+il+contigente+L.T.I.&frompage=rdoAperte.jsp&orderBy=pubblicazione&sort=desc&__pagina=72&__element=paginazione,"Tue, 20 Mar 2018 02:00:00 +0200"
1901227,C.N.R. CONSIGLIO NAZIONALE DELLE RICERCHE,Varie,2018-03-20,06/04/2018,1580.00,"ACQUISTO DI FOTOCAMERA GARMIN VIRB360 + ACCESSORI GARMIN, bando numero: 1901227",https://www.acquistinretepa.it/opencms/opencms/main/impresa/strumenti/dettaglio.jsp?idT=1901227&tipoVis=descr&nome=ACQUISTO+DI+FOTOCAMERA+GARMIN+VIRB360+%2B+ACCESSORI+GARMIN&frompage=rdoAperte.jsp&orderBy=pubblicazione&sort=desc&__pagina=73&__element=paginazione,"Tue, 20 Mar 2018 02:00:00 +0200"
1901201,UNIVERSITA' DEGLI STUDI DEL MOLISE,Varie,2018-03-20,06/04/2018,65573.00,"Fornitura e allestimento del sistema RFID antitaccheggio, bando numero: 1901201",https://www.acquistinretepa.it/opencms/opencms/main/impresa/strumenti/dettaglio.jsp?idT=1901201&tipoVis=descr&nome=Fornitura+e+allestimento+del+sistema+RFID+antitaccheggio&frompage=rdoAperte.jsp&orderBy=pubblicazione&sort=desc&__pagina=73&__element=paginazione,"Tue, 20 Mar 2018 02:00:00 +0200"
1899541,AZIENDA OSPEDALIERO-UNIVERSITARIA OSPEDALI RIUNITI UMBERTO I - G.M. LANCISI - G. SALESI,Varie,2018-03-20,10/04/2018,39600.00,"AOR-ANCONA-FORNITURA ANNUALE DI SISTEMA DOPPIO GUANTO CHIRURGICO E RICAMBIO DOPPIO GUANTO VARIE MISURE, bando numero: 1899541",https://www.acquistinretepa.it/opencms/opencms/main/impresa/strumenti/dettaglio.jsp?idT=1899541&tipoVis=descr&nome=AOR-ANCONA-FORNITURA+ANNUALE+DI+SISTEMA+DOPPIO+GUANTO+CHIRURGICO+E+RICAMBIO+DOPPIO+GUANTO+VARIE+MISURE&frompage=rdoAperte.jsp&orderBy=pubblicazione&sort=desc&__pagina=73&__element=paginazione,"Tue, 20 Mar 2018 02:00:00 +0200"
1900234,AZIENDA SANITARIA PROVINCIALE DI RAGUSA,Varie,2018-03-20,05/04/2018,400.00,"Fornitura di N. 1 “STERILIZZATORE A VAPORE PER DISINFEZIONE E ASCIUGATURA A CALDO PER IL PAZIENTE P. R.”, bando numero: 1900234",https://www.acquistinretepa.it/opencms/opencms/main/impresa/strumenti/dettaglio.jsp?idT=1900234&tipoVis=descr&nome=Fornitura+di+N.+1+%3FSTERILIZZATORE+A+VAPORE+PER+DISINFEZIONE+E+ASCIUGATURA+A+CALDO+PER+IL+PAZIENTE+P.+R.%3F&frompage=rdoAperte.jsp&orderBy=pubblicazione&sort=desc&__pagina=73&__element=paginazione,"Tue, 20 Mar 2018 02:00:00 +0200"
1900081,CAMERA DI COMMERCIO DI SALERNO,2,2018-03-20,20/04/2018,6500.00,"SERVIZI POSTALI ANNUALI DELLA CAMERA, bando numero: 1900081",https://www.acquistinretepa.it/opencms/opencms/main/impresa/strumenti/dettaglio.jsp?idT=1900081&tipoVis=descr&nome=SERVIZI+POSTALI+ANNUALI+DELLA+CAMERA&frompage=rdoAperte.jsp&orderBy=pubblicazione&sort=desc&__pagina=73&__element=paginazione,"Tue, 20 Mar 2018 02:00:00 +0200"
1856190,I.R.C.C.S. ISTITUTO NAZIONALE TUMORI FONDAZIONE PASCALE NAPOLI,Varie,2018-03-20,19/04/2018,140000.00,"SOMMINISTRAZIONE ANNUALE PER SISTEMI TERMOREGOLANTI PER RISCALDAMENTO PAZIENTI CON PROPRIETA' ANTIDECUBITO PER UTILIZZO DURANTE INTERVENTI, bando numero: 1856190",https://www.acquistinretepa.it/opencms/opencms/main/impresa/strumenti/dettaglio.jsp?idT=1856190&tipoVis=descr&nome=SOMMINISTRAZIONE+ANNUALE+PER+SISTEMI+TERMOREGOLANTI+PER+RISCALDAMENTO+PAZIENTI+CON+PROPRIETA%27+ANTIDECUBITO+PER+UTILIZZO+DURANTE+INTERVENTI&frompage=rdoAperte.jsp&orderBy=pubblicazione&sort=desc&__pagina=73&__element=paginazione,"Tue, 20 Mar 2018 02:00:00 +0200"
1893404,AZIENDA OSPEDALIERO-UNIVERSITARIA OSPEDALI RIUNITI UMBERTO I - G.M. LANCISI - G. SALESI,Varie,2018-03-20,04/04/2018,12000.00,"AOR ANCONA - STRUMENTARIO ORIGINALE S&T, bando numero: 1893404",https://www.acquistinretepa.it/opencms/opencms/main/impresa/strumenti/dettaglio.jsp?idT=1893404&tipoVis=descr&nome=AOR+ANCONA+-+STRUMENTARIO+ORIGINALE+S%26T&frompage=rdoAperte.jsp&orderBy=pubblicazione&sort=desc&__pagina=73&__element=paginazione,"Tue, 20 Mar 2018 02:00:00 +0200"
1893377,AZIENDA OSPEDALIERO-UNIVERSITARIA OSPEDALI RIUNITI UMBERTO I - G.M. LANCISI - G. SALESI,Varie,2018-03-20,04/04/2018,3000.00,"AOR ANCONA - DILATATORI ESOFAGEI ORIGINALI PILLING, bando numero: 1893377",https://www.acquistinretepa.it/opencms/opencms/main/impresa/strumenti/dettaglio.jsp?idT=1893377&tipoVis=descr&nome=AOR+ANCONA+-+DILATATORI+ESOFAGEI+ORIGINALI+PILLING&frompage=rdoAperte.jsp&orderBy=pubblicazione&sort=desc&__pagina=73&__element=paginazione,"Tue, 20 Mar 2018 02:00:00 +0200"
1893322,AZIENDA OSPEDALIERO-UNIVERSITARIA OSPEDALI RIUNITI UMBERTO I - G.M. LANCISI - G. SALESI,Varie,2018-03-20,04/04/2018,4900.00,"AOR ANCONA - STRUMENTARIO ORIGINALE OLYMPUS, bando numero: 1893322",https://www.acquistinretepa.it/opencms/opencms/main/impresa/strumenti/dettaglio.jsp?idT=1893322&tipoVis=descr&nome=AOR+ANCONA+-+STRUMENTARIO+ORIGINALE+OLYMPUS&frompage=rdoAperte.jsp&orderBy=pubblicazione&sort=desc&__pagina=73&__element=paginazione,"Tue, 20 Mar 2018 02:00:00 +0200"
1893286,AZIENDA OSPEDALIERO-UNIVERSITARIA OSPEDALI RIUNITI UMBERTO I - G.M. LANCISI - G. SALESI,Varie,2018-03-20,04/04/2018,4000.00,"AOR ANCONA - FORBICE ENDOSCOPICA ORIGINALE WOLF, bando numero: 1893286",https://www.acquistinretepa.it/opencms/opencms/main/impresa/strumenti/dettaglio.jsp?idT=1893286&tipoVis=descr&nome=AOR+ANCONA+-+FORBICE+ENDOSCOPICA+ORIGINALE+WOLF&frompage=rdoAperte.jsp&orderBy=pubblicazione&sort=desc&__pagina=73&__element=paginazione,"Tue, 20 Mar 2018 02:00:00 +0200"
1885574,MINISTERO DELL'ISTRUZIONE DELL'UNIVERSITA' E DELLA RICERCA,Varie,2018-03-20,03/04/2018,5400.00,"COMPUTER UFFICI, bando numero: 1885574",https://www.acquistinretepa.it/opencms/opencms/main/impresa/strumenti/dettaglio.jsp?idT=1885574&tipoVis=descr&nome=COMPUTER+UFFICI&frompage=rdoAperte.jsp&orderBy=pubblicazione&sort=desc&__pagina=74&__element=paginazione,"Tue, 20 Mar 2018 02:00:00 +0200"
1898498,ROMA CAPITALE - COMUNE DI ROMA,Varie,2018-03-19,03/04/2018,196721.31,"Fornitura di materiale agrario, piante e fiori per eventi istituzionali, bando numero: 1898498",https://www.acquistinretepa.it/opencms/opencms/main/impresa/strumenti/dettaglio.jsp?idT=1898498&tipoVis=descr&nome=Fornitura+di+materiale+agrario%2C+piante+e+fiori+per+eventi+istituzionali&frompage=rdoAperte.jsp&orderBy=pubblicazione&sort=desc&__pagina=74&__element=paginazione,"Mon, 19 Mar 2018 02:00:00 +0200"
1900761,AZIENDA SANITARIA UNICA REGIONALE MARCHE,Varie,2018-03-19,20/04/2018,180000.00,"FORNITURA IN NOLEGGIO DI N. 2 PROCESSATORI- MATERIALE DI CONSUMO - MANUTENZIONE FULL RISK, bando numero: 1900761",https://www.acquistinretepa.it/opencms/opencms/main/impresa/strumenti/dettaglio.jsp?idT=1900761&tipoVis=descr&nome=FORNITURA+IN+NOLEGGIO+DI+N.+2+PROCESSATORI-+MATERIALE+DI+CONSUMO+-+MANUTENZIONE+FULL+RISK&frompage=rdoAperte.jsp&orderBy=pubblicazione&sort=desc&__pagina=74&__element=paginazione,"Mon, 19 Mar 2018 02:00:00 +0200"
1900259,AZIENDA SANITARIA PROVINCIALE DI RAGUSA,2,2018-03-19,06/04/2018,190000.00,"Servizio biennale manutenzione ordinaria, straordinaria, lavaggio e revisione degli automezzi di proprietà dell'A.S.P. di Ragusa., bando numero: 1900259",https://www.acquistinretepa.it/opencms/opencms/main/impresa/strumenti/dettaglio.jsp?idT=1900259&tipoVis=descr&nome=Servizio+biennale+manutenzione+ordinaria%2C+straordinaria%2C+lavaggio+e+revisione+degli+automezzi+di+propriet%E0+dell%27A.S.P.+di+Ragusa.&frompage=rdoAperte.jsp&orderBy=pubblicazione&sort=desc&__pagina=74&__element=paginazione,"Mon, 19 Mar 2018 02:00:00 +0200"
1883897,ROMA CAPITALE - COMUNE DI ROMA,2,2018-03-19,09/04/2018,53278.70,"Centri ricreativi estivi per minori anno 2018, bando numero: 1883897",https://www.acquistinretepa.it/opencms/opencms/main/impresa/strumenti/dettaglio.jsp?idT=1883897&tipoVis=descr&nome=Centri+ricreativi+estivi+per+minori+anno+2018&frompage=rdoAperte.jsp&orderBy=pubblicazione&sort=desc&__pagina=74&__element=paginazione,"Mon, 19 Mar 2018 02:00:00 +0200"
1890216,MINISTERO DELL'ECONOMIA E DELLE FINANZE,2,2018-03-19,09/04/2018,180.00,"Controllo affidabilità su automotoveicoli in dotazione alla Guardia di Finanza - Liguria, bando numero: 1890216",https://www.acquistinretepa.it/opencms/opencms/main/impresa/strumenti/dettaglio.jsp?idT=1890216&tipoVis=descr&nome=Controllo+affidabilit%E0+su+automotoveicoli+in+dotazione+alla+Guardia+di+Finanza+-+Liguria&frompage=rdoAperte.jsp&orderBy=pubblicazione&sort=desc&__pagina=74&__element=paginazione,"Mon, 19 Mar 2018 02:00:00 +0200"
1900541,AZIENDA OSPEDALIERA CITTA' DELLA SALUTE E DELLA SCIENZA DI TORINO,2,2018-03-19,19/04/2018,91480.00,"FORNITURA DEL SERVIZIO DI MANUTENZIONE, ASSISTENZA  DEL PACS O3 OPEN SOURCE PER 12 MESI, bando numero: 1900541",https://www.acquistinretepa.it/opencms/opencms/main/impresa/strumenti/dettaglio.jsp?idT=1900541&tipoVis=descr&nome=FORNITURA+DEL+SERVIZIO+DI+MANUTENZIONE%2C+ASSISTENZA++DEL+PACS+O3+OPEN+SOURCE+PER+12+MESI&frompage=rdoAperte.jsp&orderBy=pubblicazione&sort=desc&__pagina=74&__element=paginazione,"Mon, 19 Mar 2018 02:00:00 +0200"
1900577,COMUNE DI CHIVASSO,2,2018-03-19,05/04/2018,30000.00,"SERVIZIO DI REGISTRAZIONE AUDIO E VIDEO (TRASMISSIONE IN DIRETTA STREAMING) E TRASCRIZIONE DELLE SEDUTE DEL CONSIGLIO COMUNALE E  ASSISTENZA TECNICA PER QUATTRO ANNI, bando numero: 1900577",https://www.acquistinretepa.it/opencms/opencms/main/impresa/strumenti/dettaglio.jsp?idT=1900577&tipoVis=descr&nome=SERVIZIO+DI+REGISTRAZIONE+AUDIO+E+VIDEO+%28TRASMISSIONE+IN+DIRETTA+STREAMING%29+E+TRASCRIZIONE+DELLE+SEDUTE+DEL+CONSIGLIO+COMUNALE+E++ASSISTENZA+TECNICA+PER+QUATTRO+ANNI&frompage=rdoAperte.jsp&orderBy=pubblicazione&sort=desc&__pagina=74&__element=paginazione,"Mon, 19 Mar 2018 02:00:00 +0200"
1900520,AZIENDA SANITARIA UNICA REGIONALE MARCHE,Varie,2018-03-19,03/04/2018,110000.00,"Fornitura e trasporto gruppo refrigeratore c/o l'Ospedale di Civitanova Marche, bando numero: 1900520",https://www.acquistinretepa.it/opencms/opencms/main/impresa/strumenti/dettaglio.jsp?idT=1900520&tipoVis=descr&nome=Fornitura+e+trasporto+gruppo+refrigeratore+c%2Fo+l%27Ospedale+di+Civitanova+Marche&frompage=rdoAperte.jsp&orderBy=pubblicazione&sort=desc&__pagina=74&__element=paginazione,"Mon, 19 Mar 2018 02:00:00 +0200"
1881436,ASL FROSINONE,Varie,2018-03-19,03/04/2018,206400.00,"Fornitura di attrezzature informatiche, bando numero: 1881436",https://www.acquistinretepa.it/opencms/opencms/main/impresa/strumenti/dettaglio.jsp?idT=1881436&tipoVis=descr&nome=Fornitura+di+attrezzature+informatiche&frompage=rdoAperte.jsp&orderBy=pubblicazione&sort=desc&__pagina=74&__element=paginazione,"Mon, 19 Mar 2018 02:00:00 +0200"
1882450,UNIVERSITA' DEGLI STUDI DI NAPOLI FEDERICO II,Varie,2018-03-19,03/04/2018,24050.00,"Fornitura di cartelline personalizzate, bando numero: 1882450",https://www.acquistinretepa.it/opencms/opencms/main/impresa/strumenti/dettaglio.jsp?idT=1882450&tipoVis=descr&nome=Fornitura+di+cartelline+personalizzate&frompage=rdoAperte.jsp&orderBy=pubblicazione&sort=desc&__pagina=75&__element=paginazione,"Mon, 19 Mar 2018 02:00:00 +0200"
1900279,FONDAZIONE POLICLINICO TOR VERGATA,Varie,2018-03-19,09/04/2018,38000.00,"Lame per microtomo, bando numero: 1900279",https://www.acquistinretepa.it/opencms/opencms/main/impresa/strumenti/dettaglio.jsp?idT=1900279&tipoVis=descr&nome=Lame+per+microtomo&frompage=rdoAperte.jsp&orderBy=pubblicazione&sort=desc&__pagina=75&__element=paginazione,"Mon, 19 Mar 2018 02:00:00 +0200"
1900317,COMUNE DI NISCEMI,2,2018-03-19,10/04/2018,35364.80,"Servizio di pulizia ambienti comunali 2018/2019 comune di Niscemi, bando numero: 1900317",https://www.acquistinretepa.it/opencms/opencms/main/impresa/strumenti/dettaglio.jsp?idT=1900317&tipoVis=descr&nome=Servizio+di+pulizia+ambienti+comunali+2018%2F2019+comune+di+Niscemi&frompage=rdoAperte.jsp&orderBy=pubblicazione&sort=desc&__pagina=75&__element=paginazione,"Mon, 19 Mar 2018 02:00:00 +0200"
1899391,ASL NAPOLI 1 CENTRO,Varie,2018-03-19,05/04/2018,13200.00,"FORNITURA BIENNALE IN SOMMINISTRAZIONE DI DISPOSITIVI MEDICI SACCHE DI IRRIGAZIONE SORBITOLO + MANNITOLO OCCORRENTI ALLE UU.OO. FARMACIA DEI PRESIDI OSPEDALIERI DELLA ASL NAPOLI 1 CENTRO (LOTTO UNICO E INDIVISIBILE) R.P., bando numero: 1899391",https://www.acquistinretepa.it/opencms/opencms/main/impresa/strumenti/dettaglio.jsp?idT=1899391&tipoVis=descr&nome=FORNITURA+BIENNALE+IN+SOMMINISTRAZIONE+DI+DISPOSITIVI+MEDICI+SACCHE+DI+IRRIGAZIONE+SORBITOLO+%2B+MANNITOLO+OCCORRENTI+ALLE+UU.OO.+FARMACIA+DEI+PRESIDI+OSPEDALIERI+DELLA+ASL+NAPOLI+1+CENTRO+%28LOTTO+UNICO+E+INDIVISIBILE%29+R.P.&frompage=rdoAperte.jsp&orderBy=pubblicazione&sort=desc&__pagina=75&__element=paginazione,"Mon, 19 Mar 2018 02:00:00 +0200"
1900156,CORTE DEI CONTI,Varie,2018-03-19,02/05/2018,185000.00,"FORNITURA E INSTALLAZIONE SISTEMA DI RILEVAZIONE ACCESSI, bando numero: 1900156",https://www.acquistinretepa.it/opencms/opencms/main/impresa/strumenti/dettaglio.jsp?idT=1900156&tipoVis=descr&nome=FORNITURA+E+INSTALLAZIONE+SISTEMA+DI+RILEVAZIONE+ACCESSI&frompage=rdoAperte.jsp&orderBy=pubblicazione&sort=desc&__pagina=75&__element=paginazione,"Mon, 19 Mar 2018 02:00:00 +0200"
1899960,AZIENDA SANITARIA PROVINCIALE DI CROTONE,Varie,2018-03-19,04/04/2018,10000.00,"Acquisto di n. 1 lampada per fototerapia di ultima generazione per la SOC di Neonatologia-T.I.N. del Presidio Ospedaliero di Crotone., bando numero: 1899960",https://www.acquistinretepa.it/opencms/opencms/main/impresa/strumenti/dettaglio.jsp?idT=1899960&tipoVis=descr&nome=Acquisto+di+n.+1+lampada+per+fototerapia+di+ultima+generazione+per+la+SOC+di+Neonatologia-T.I.N.+del+Presidio+Ospedaliero+di+Crotone.&frompage=rdoAperte.jsp&orderBy=pubblicazione&sort=desc&__pagina=75&__element=paginazione,"Mon, 19 Mar 2018 02:00:00 +0200"
1900042,UNIVERSITA' DEGLI STUDI DEL SANNIO,Varie,2018-03-19,03/04/2018,2700.00,"Fornitura di n. 1 notebook e n. 1 stampante per le esigenze del Prorettore, bando numero: 1900042",https://www.acquistinretepa.it/opencms/opencms/main/impresa/strumenti/dettaglio.jsp?idT=1900042&tipoVis=descr&nome=Fornitura+di+n.+1+notebook+e+n.+1+stampante+per+le+esigenze+del+Prorettore&frompage=rdoAperte.jsp&orderBy=pubblicazione&sort=desc&__pagina=75&__element=paginazione,"Mon, 19 Mar 2018 02:00:00 +0200"
1900237,AZIENDA SANITARIA PROVINCIALE DI ENNA,Varie,2018-03-19,07/04/2018,5000.00,"CLASSIFICATOIRI A 4 CASSETTI COMPLETI CARTELLE SOSPESE, bando numero: 1900237",https://www.acquistinretepa.it/opencms/opencms/main/impresa/strumenti/dettaglio.jsp?idT=1900237&tipoVis=descr&nome=CLASSIFICATOIRI+A+4+CASSETTI+COMPLETI+CARTELLE+SOSPESE&frompage=rdoAperte.jsp&orderBy=pubblicazione&sort=desc&__pagina=75&__element=paginazione,"Mon, 19 Mar 2018 02:00:00 +0200"
1783779,AGENZIA DELLE DOGANE E DEI MONOPOLI,2,2018-03-19,18/04/2018,43130.00,"Servizio di pulizia, igiene ambientale e servizi connessi di ausiliariato per l'immobile della Direzione dell'ufficio dei Monopoli per la Calabria sede di Cosenza e per le SOT di Catanzaro e Reggio Calabria, bando numero: 1783779",https://www.acquistinretepa.it/opencms/opencms/main/impresa/strumenti/dettaglio.jsp?idT=1783779&tipoVis=descr&nome=Servizio+di+pulizia%2C+igiene+ambientale+e+servizi+connessi+di+ausiliariato+per+l%27immobile+della+Direzione+dell%27ufficio+dei+Monopoli+per+la+Calabria+sede+di+Cosenza+e+per+le+SOT+di+Catanzaro+e+Reggio+Calabria&frompage=rdoAperte.jsp&orderBy=pubblicazione&sort=desc&__pagina=75&__element=paginazione,"Mon, 19 Mar 2018 02:00:00 +0200"
1900168,AZIENDA SANITARIA PROVINCIALE DI ENNA,Varie,2018-03-19,07/04/2018,800.00,"KIT 3 GRADINI X MASTER STEP TEST, bando numero: 1900168",https://www.acquistinretepa.it/opencms/opencms/main/impresa/strumenti/dettaglio.jsp?idT=1900168&tipoVis=descr&nome=KIT+3+GRADINI+X+MASTER+STEP+TEST&frompage=rdoAperte.jsp&orderBy=pubblicazione&sort=desc&__pagina=75&__element=paginazione,"Mon, 19 Mar 2018 02:00:00 +0200"
