numero,enteCommittente,categoria,pubblicazione,scadenza,valore:number,descrizione,url,datarss
1823379,COMUNE DI GINOSA,Varie,2017-12-16,19/12/2017,2000.00,"Noleggio service audio video due concerti, bando numero: 1823379",https://www.acquistinretepa.it/opencms/opencms/main/impresa/strumenti/dettaglio.jsp?idT=1823379&tipoVis=descr&nome=Noleggio+service+audio+video+due+concerti&frompage=rdoAperte.jsp&orderBy=pubblicazione&sort=desc&__pagina=1&__element=paginazione,"Sat, 16 Dec 2017 02:00:00 +0200"
1821078,COMUNE DI FIUMICINO,Varie,2017-12-16,28/12/2017,32377.00,"TUTORAGGIO AI PERCORSI INDIVIDUALI DI ACCOMPAGNAMENTO AL LAVORO DI PERSONE INDIVIDUATE DAL COMMITTENTE PER LO SVOLGIMENTO DI ATTIVITA' DI PICCOLA MANUTENZIONE, bando numero: 1821078",https://www.acquistinretepa.it/opencms/opencms/main/impresa/strumenti/dettaglio.jsp?idT=1821078&tipoVis=descr&nome=TUTORAGGIO+AI+PERCORSI+INDIVIDUALI+DI+ACCOMPAGNAMENTO+AL+LAVORO+DI+PERSONE+INDIVIDUATE+DAL+COMMITTENTE+PER+LO+SVOLGIMENTO+DI+ATTIVITA%27+DI+PICCOLA+MANUTENZIONE&frompage=rdoAperte.jsp&orderBy=pubblicazione&sort=desc&__pagina=1&__element=paginazione,"Sat, 16 Dec 2017 02:00:00 +0200"
1802653,AZIENDA OSPEDALIERA S. CARLO POTENZA,Varie,2017-12-16,30/12/2017,790.00,"FORNITURA FRIGORIFERI PORTATILI, bando numero: 1802653",https://www.acquistinretepa.it/opencms/opencms/main/impresa/strumenti/dettaglio.jsp?idT=1802653&tipoVis=descr&nome=FORNITURA+FRIGORIFERI+PORTATILI&frompage=rdoAperte.jsp&orderBy=pubblicazione&sort=desc&__pagina=1&__element=paginazione,"Sat, 16 Dec 2017 02:00:00 +0200"
1823354,MINISTERO DELLA DIFESA,Varie,2017-12-16,22/12/2017,62994.00,"Fasc. 1231/17 – Fornitura (Lotti non aggiudicabili separatamente): Lotto A= elettrocompressori per UU.NN. ai lavori – Lotto B= elettrocompressori per le officine di Marinarsen Taranto, bando numero: 1823354",https://www.acquistinretepa.it/opencms/opencms/main/impresa/strumenti/dettaglio.jsp?idT=1823354&tipoVis=descr&nome=Fasc.+1231%2F17+%3F+Fornitura+%28Lotti+non+aggiudicabili+separatamente%29%3A+Lotto+A%3D+elettrocompressori+per+UU.NN.+ai+lavori+%3F+Lotto+B%3D+elettrocompressori+per+le+officine+di+Marinarsen+Taranto&frompage=rdoAperte.jsp&orderBy=pubblicazione&sort=desc&__pagina=1&__element=paginazione,"Sat, 16 Dec 2017 02:00:00 +0200"
1820864,MINISTERO DELLA DIFESA,Varie,2017-12-16,22/12/2017,80000.00,"FASC. 5659/17 – INDAGINE RIBANDITA - Servizi a quantità indeterminata inerenti rilievi  in atmosfera ed analisi delle fibre di amianto aerodisperse sulle UU.NN. della M.M.I./mezzi vari presso l'Arsenale di Taranto – CIG 7319842CB2 – Responsabile del procedimento C.V. Enzo Fabio TOTINO, bando numero: 1820864",https://www.acquistinretepa.it/opencms/opencms/main/impresa/strumenti/dettaglio.jsp?idT=1820864&tipoVis=descr&nome=FASC.+5659%2F17+%3F+INDAGINE+RIBANDITA+-+Servizi+a+quantit%E0+indeterminata+inerenti+rilievi++in+atmosfera+ed+analisi+delle+fibre+di+amianto+aerodisperse+sulle+UU.NN.+della+M.M.I.%2Fmezzi+vari+presso+l%27Arsenale+di+Taranto+%3F+CIG+7319842CB2+%3F+Responsabile+del+procedimento+C.V.+Enzo+Fabio+TOTINO&frompage=rdoAperte.jsp&orderBy=pubblicazione&sort=desc&__pagina=1&__element=paginazione,"Sat, 16 Dec 2017 02:00:00 +0200"
1823276,MINISTERO DELLA DIFESA,Varie,2017-12-16,22/12/2017,4036.88,"FASC. 5681/17 – Fornitura di un corso di formazione teorico-pratico per lavoratori addetti alla conduzione di carrelli elevatori semoventi con conducente – CIG 73143020F5, bando numero: 1823276",https://www.acquistinretepa.it/opencms/opencms/main/impresa/strumenti/dettaglio.jsp?idT=1823276&tipoVis=descr&nome=FASC.+5681%2F17+%3F+Fornitura+di+un+corso+di+formazione+teorico-pratico+per+lavoratori+addetti+alla+conduzione+di+carrelli+elevatori+semoventi+con+conducente+%3F+CIG+73143020F5&frompage=rdoAperte.jsp&orderBy=pubblicazione&sort=desc&__pagina=1&__element=paginazione,"Sat, 16 Dec 2017 02:00:00 +0200"
1823251,MINISTERO DELLA DIFESA,Varie,2017-12-16,27/12/2017,40983.49,"Fasc. 1263/17 – Fornitura di dispositivi di protezione individuale (DPI) per il funzionamento dei raparti/nuclei/settori dello stabilimento, bando numero: 1823251",https://www.acquistinretepa.it/opencms/opencms/main/impresa/strumenti/dettaglio.jsp?idT=1823251&tipoVis=descr&nome=Fasc.+1263%2F17+%3F+Fornitura+di+dispositivi+di+protezione+individuale+%28DPI%29+per+il+funzionamento+dei+raparti%2Fnuclei%2Fsettori+dello+stabilimento&frompage=rdoAperte.jsp&orderBy=pubblicazione&sort=desc&__pagina=1&__element=paginazione,"Sat, 16 Dec 2017 02:00:00 +0200"
1823122,MINISTERO DELL'ISTRUZIONE DELL'UNIVERSITA' E DELLA RICERCA,Varie,2017-12-16,22/12/2017,2200.00,"Videoproiettori per aule informatiche., bando numero: 1823122",https://www.acquistinretepa.it/opencms/opencms/main/impresa/strumenti/dettaglio.jsp?idT=1823122&tipoVis=descr&nome=Videoproiettori+per+aule+informatiche.&frompage=rdoAperte.jsp&orderBy=pubblicazione&sort=desc&__pagina=1&__element=paginazione,"Sat, 16 Dec 2017 02:00:00 +0200"
1823160,MINISTERO DELLA DIFESA,Varie,2017-12-16,27/12/2017,1192.75,"Smontaggio, sabbiatura e verniciatura bombole, bando numero: 1823160",https://www.acquistinretepa.it/opencms/opencms/main/impresa/strumenti/dettaglio.jsp?idT=1823160&tipoVis=descr&nome=Smontaggio%2C+sabbiatura+e+verniciatura+bombole&frompage=rdoAperte.jsp&orderBy=pubblicazione&sort=desc&__pagina=1&__element=paginazione,"Sat, 16 Dec 2017 02:00:00 +0200"
1823157,COMUNE DI AUGUSTA,Lavori di manutenzione,2017-12-16,19/01/2018,22214.04,"Copia di LAVORI DI MESSA IN SICUREZZA TRATTI DI STRADA DI PROPRIETA' COMUNALI, bando numero: 1823157",https://www.acquistinretepa.it/opencms/opencms/main/impresa/strumenti/dettaglio.jsp?idT=1823157&tipoVis=descr&nome=Copia+di+LAVORI+DI+MESSA+IN+SICUREZZA+TRATTI+DI+STRADA+DI+PROPRIETA%27+COMUNALI&frompage=rdoAperte.jsp&orderBy=pubblicazione&sort=desc&__pagina=1&__element=paginazione,"Sat, 16 Dec 2017 02:00:00 +0200"
1818961,MINISTERO DELL'ISTRUZIONE DELL'UNIVERSITA' E DELLA RICERCA,Varie,2017-12-16,04/01/2018,5000.00,"Acquisti per Progetto FesrPON-CA-2017-10 - Modulo ""Palestra"", bando numero: 1818961",https://www.acquistinretepa.it/opencms/opencms/main/impresa/strumenti/dettaglio.jsp?idT=1818961&tipoVis=descr&nome=Acquisti+per+Progetto+FesrPON-CA-2017-10+-+Modulo+%22Palestra%22&frompage=rdoAperte.jsp&orderBy=pubblicazione&sort=desc&__pagina=2&__element=paginazione,"Sat, 16 Dec 2017 02:00:00 +0200"
1823125,MINISTERO DELLA DIFESA,Varie,2017-12-16,27/12/2017,2295.08,"Fornitura materiali per manutenzione apparati efficienza linea, bando numero: 1823125",https://www.acquistinretepa.it/opencms/opencms/main/impresa/strumenti/dettaglio.jsp?idT=1823125&tipoVis=descr&nome=Fornitura+materiali+per+manutenzione+apparati+efficienza+linea&frompage=rdoAperte.jsp&orderBy=pubblicazione&sort=desc&__pagina=2&__element=paginazione,"Sat, 16 Dec 2017 02:00:00 +0200"
1823129,MINISTERO DELLA DIFESA,Varie,2017-12-16,22/12/2017,7459.00,"Fasc. 1256/17 – Acquisizione di strumentazione di diagnosi per i motori marini dei galleggianti imbarcati sulle nuove UU.NN della M.M., bando numero: 1823129",https://www.acquistinretepa.it/opencms/opencms/main/impresa/strumenti/dettaglio.jsp?idT=1823129&tipoVis=descr&nome=Fasc.+1256%2F17+%3F+Acquisizione+di+strumentazione+di+diagnosi+per+i+motori+marini+dei+galleggianti+imbarcati+sulle+nuove+UU.NN+della+M.M.&frompage=rdoAperte.jsp&orderBy=pubblicazione&sort=desc&__pagina=2&__element=paginazione,"Sat, 16 Dec 2017 02:00:00 +0200"
1821849,AZIENDA OSPEDALIERA OSPEDALI RIUNITI MARCHE NORD,Varie,2017-12-15,29/12/2017,40458.60,"Servizio di ritiro degli incassi, contazione valori e cambio monete, bando numero: 1821849",https://www.acquistinretepa.it/opencms/opencms/main/impresa/strumenti/dettaglio.jsp?idT=1821849&tipoVis=descr&nome=Servizio+di+ritiro+degli+incassi%2C+contazione+valori+e+cambio+monete&frompage=rdoAperte.jsp&orderBy=pubblicazione&sort=desc&__pagina=10&__element=paginazione,"Fri, 15 Dec 2017 02:00:00 +0200"
1816483,MINISTERO DELLA DIFESA,Varie,2017-12-15,20/12/2017,22622.85,"AN 109/17 - Smaltimento rifiuti speciali, bando numero: 1816483",https://www.acquistinretepa.it/opencms/opencms/main/impresa/strumenti/dettaglio.jsp?idT=1816483&tipoVis=descr&nome=AN+109%2F17+-+Smaltimento+rifiuti+speciali&frompage=rdoAperte.jsp&orderBy=pubblicazione&sort=desc&__pagina=10&__element=paginazione,"Fri, 15 Dec 2017 02:00:00 +0200"
1821987,CONSERVATORIO DI MUSICA E. R. DUNI,Varie,2017-12-15,29/12/2017,1254.29,"Set Di Corde, bando numero: 1821987",https://www.acquistinretepa.it/opencms/opencms/main/impresa/strumenti/dettaglio.jsp?idT=1821987&tipoVis=descr&nome=Set+Di+Corde&frompage=rdoAperte.jsp&orderBy=pubblicazione&sort=desc&__pagina=10&__element=paginazione,"Fri, 15 Dec 2017 02:00:00 +0200"
1821810,COMUNE DI SPOLETO,"Varie,Varie",2017-12-15,21/12/2017,117630.00,"FORNITURA DI MATERIALI (HARDWARE E SOFTWARE) E SERVIZI INFORMATICI PER GLI UFFICI DEL COMUNE DI SPOLETO, bando numero: 1821810",https://www.acquistinretepa.it/opencms/opencms/main/impresa/strumenti/dettaglio.jsp?idT=1821810&tipoVis=descr&nome=FORNITURA+DI+MATERIALI+%28HARDWARE+E+SOFTWARE%29+E+SERVIZI+INFORMATICI+PER+GLI+UFFICI+DEL+COMUNE+DI+SPOLETO&frompage=rdoAperte.jsp&orderBy=pubblicazione&sort=desc&__pagina=10&__element=paginazione,"Fri, 15 Dec 2017 02:00:00 +0200"
1814715,MINISTERO DELLA GIUSTIZIA,Varie,2017-12-15,28/12/2017,26000.00,"Fornitura di accessori storage e servizi manutenzione software di rete, bando numero: 1814715",https://www.acquistinretepa.it/opencms/opencms/main/impresa/strumenti/dettaglio.jsp?idT=1814715&tipoVis=descr&nome=Fornitura+di+accessori+storage+e+servizi+manutenzione+software+di+rete&frompage=rdoAperte.jsp&orderBy=pubblicazione&sort=desc&__pagina=10&__element=paginazione,"Fri, 15 Dec 2017 02:00:00 +0200"
1822003,AZIENDA OSPEDALIERA - UNIVERSITARIA OSPEDALE POLICLINICO CONSORZIALE BARI,Varie,2017-12-15,18/01/2018,209000.00,"SERVIZIO SPECIALISTICO SUPPORTO ORGANIZZATIVO FINALIZZATO ALLO SCOUTING E ACCESSO A FONDI COMUNITARI, bando numero: 1822003",https://www.acquistinretepa.it/opencms/opencms/main/impresa/strumenti/dettaglio.jsp?idT=1822003&tipoVis=descr&nome=SERVIZIO+SPECIALISTICO+SUPPORTO+ORGANIZZATIVO+FINALIZZATO+ALLO+SCOUTING+E+ACCESSO+A+FONDI+COMUNITARI&frompage=rdoAperte.jsp&orderBy=pubblicazione&sort=desc&__pagina=10&__element=paginazione,"Fri, 15 Dec 2017 02:00:00 +0200"
1822017,UNIONE DI COMUNI DELLA ROMAGNA FORLIVESE - UNIONE MONTANA,Varie,2017-12-15,10/01/2018,5500.00,"FORNITURA GRUPPI DI CONTINUITA' MARCA APC E RICAMBI ORIGINALI, bando numero: 1822017",https://www.acquistinretepa.it/opencms/opencms/main/impresa/strumenti/dettaglio.jsp?idT=1822017&tipoVis=descr&nome=FORNITURA+GRUPPI+DI+CONTINUITA%27+MARCA+APC+E+RICAMBI+ORIGINALI&frompage=rdoAperte.jsp&orderBy=pubblicazione&sort=desc&__pagina=10&__element=paginazione,"Fri, 15 Dec 2017 02:00:00 +0200"
1821826,AZIENDA SANITARIA PROVINCIALE DI CATANIA,Varie,2017-12-15,16/01/2018,147540.98,"Noleggio di un camper attrezzato denominato “Centro Cardiologico Ambulatoriale Mobile”., bando numero: 1821826",https://www.acquistinretepa.it/opencms/opencms/main/impresa/strumenti/dettaglio.jsp?idT=1821826&tipoVis=descr&nome=Noleggio+di+un+camper+attrezzato+denominato+%3FCentro+Cardiologico+Ambulatoriale+Mobile%3F.&frompage=rdoAperte.jsp&orderBy=pubblicazione&sort=desc&__pagina=10&__element=paginazione,"Fri, 15 Dec 2017 02:00:00 +0200"
1821972,AZIENDA SANITARIA PROVINCIALE DI PALERMO,Varie,2017-12-15,05/01/2018,194000.00,"Affidamento lavori di manutenzione degli spazi a verde ed aree connesse dell'azienda sanitaria provinciale di palermo, bando numero: 1821972",https://www.acquistinretepa.it/opencms/opencms/main/impresa/strumenti/dettaglio.jsp?idT=1821972&tipoVis=descr&nome=Affidamento+lavori+di+manutenzione+degli+spazi+a+verde+ed+aree+connesse+dell%27azienda+sanitaria+provinciale+di+palermo&frompage=rdoAperte.jsp&orderBy=pubblicazione&sort=desc&__pagina=10&__element=paginazione,"Fri, 15 Dec 2017 02:00:00 +0200"
1815999,AZIENDA OSPEDALIERA DI RILIEVO NAZIONALE E DI ALTA SPECIALIZZAZIONE - GARIBALDI CATANIA,Varie,2017-12-15,10/01/2018,48500.00,"FORNITURA N.2 INSUFFLATORI LAPAROSCOPICI DI CO2 - LOTTI 2, bando numero: 1815999",https://www.acquistinretepa.it/opencms/opencms/main/impresa/strumenti/dettaglio.jsp?idT=1815999&tipoVis=descr&nome=FORNITURA+N.2+INSUFFLATORI+LAPAROSCOPICI+DI+CO2+-+LOTTI+2&frompage=rdoAperte.jsp&orderBy=pubblicazione&sort=desc&__pagina=10&__element=paginazione,"Fri, 15 Dec 2017 02:00:00 +0200"
1821891,COMUNE DI BISCEGLIE,Varie,2017-12-15,20/12/2017,9268.00,"Parco giochi inclusivo via Verdi, bando numero: 1821891",https://www.acquistinretepa.it/opencms/opencms/main/impresa/strumenti/dettaglio.jsp?idT=1821891&tipoVis=descr&nome=Parco+giochi+inclusivo+via+Verdi&frompage=rdoAperte.jsp&orderBy=pubblicazione&sort=desc&__pagina=11&__element=paginazione,"Fri, 15 Dec 2017 02:00:00 +0200"
1821749,COMUNE DI MARIGLIANO,Varie,2017-12-15,27/12/2017,18852.46,"Acquistp trattore e trincia, bando numero: 1821749",https://www.acquistinretepa.it/opencms/opencms/main/impresa/strumenti/dettaglio.jsp?idT=1821749&tipoVis=descr&nome=Acquistp+trattore+e+trincia&frompage=rdoAperte.jsp&orderBy=pubblicazione&sort=desc&__pagina=11&__element=paginazione,"Fri, 15 Dec 2017 02:00:00 +0200"
1821957,COMUNE DI SOMMACAMPAGNA,Varie,2017-12-15,20/12/2017,20000.00,"FORNITURA DI APPARECCHI PER L’ILLUMINAZIONE DI EMERGENZA PER EDIFICI SCOLASTICI, bando numero: 1821957",https://www.acquistinretepa.it/opencms/opencms/main/impresa/strumenti/dettaglio.jsp?idT=1821957&tipoVis=descr&nome=FORNITURA+DI+APPARECCHI+PER+L%3FILLUMINAZIONE+DI+EMERGENZA+PER+EDIFICI+SCOLASTICI&frompage=rdoAperte.jsp&orderBy=pubblicazione&sort=desc&__pagina=11&__element=paginazione,"Fri, 15 Dec 2017 02:00:00 +0200"
1820933,AZIENDA SANITARIA PROVINCIALE DI RAGUSA,Varie,2017-12-15,28/12/2017,2000.00,"Fornitura di un applicativo Web per la gestione delle comunicazione all'Anac, ai sensi dell'art. 1 comma 32 legge 190 e succ modifiche per durata anni 3, bando numero: 1820933",https://www.acquistinretepa.it/opencms/opencms/main/impresa/strumenti/dettaglio.jsp?idT=1820933&tipoVis=descr&nome=Fornitura+di+un+applicativo+Web+per+la+gestione+delle+comunicazione+all%27Anac%2C+ai+sensi+dell%27art.+1+comma+32+legge+190+e+succ+modifiche+per+durata+anni+3&frompage=rdoAperte.jsp&orderBy=pubblicazione&sort=desc&__pagina=11&__element=paginazione,"Fri, 15 Dec 2017 02:00:00 +0200"
1821866,MINISTERO DELLA DIFESA,Varie,2017-12-15,19/12/2017,443.00,"FORNITURA DI UNA TROMBA COME DA SPECIFICHE TECNICHE IN ALLEGATO ""A"", bando numero: 1821866",https://www.acquistinretepa.it/opencms/opencms/main/impresa/strumenti/dettaglio.jsp?idT=1821866&tipoVis=descr&nome=FORNITURA+DI+UNA+TROMBA+COME+DA+SPECIFICHE+TECNICHE+IN+ALLEGATO+%22A%22&frompage=rdoAperte.jsp&orderBy=pubblicazione&sort=desc&__pagina=11&__element=paginazione,"Fri, 15 Dec 2017 02:00:00 +0200"
1817600,CREA - CONSIGLIO PER LA RICERCA IN AGRICOLTURA E L'ANALISI DELL'ECONOMIA AGRARIA,Varie,2017-12-15,12/01/2018,4150.00,"ANTISIERI PER LE SEDI DC AREA CERTIFICAZIONE, bando numero: 1817600",https://www.acquistinretepa.it/opencms/opencms/main/impresa/strumenti/dettaglio.jsp?idT=1817600&tipoVis=descr&nome=ANTISIERI+PER+LE+SEDI+DC+AREA+CERTIFICAZIONE&frompage=rdoAperte.jsp&orderBy=pubblicazione&sort=desc&__pagina=11&__element=paginazione,"Fri, 15 Dec 2017 02:00:00 +0200"
1820795,COMUNE DI MILANO,Varie,2017-12-15,30/12/2017,39961.00,"Approvvigionamento di licenze software del sistema operativo Microsoft Windows 10 Education e Microsoft Office 2016 Educational per le esigenze della Direzione Educazione del Comune di Milano., bando numero: 1820795",https://www.acquistinretepa.it/opencms/opencms/main/impresa/strumenti/dettaglio.jsp?idT=1820795&tipoVis=descr&nome=Approvvigionamento+di+licenze+software+del+sistema+operativo+Microsoft+Windows+10+Education+e+Microsoft+Office+2016+Educational+per+le+esigenze+della+Direzione+Educazione+del+Comune+di+Milano.&frompage=rdoAperte.jsp&orderBy=pubblicazione&sort=desc&__pagina=11&__element=paginazione,"Fri, 15 Dec 2017 02:00:00 +0200"
1821777,AZIENDA OSPEDALIERA OSPEDALI RIUNITI MARCHE NORD,Varie,2017-12-15,29/12/2017,45000.00,"Servizio di cassa a tesoreria unica, bando numero: 1821777",https://www.acquistinretepa.it/opencms/opencms/main/impresa/strumenti/dettaglio.jsp?idT=1821777&tipoVis=descr&nome=Servizio+di+cassa+a+tesoreria+unica&frompage=rdoAperte.jsp&orderBy=pubblicazione&sort=desc&__pagina=11&__element=paginazione,"Fri, 15 Dec 2017 02:00:00 +0200"
1819290,AZIENDA SANITARIA PROVINCIALE DI ENNA,Varie,2017-12-15,30/12/2017,38000.00,"MICROSCOPI DA LABORATORIO, bando numero: 1819290",https://www.acquistinretepa.it/opencms/opencms/main/impresa/strumenti/dettaglio.jsp?idT=1819290&tipoVis=descr&nome=MICROSCOPI+DA+LABORATORIO&frompage=rdoAperte.jsp&orderBy=pubblicazione&sort=desc&__pagina=11&__element=paginazione,"Fri, 15 Dec 2017 02:00:00 +0200"
1814677,AZIENDA OSPEDALIERO - UNIVERSITARIA S. LUIGI GONZAGA DI ORBASSANO,Varie,2017-12-15,12/01/2018,110000.00,"FORNITURA DI TONER ORIGINALI PER STAMPANTI OCCORRENTI ALL'A.O.U. SAN LUIGI GONZAGA DI ORBASSANO, bando numero: 1814677",https://www.acquistinretepa.it/opencms/opencms/main/impresa/strumenti/dettaglio.jsp?idT=1814677&tipoVis=descr&nome=FORNITURA+DI+TONER+ORIGINALI+PER+STAMPANTI+OCCORRENTI+ALL%27A.O.U.+SAN+LUIGI+GONZAGA+DI+ORBASSANO&frompage=rdoAperte.jsp&orderBy=pubblicazione&sort=desc&__pagina=11&__element=paginazione,"Fri, 15 Dec 2017 02:00:00 +0200"
1821695,MINISTERO DELLA DIFESA,Varie,2017-12-15,19/12/2017,561.63,"FORNITURA DI TUTE DA LAVORO COME DA SPECIFICHE TECNICHE IN ALLEGATO ""A"", bando numero: 1821695",https://www.acquistinretepa.it/opencms/opencms/main/impresa/strumenti/dettaglio.jsp?idT=1821695&tipoVis=descr&nome=FORNITURA+DI+TUTE+DA+LAVORO+COME+DA+SPECIFICHE+TECNICHE+IN+ALLEGATO+%22A%22&frompage=rdoAperte.jsp&orderBy=pubblicazione&sort=desc&__pagina=12&__element=paginazione,"Fri, 15 Dec 2017 02:00:00 +0200"
1821657,POLITECNICO DI TORINO,Varie,2017-12-15,16/01/2018,17500.00,"DET_POLITECNICO DI TORINO - attrezzatura scientifica - GALB (CIG ZD02153FD2), bando numero: 1821657",https://www.acquistinretepa.it/opencms/opencms/main/impresa/strumenti/dettaglio.jsp?idT=1821657&tipoVis=descr&nome=DET_POLITECNICO+DI+TORINO+-+attrezzatura+scientifica+-+GALB+%28CIG+ZD02153FD2%29&frompage=rdoAperte.jsp&orderBy=pubblicazione&sort=desc&__pagina=12&__element=paginazione,"Fri, 15 Dec 2017 02:00:00 +0200"
1817569,AZIENDA OSPEDALIERA PADOVA,Varie,2017-12-15,10/01/2018,100000.00,"Acquisto di switch Ethernet di piano Extreme Networks, bando numero: 1817569",https://www.acquistinretepa.it/opencms/opencms/main/impresa/strumenti/dettaglio.jsp?idT=1817569&tipoVis=descr&nome=Acquisto+di+switch+Ethernet+di+piano+Extreme+Networks&frompage=rdoAperte.jsp&orderBy=pubblicazione&sort=desc&__pagina=12&__element=paginazione,"Fri, 15 Dec 2017 02:00:00 +0200"
1816006,AZIENDA OSPEDALIERA UNIVERSITARIA FEDERICO II,Varie,2017-12-15,05/01/2018,12000.00,"Copia di FORNITURA N° 6 ASPIRATORI A PARETE, bando numero: 1816006",https://www.acquistinretepa.it/opencms/opencms/main/impresa/strumenti/dettaglio.jsp?idT=1816006&tipoVis=descr&nome=Copia+di+FORNITURA+N%B0+6+ASPIRATORI+A+PARETE&frompage=rdoAperte.jsp&orderBy=pubblicazione&sort=desc&__pagina=12&__element=paginazione,"Fri, 15 Dec 2017 02:00:00 +0200"
1820983,COMUNE DI RIVOLI,"Lavori di manutenzione,Lavori di manutenzione,Lavori di manutenzione",2017-12-15,02/02/2018,289709.71,"LAVORI DI RIQUALIFICAZIONE, RISANAMENTO CONSERVATIVO E MANUTENZIONE STRAORDINARIA EDIFICI SCOLASTICI : CASA DEL SOLE E RODARI, bando numero: 1820983",https://www.acquistinretepa.it/opencms/opencms/main/impresa/strumenti/dettaglio.jsp?idT=1820983&tipoVis=descr&nome=LAVORI+DI+RIQUALIFICAZIONE%2C+RISANAMENTO+CONSERVATIVO+E+MANUTENZIONE+STRAORDINARIA+EDIFICI+SCOLASTICI+%3A+CASA+DEL+SOLE+E+RODARI&frompage=rdoAperte.jsp&orderBy=pubblicazione&sort=desc&__pagina=12&__element=paginazione,"Fri, 15 Dec 2017 02:00:00 +0200"
1816053,AZIENDA OSPEDALIERO - UNIVERSITARIA MAGGIORE DELLA CARITA' DI NOVARA,Varie,2017-12-15,28/12/2017,23579.00,"A.O.U. ""MAGGIORE DELLA CARITA' DI NOVARA - FORNITURA DI TRAVERSE SALVAMATERASSO RIMBOCCABILI MIS. 80 X 180, bando numero: 1816053",https://www.acquistinretepa.it/opencms/opencms/main/impresa/strumenti/dettaglio.jsp?idT=1816053&tipoVis=descr&nome=A.O.U.+%22MAGGIORE+DELLA+CARITA%27+DI+NOVARA+-+FORNITURA+DI+TRAVERSE+SALVAMATERASSO+RIMBOCCABILI+MIS.+80+X+180&frompage=rdoAperte.jsp&orderBy=pubblicazione&sort=desc&__pagina=12&__element=paginazione,"Fri, 15 Dec 2017 02:00:00 +0200"
1813208,AZIENDA OSPEDALIERO - UNIVERSITARIA MAGGIORE DELLA CARITA' DI NOVARA,Varie,2017-12-15,28/12/2017,19865.00,"A.O.U. ""MAGGIORE DELLA CARITA'"" DI NOVARA - FORNITURA DI PANNOLONI MUTANDINA MIS GRANDE , ASSORBENTI IGIENICI DONNA E MUTANDINE A RETE PIU' MISURE, bando numero: 1813208",https://www.acquistinretepa.it/opencms/opencms/main/impresa/strumenti/dettaglio.jsp?idT=1813208&tipoVis=descr&nome=A.O.U.+%22MAGGIORE+DELLA+CARITA%27%22+DI+NOVARA+-+FORNITURA+DI+PANNOLONI+MUTANDINA+MIS+GRANDE+%2C+ASSORBENTI+IGIENICI+DONNA+E+MUTANDINE+A+RETE+PIU%27+MISURE&frompage=rdoAperte.jsp&orderBy=pubblicazione&sort=desc&__pagina=12&__element=paginazione,"Fri, 15 Dec 2017 02:00:00 +0200"
1821571,MINISTERO DELLA DIFESA,Varie,2017-12-15,19/12/2017,369.00,"ACQUISIZIONE DI ARREDI COME DA SPECIFICHE TECNICHE IN ALLEGATO ""A"", bando numero: 1821571",https://www.acquistinretepa.it/opencms/opencms/main/impresa/strumenti/dettaglio.jsp?idT=1821571&tipoVis=descr&nome=ACQUISIZIONE+DI+ARREDI+COME+DA+SPECIFICHE+TECNICHE+IN+ALLEGATO+%22A%22&frompage=rdoAperte.jsp&orderBy=pubblicazione&sort=desc&__pagina=12&__element=paginazione,"Fri, 15 Dec 2017 02:00:00 +0200"
1820979,AZIENDA SANITARIA PROVINCIALE DI CATANIA,Varie,2017-12-15,10/01/2018,25000.00,"ASP CT Fornitura di colposcopio completo di telecamera integrata con sistema di acquisizione e archiviazione digitale di dati e immagini, da destinare alla U.O. di Screening Ginecologico., bando numero: 1820979",https://www.acquistinretepa.it/opencms/opencms/main/impresa/strumenti/dettaglio.jsp?idT=1820979&tipoVis=descr&nome=ASP+CT+Fornitura+di+colposcopio+completo+di+telecamera+integrata+con+sistema+di+acquisizione+e+archiviazione+digitale+di+dati+e+immagini%2C+da+destinare+alla+U.O.+di+Screening+Ginecologico.&frompage=rdoAperte.jsp&orderBy=pubblicazione&sort=desc&__pagina=12&__element=paginazione,"Fri, 15 Dec 2017 02:00:00 +0200"
1819974,AZIENDA OSPEDALIERA - UNIVERSITARIA OSPEDALE POLICLINICO CONSORZIALE BARI,Varie,2017-12-15,10/01/2018,197900.00,"SUTURATRICI ENDOSCOPICHE, bando numero: 1819974",https://www.acquistinretepa.it/opencms/opencms/main/impresa/strumenti/dettaglio.jsp?idT=1819974&tipoVis=descr&nome=SUTURATRICI+ENDOSCOPICHE&frompage=rdoAperte.jsp&orderBy=pubblicazione&sort=desc&__pagina=12&__element=paginazione,"Fri, 15 Dec 2017 02:00:00 +0200"
1815061,AZIENDA SERVIZI SOCIALI BOLZANO,Varie,2017-12-15,22/12/2017,4800.00,"Materiale per parrucchiera e per la cura e l’igiene del corpo per la Ripartizione Strutture residenziali e semiresidenziali Bolzano, bando numero: 1815061",https://www.acquistinretepa.it/opencms/opencms/main/impresa/strumenti/dettaglio.jsp?idT=1815061&tipoVis=descr&nome=Materiale+per+parrucchiera+e+per+la+cura+e+l%3Figiene+del+corpo+per+la+Ripartizione+Strutture+residenziali+e+semiresidenziali+Bolzano&frompage=rdoAperte.jsp&orderBy=pubblicazione&sort=desc&__pagina=13&__element=paginazione,"Fri, 15 Dec 2017 02:00:00 +0200"
1819750,COMUNE DI GENOVA,Varie,2017-12-15,26/01/2018,40000.00,"AFFIDAMENTO DI UN SERVIZIO DI ANALISI TECNICA ED ECONOMICA FINALIZZATA ALL’ELABORAZIONE DI UN PIANO STRATEGICO DI VALORIZZAZIONE DI ALCUNI IMMOBILI DI CIVICA PROPRIETÀ, bando numero: 1819750",https://www.acquistinretepa.it/opencms/opencms/main/impresa/strumenti/dettaglio.jsp?idT=1819750&tipoVis=descr&nome=AFFIDAMENTO+DI+UN+SERVIZIO+DI+ANALISI+TECNICA+ED+ECONOMICA+FINALIZZATA+ALL%3FELABORAZIONE+DI+UN+PIANO+STRATEGICO+DI+VALORIZZAZIONE+DI+ALCUNI+IMMOBILI+DI+CIVICA+PROPRIET%C0&frompage=rdoAperte.jsp&orderBy=pubblicazione&sort=desc&__pagina=13&__element=paginazione,"Fri, 15 Dec 2017 02:00:00 +0200"
1814232,UNIVERSITA' DEGLI STUDI DI PADOVA,Varie,2017-12-15,08/01/2018,2000.00,"Notebook + ram, bando numero: 1814232",https://www.acquistinretepa.it/opencms/opencms/main/impresa/strumenti/dettaglio.jsp?idT=1814232&tipoVis=descr&nome=Notebook+%2B+ram&frompage=rdoAperte.jsp&orderBy=pubblicazione&sort=desc&__pagina=13&__element=paginazione,"Fri, 15 Dec 2017 02:00:00 +0200"
1818212,I.N.F.N. - ISTITUTO NAZIONALE DI FISICA NUCLEARE,Varie,2017-12-15,22/12/2017,1620.00,"Fornitura di nastri LTO7 per backup, bando numero: 1818212",https://www.acquistinretepa.it/opencms/opencms/main/impresa/strumenti/dettaglio.jsp?idT=1818212&tipoVis=descr&nome=Fornitura+di+nastri+LTO7+per+backup&frompage=rdoAperte.jsp&orderBy=pubblicazione&sort=desc&__pagina=13&__element=paginazione,"Fri, 15 Dec 2017 02:00:00 +0200"
1817647,AZIENDA OSPEDALIERA UNIVERSITARIA FEDERICO II,Varie,2017-12-15,05/01/2018,3500.00,"Fornitura di pedana mobile per ecg da sforzo - gara 3676, bando numero: 1817647",https://www.acquistinretepa.it/opencms/opencms/main/impresa/strumenti/dettaglio.jsp?idT=1817647&tipoVis=descr&nome=Fornitura+di+pedana+mobile+per+ecg+da+sforzo+-+gara+3676&frompage=rdoAperte.jsp&orderBy=pubblicazione&sort=desc&__pagina=13&__element=paginazione,"Fri, 15 Dec 2017 02:00:00 +0200"
1821347,AZIENDA SANITARIA PROVINCIALE DI ENNA,Varie,2017-12-15,04/01/2018,10000.00,"ATTREZZATURE INFORMATICHE CSM, bando numero: 1821347",https://www.acquistinretepa.it/opencms/opencms/main/impresa/strumenti/dettaglio.jsp?idT=1821347&tipoVis=descr&nome=ATTREZZATURE+INFORMATICHE+CSM&frompage=rdoAperte.jsp&orderBy=pubblicazione&sort=desc&__pagina=13&__element=paginazione,"Fri, 15 Dec 2017 02:00:00 +0200"
