numero,enteCommittente,categoria,pubblicazione,scadenza,valore:number,descrizione,url,datarss
1807342,AZIENDA SANITARIA PROVINCIALE DI MESSINA,Varie,2017-12-06,22/12/2017,71146.43,"Gara, suddivisa in 7 lotti, per la fornitura di n. 1 isola neonatale ed altre attrezzature occorrenti alla UOC Pediatria TIN del PO di Patti, bando numero: 1807342",https://www.acquistinretepa.it/opencms/opencms/main/impresa/strumenti/dettaglio.jsp?idT=1807342&tipoVis=descr&nome=Gara%2C+suddivisa+in+7+lotti%2C+per+la+fornitura+di+n.+1+isola+neonatale+ed+altre+attrezzature+occorrenti+alla+UOC+Pediatria+TIN+del+PO+di+Patti&frompage=rdoAperte.jsp&orderBy=pubblicazione&sort=desc&__pagina=84&__element=paginazione,"Wed, 06 Dec 2017 02:00:00 +0200"
1770903,MINISTERO DEI BENI E DELLE ATTIVITA' CULTURALI E DEL TURISMO,Varie,2017-12-06,20/12/2017,941.34,"FORNITURA CANCELLERIA, bando numero: 1770903",https://www.acquistinretepa.it/opencms/opencms/main/impresa/strumenti/dettaglio.jsp?idT=1770903&tipoVis=descr&nome=FORNITURA+CANCELLERIA&frompage=rdoAperte.jsp&orderBy=pubblicazione&sort=desc&__pagina=84&__element=paginazione,"Wed, 06 Dec 2017 02:00:00 +0200"
1800292,AZIENDA OSPEDALIERA SAN CAMILLO FORLANINI ROMA,Varie,2017-12-06,21/12/2017,2800.00,"Fabbisogno biennale etichette grandi per il SIMT, bando numero: 1800292",https://www.acquistinretepa.it/opencms/opencms/main/impresa/strumenti/dettaglio.jsp?idT=1800292&tipoVis=descr&nome=Fabbisogno+biennale+etichette+grandi+per+il+SIMT&frompage=rdoAperte.jsp&orderBy=pubblicazione&sort=desc&__pagina=84&__element=paginazione,"Wed, 06 Dec 2017 02:00:00 +0200"
1807527,AZIENDA OSPEDALIERA SAN CAMILLO FORLANINI ROMA,Varie,2017-12-06,21/12/2017,7000.00,"Fabbisogno annuale di maschere per contenzione pazienti per trattamenti radioterapici, bando numero: 1807527",https://www.acquistinretepa.it/opencms/opencms/main/impresa/strumenti/dettaglio.jsp?idT=1807527&tipoVis=descr&nome=Fabbisogno+annuale+di+maschere+per+contenzione+pazienti+per+trattamenti+radioterapici&frompage=rdoAperte.jsp&orderBy=pubblicazione&sort=desc&__pagina=84&__element=paginazione,"Wed, 06 Dec 2017 02:00:00 +0200"
1802753,AZIENDA OSPEDALIERA SAN CAMILLO FORLANINI ROMA,Varie,2017-12-06,18/12/2017,14000.00,"Fabbisogno biennale buste per trasporto farmaci chemioterapici, bando numero: 1802753",https://www.acquistinretepa.it/opencms/opencms/main/impresa/strumenti/dettaglio.jsp?idT=1802753&tipoVis=descr&nome=Fabbisogno+biennale+buste+per+trasporto+farmaci+chemioterapici&frompage=rdoAperte.jsp&orderBy=pubblicazione&sort=desc&__pagina=85&__element=paginazione,"Wed, 06 Dec 2017 02:00:00 +0200"
1767683,MINISTERO DELL'ISTRUZIONE DELL'UNIVERSITA' E DELLA RICERCA,Varie,2017-12-06,20/12/2017,11803.28,"ATELIER CREATIVI - 2017, bando numero: 1767683",https://www.acquistinretepa.it/opencms/opencms/main/impresa/strumenti/dettaglio.jsp?idT=1767683&tipoVis=descr&nome=ATELIER+CREATIVI+-+2017&frompage=rdoAperte.jsp&orderBy=pubblicazione&sort=desc&__pagina=85&__element=paginazione,"Wed, 06 Dec 2017 02:00:00 +0200"
1807123,COMUNE DI EBOLI,Varie,2017-12-05,20/12/2017,134892.07,"DETERMINA A CONTRARRE DI INDIZIONE GARA TELEMATICA APERTA SU PIATTAFORMA MEPA PER L'AFFIDAMENTO DEL SERVIZIO GESTIONALE DEL PROGRAMMA HOME CARE PREMIUM 2017 DELL'INPS PER L'AMBITO TERRITORIALE S3 EX S5 FINO AL 31.12.2018, bando numero: 1807123",https://www.acquistinretepa.it/opencms/opencms/main/impresa/strumenti/dettaglio.jsp?idT=1807123&tipoVis=descr&nome=DETERMINA+A+CONTRARRE+DI+INDIZIONE+GARA+TELEMATICA+APERTA+SU+PIATTAFORMA+MEPA+PER+L%27AFFIDAMENTO+DEL+SERVIZIO+GESTIONALE+DEL+PROGRAMMA+HOME+CARE+PREMIUM+2017+DELL%27INPS+PER+L%27AMBITO+TERRITORIALE+S3+EX+S5+FINO+AL+31.12.2018&frompage=rdoAperte.jsp&orderBy=pubblicazione&sort=desc&__pagina=85&__element=paginazione,"Tue, 05 Dec 2017 02:00:00 +0200"
1806309,COMUNE DI MONTEBELLUNA,Varie,2017-12-05,27/12/2017,72900.00,"Servizio di conduzione, manutenzione ordinaria programmata, manutenzione straordinaria, assunzione del ruolo di terzo responsabile degli impianti termici e di condizionamento degli edifici comunali - anno 2018, bando numero: 1806309",https://www.acquistinretepa.it/opencms/opencms/main/impresa/strumenti/dettaglio.jsp?idT=1806309&tipoVis=descr&nome=Servizio+di+conduzione%2C+manutenzione+ordinaria+programmata%2C+manutenzione+straordinaria%2C+assunzione+del+ruolo+di+terzo+responsabile+degli+impianti+termici+e+di+condizionamento+degli+edifici+comunali+-+anno+2018&frompage=rdoAperte.jsp&orderBy=pubblicazione&sort=desc&__pagina=85&__element=paginazione,"Tue, 05 Dec 2017 02:00:00 +0200"
1805902,MINISTERO DELLA DIFESA,Varie,2017-12-05,20/12/2017,48710.00,"APPROVVIGIONAMENTO VARIO MATERIALE PER SITI PERIFERICI DEL CENTRO COME DA RISPETTIVI CAPITOLATI TECNICI ALLEGATI, bando numero: 1805902",https://www.acquistinretepa.it/opencms/opencms/main/impresa/strumenti/dettaglio.jsp?idT=1805902&tipoVis=descr&nome=APPROVVIGIONAMENTO+VARIO+MATERIALE+PER+SITI+PERIFERICI+DEL+CENTRO+COME+DA+RISPETTIVI+CAPITOLATI+TECNICI+ALLEGATI&frompage=rdoAperte.jsp&orderBy=pubblicazione&sort=desc&__pagina=85&__element=paginazione,"Tue, 05 Dec 2017 02:00:00 +0200"
1803448,AZIENDA OSPEDALIERO-UNIVERSITARIA OSPEDALI RIUNITI UMBERTO I - G.M. LANCISI - G. SALESI,Varie,2017-12-05,19/12/2017,11700.00,"1810 CF - FORNITURA BIENNALE FAX MULTIFUNZIONE, bando numero: 1803448",https://www.acquistinretepa.it/opencms/opencms/main/impresa/strumenti/dettaglio.jsp?idT=1803448&tipoVis=descr&nome=1810+CF+-+FORNITURA+BIENNALE+FAX+MULTIFUNZIONE&frompage=rdoAperte.jsp&orderBy=pubblicazione&sort=desc&__pagina=85&__element=paginazione,"Tue, 05 Dec 2017 02:00:00 +0200"
1801547,COMUNE DI MONDOVÌ,Varie,2017-12-05,30/12/2017,9000.00,"Affidamento servizi di organizzazione di iniziative didattiche e formative nell’ambito del progetto “Nati per leggere” 2018 nel territorio monregalese, bando numero: 1801547",https://www.acquistinretepa.it/opencms/opencms/main/impresa/strumenti/dettaglio.jsp?idT=1801547&tipoVis=descr&nome=Affidamento+servizi+di+organizzazione+di+iniziative+didattiche+e+formative+nell%3Fambito+del+progetto+%3FNati+per+leggere%3F+2018+nel+territorio+monregalese&frompage=rdoAperte.jsp&orderBy=pubblicazione&sort=desc&__pagina=85&__element=paginazione,"Tue, 05 Dec 2017 02:00:00 +0200"
1761201,COMUNE DI REGGIO DI CALABRIA,Varie,2017-12-05,09/01/2018,176623.36,"NIDO DI INFANZIA AZIENDALE COMUNALE PRESSO CE.DIR, bando numero: 1761201",https://www.acquistinretepa.it/opencms/opencms/main/impresa/strumenti/dettaglio.jsp?idT=1761201&tipoVis=descr&nome=NIDO+DI+INFANZIA+AZIENDALE+COMUNALE+PRESSO+CE.DIR&frompage=rdoAperte.jsp&orderBy=pubblicazione&sort=desc&__pagina=85&__element=paginazione,"Tue, 05 Dec 2017 02:00:00 +0200"
1801768,REGIONE MARCHE,Varie,2017-12-05,20/12/2017,176229.51,"Manutenzione del Sistema Integrato Radio Telecomunicazioni e Video sorveglianza (SIRTEV) della Regione Marche, bando numero: 1801768",https://www.acquistinretepa.it/opencms/opencms/main/impresa/strumenti/dettaglio.jsp?idT=1801768&tipoVis=descr&nome=Manutenzione+del+Sistema+Integrato+Radio+Telecomunicazioni+e+Video+sorveglianza+%28SIRTEV%29+della+Regione+Marche&frompage=rdoAperte.jsp&orderBy=pubblicazione&sort=desc&__pagina=85&__element=paginazione,"Tue, 05 Dec 2017 02:00:00 +0200"
1744589,AZIENDA PER LA TUTELA DELLA SALUTE - SARDEGNA,Varie,2017-12-05,02/01/2018,8000.00,"Arredi sanitari per Casa della Salute di Gavoi, bando numero: 1744589",https://www.acquistinretepa.it/opencms/opencms/main/impresa/strumenti/dettaglio.jsp?idT=1744589&tipoVis=descr&nome=Arredi+sanitari+per+Casa+della+Salute+di+Gavoi&frompage=rdoAperte.jsp&orderBy=pubblicazione&sort=desc&__pagina=85&__element=paginazione,"Tue, 05 Dec 2017 02:00:00 +0200"
1806944,AZIENDA SANITARIA PROVINCIALE DI MESSINA,Varie,2017-12-05,20/12/2017,300.90,"Procedura negoziata per la fornitura  di una sdraio per vasca riconducibile  a seggiolone cod. ISO 18.09.18.003, bando numero: 1806944",https://www.acquistinretepa.it/opencms/opencms/main/impresa/strumenti/dettaglio.jsp?idT=1806944&tipoVis=descr&nome=Procedura+negoziata+per+la+fornitura++di+una+sdraio+per+vasca+riconducibile++a+seggiolone+cod.+ISO+18.09.18.003&frompage=rdoAperte.jsp&orderBy=pubblicazione&sort=desc&__pagina=86&__element=paginazione,"Tue, 05 Dec 2017 02:00:00 +0200"
1806970,MINISTERO DELLA DIFESA,Varie,2017-12-05,20/12/2017,1300.00,"RT225 - MANUTENZIONE IMPIANTO VIDEOSORVEGLIANZA PALAZZO REVERBERI BRESSANONE (BZ) - SOPRALLUOGO OBBLIGATORIO, bando numero: 1806970",https://www.acquistinretepa.it/opencms/opencms/main/impresa/strumenti/dettaglio.jsp?idT=1806970&tipoVis=descr&nome=RT225+-+MANUTENZIONE+IMPIANTO+VIDEOSORVEGLIANZA+PALAZZO+REVERBERI+BRESSANONE+%28BZ%29+-+SOPRALLUOGO+OBBLIGATORIO&frompage=rdoAperte.jsp&orderBy=pubblicazione&sort=desc&__pagina=86&__element=paginazione,"Tue, 05 Dec 2017 02:00:00 +0200"
1806842,ARPA - CALABRIA,Varie,2017-12-05,10/01/2018,20000.00,"Procedura negoziata tramite RDO, da aggiudicare secondo il criterio dell’offerta economicamente più vantaggiosa, per l’affidamento del servizio di installazione in rilocazione, configurazione e personalizzazione, manutenzione correttiva e adattativa per mesi 15 del sistema software acquisito in riuso a cessione semplice dalla Regione Calabria denominato:  PERSEO, bando numero: 1806842",https://www.acquistinretepa.it/opencms/opencms/main/impresa/strumenti/dettaglio.jsp?idT=1806842&tipoVis=descr&nome=Procedura+negoziata+tramite+RDO%2C+da+aggiudicare+secondo+il+criterio+dell%3Fofferta+economicamente+pi%F9+vantaggiosa%2C+per+l%3Faffidamento+del+servizio+di+installazione+in+rilocazione%2C+configurazione+e+personalizzazione%2C+manutenzione+correttiva+e+adattativa+per+mesi+15+del+sistema+software+acquisito+in+riuso+a+cessione+semplice+dalla+Regione+Calabria+denominato%3A++PERSEO&frompage=rdoAperte.jsp&orderBy=pubblicazione&sort=desc&__pagina=86&__element=paginazione,"Tue, 05 Dec 2017 02:00:00 +0200"
1806896,UNIONE DEI COMUNI DEL SORBARA,Varie,2017-12-05,20/12/2017,1250.00,"Fornitura guanti monouso, bando numero: 1806896",https://www.acquistinretepa.it/opencms/opencms/main/impresa/strumenti/dettaglio.jsp?idT=1806896&tipoVis=descr&nome=Fornitura+guanti+monouso&frompage=rdoAperte.jsp&orderBy=pubblicazione&sort=desc&__pagina=86&__element=paginazione,"Tue, 05 Dec 2017 02:00:00 +0200"
1803468,COMUNE DI MILANO,Varie,2017-12-05,02/01/2018,207430.00,"Fornitura di una soluzione software e relativi servizi professionali per il nuovo ambiente di back office dello Sportello Digitale Edilizio della Direzione Urbanistica., bando numero: 1803468",https://www.acquistinretepa.it/opencms/opencms/main/impresa/strumenti/dettaglio.jsp?idT=1803468&tipoVis=descr&nome=Fornitura+di+una+soluzione+software+e+relativi+servizi+professionali+per+il+nuovo+ambiente+di+back+office+dello+Sportello+Digitale+Edilizio+della+Direzione+Urbanistica.&frompage=rdoAperte.jsp&orderBy=pubblicazione&sort=desc&__pagina=86&__element=paginazione,"Tue, 05 Dec 2017 02:00:00 +0200"
1798846,UNIVERSITA' DEGLI STUDI DI PADOVA,Varie,2017-12-05,18/12/2017,2800.00,"FSP card per sistema IBM power7 9117-MMB, bando numero: 1798846",https://www.acquistinretepa.it/opencms/opencms/main/impresa/strumenti/dettaglio.jsp?idT=1798846&tipoVis=descr&nome=FSP+card+per+sistema+IBM+power7+9117-MMB&frompage=rdoAperte.jsp&orderBy=pubblicazione&sort=desc&__pagina=86&__element=paginazione,"Tue, 05 Dec 2017 02:00:00 +0200"
1806781,AZIENDA OSPEDALIERA - UNIVERSITARIA OSPEDALE POLICLINICO CONSORZIALE BARI,Varie,2017-12-05,12/01/2018,240000.00,"AFFIDAMENTO DEL SERVIZIO POSTALE, bando numero: 1806781",https://www.acquistinretepa.it/opencms/opencms/main/impresa/strumenti/dettaglio.jsp?idT=1806781&tipoVis=descr&nome=AFFIDAMENTO+DEL+SERVIZIO+POSTALE&frompage=rdoAperte.jsp&orderBy=pubblicazione&sort=desc&__pagina=86&__element=paginazione,"Tue, 05 Dec 2017 02:00:00 +0200"
1778964,MINISTERO DELL'ECONOMIA E DELLE FINANZE,Varie,2017-12-05,20/12/2017,4920.00,"Fornitura, revisione e smaltimento estintori di bordo degli autoveicoli GDF Liguria, bando numero: 1778964",https://www.acquistinretepa.it/opencms/opencms/main/impresa/strumenti/dettaglio.jsp?idT=1778964&tipoVis=descr&nome=Fornitura%2C+revisione+e+smaltimento+estintori+di+bordo+degli+autoveicoli+GDF+Liguria&frompage=rdoAperte.jsp&orderBy=pubblicazione&sort=desc&__pagina=86&__element=paginazione,"Tue, 05 Dec 2017 02:00:00 +0200"
1806144,MINISTERO DELL'ECONOMIA E DELLE FINANZE,Varie,2017-12-05,20/12/2017,2100.00,"Manutenzione impianto di filtrazione acqua potabile, bando numero: 1806144",https://www.acquistinretepa.it/opencms/opencms/main/impresa/strumenti/dettaglio.jsp?idT=1806144&tipoVis=descr&nome=Manutenzione+impianto+di+filtrazione+acqua+potabile&frompage=rdoAperte.jsp&orderBy=pubblicazione&sort=desc&__pagina=86&__element=paginazione,"Tue, 05 Dec 2017 02:00:00 +0200"
1806542,AZIENDA OSPEDALIERA DI RILIEVO NAZIONALE E DI ALTA SPECIALIZZAZIONE - CIVICO BENFRATELLI DI CRISTINA PALERMO,Varie,2017-12-05,22/12/2017,177500.00,"Fornitura annuale di  “materiale specialistico per chirurgia per patologie a carico del polmone ”, bando numero: 1806542",https://www.acquistinretepa.it/opencms/opencms/main/impresa/strumenti/dettaglio.jsp?idT=1806542&tipoVis=descr&nome=Fornitura+annuale+di++%3Fmateriale+specialistico+per+chirurgia+per+patologie+a+carico+del+polmone+%3F&frompage=rdoAperte.jsp&orderBy=pubblicazione&sort=desc&__pagina=86&__element=paginazione,"Tue, 05 Dec 2017 02:00:00 +0200"
1805230,MINISTERO DELL'ISTRUZIONE DELL'UNIVERSITA' E DELLA RICERCA,Varie,2017-12-05,20/12/2017,9800.00,"Acquisto n. 6 lim complete di videoproiettore notebook casse e installazione a parete, bando numero: 1805230",https://www.acquistinretepa.it/opencms/opencms/main/impresa/strumenti/dettaglio.jsp?idT=1805230&tipoVis=descr&nome=Acquisto+n.+6+lim+complete+di+videoproiettore+notebook+casse+e+installazione+a+parete&frompage=rdoAperte.jsp&orderBy=pubblicazione&sort=desc&__pagina=87&__element=paginazione,"Tue, 05 Dec 2017 02:00:00 +0200"
1802697,AZIENDA SANITARIA PROVINCIALE DI RAGUSA,Varie,2017-12-05,18/12/2017,1750.00,"Fornitura annuale, in somministrazione, di n. 360 nasini artificiali HCH-V6 01-06-2904-8 Mediflux, bando numero: 1802697",https://www.acquistinretepa.it/opencms/opencms/main/impresa/strumenti/dettaglio.jsp?idT=1802697&tipoVis=descr&nome=Fornitura+annuale%2C+in+somministrazione%2C+di+n.+360+nasini+artificiali+HCH-V6+01-06-2904-8+Mediflux&frompage=rdoAperte.jsp&orderBy=pubblicazione&sort=desc&__pagina=87&__element=paginazione,"Tue, 05 Dec 2017 02:00:00 +0200"
1804938,AZIENDA OSPEDALIERA DI RILIEVO NAZIONALE E DI ALTA SPECIALIZZAZIONE - CIVICO BENFRATELLI DI CRISTINA PALERMO,Varie,2017-12-05,20/12/2017,178650.00,"Fornitur annuale in somministrazione di materiale specialistico per la ricostruzione dei chirurgia oncologica e traumatologica, bando numero: 1804938",https://www.acquistinretepa.it/opencms/opencms/main/impresa/strumenti/dettaglio.jsp?idT=1804938&tipoVis=descr&nome=Fornitur+annuale+in+somministrazione+di+materiale+specialistico+per+la+ricostruzione+dei+chirurgia+oncologica+e+traumatologica&frompage=rdoAperte.jsp&orderBy=pubblicazione&sort=desc&__pagina=87&__element=paginazione,"Tue, 05 Dec 2017 02:00:00 +0200"
1806224,UNIVERSITA' DEGLI STUDI DEL SANNIO,Varie,2017-12-05,19/12/2017,4000.00,"RDO MEPA 22_17 Materiale per ""Misure per Droni"", bando numero: 1806224",https://www.acquistinretepa.it/opencms/opencms/main/impresa/strumenti/dettaglio.jsp?idT=1806224&tipoVis=descr&nome=RDO+MEPA+22_17+Materiale+per+%22Misure+per+Droni%22&frompage=rdoAperte.jsp&orderBy=pubblicazione&sort=desc&__pagina=87&__element=paginazione,"Tue, 05 Dec 2017 02:00:00 +0200"
1806335,MINISTERO DELLA DIFESA,Varie,2017-12-05,18/12/2017,22300.00,"Fornitura e posa in opera armadi per archiviazione documenti, bando numero: 1806335",https://www.acquistinretepa.it/opencms/opencms/main/impresa/strumenti/dettaglio.jsp?idT=1806335&tipoVis=descr&nome=Fornitura+e+posa+in+opera+armadi+per+archiviazione+documenti&frompage=rdoAperte.jsp&orderBy=pubblicazione&sort=desc&__pagina=87&__element=paginazione,"Tue, 05 Dec 2017 02:00:00 +0200"
1804869,MINISTERO DELL'ISTRUZIONE DELL'UNIVERSITA' E DELLA RICERCA,Varie,2017-12-05,21/12/2017,975.00,"TAVOLO RICHIUDIBILE, bando numero: 1804869",https://www.acquistinretepa.it/opencms/opencms/main/impresa/strumenti/dettaglio.jsp?idT=1804869&tipoVis=descr&nome=TAVOLO+RICHIUDIBILE&frompage=rdoAperte.jsp&orderBy=pubblicazione&sort=desc&__pagina=87&__element=paginazione,"Tue, 05 Dec 2017 02:00:00 +0200"
1804837,AGENZIA DELLE ENTRATE,Varie,2017-12-05,20/12/2017,15561.19,"III° ACQUISTO CARTA UFFICI REGIONE BASILICATA, bando numero: 1804837",https://www.acquistinretepa.it/opencms/opencms/main/impresa/strumenti/dettaglio.jsp?idT=1804837&tipoVis=descr&nome=III%B0+ACQUISTO+CARTA+UFFICI+REGIONE+BASILICATA&frompage=rdoAperte.jsp&orderBy=pubblicazione&sort=desc&__pagina=87&__element=paginazione,"Tue, 05 Dec 2017 02:00:00 +0200"
1805443,AGENZIA DELLE ENTRATE,Varie,2017-12-05,20/12/2017,10000.00,"2° ACQUISTO TONER UFFICI REGIONE BASILICATA, bando numero: 1805443",https://www.acquistinretepa.it/opencms/opencms/main/impresa/strumenti/dettaglio.jsp?idT=1805443&tipoVis=descr&nome=2%B0+ACQUISTO+TONER+UFFICI+REGIONE+BASILICATA&frompage=rdoAperte.jsp&orderBy=pubblicazione&sort=desc&__pagina=87&__element=paginazione,"Tue, 05 Dec 2017 02:00:00 +0200"
1806263,COMUNE DI MARINO,Varie,2017-12-05,20/12/2017,135000.00,"INDIZIONE DI GARA TELEMATICA RDO PER  PER AFFIDAMENTO DEL SERVIZIO DI GESTIONE VERBALI DI VIOLAZIONE REDATTI DAGLI AGENTI DI POLIZIA LOCALE, bando numero: 1806263",https://www.acquistinretepa.it/opencms/opencms/main/impresa/strumenti/dettaglio.jsp?idT=1806263&tipoVis=descr&nome=INDIZIONE+DI+GARA+TELEMATICA+RDO+PER++PER+AFFIDAMENTO+DEL+SERVIZIO+DI+GESTIONE+VERBALI+DI+VIOLAZIONE+REDATTI+DAGLI+AGENTI+DI+POLIZIA+LOCALE&frompage=rdoAperte.jsp&orderBy=pubblicazione&sort=desc&__pagina=87&__element=paginazione,"Tue, 05 Dec 2017 02:00:00 +0200"
1793102,COMUNE DI RIVALTA DI TORINO,Varie,2017-12-05,20/12/2017,6000.00,"Fornitura materiale librario e multimediale, bando numero: 1793102",https://www.acquistinretepa.it/opencms/opencms/main/impresa/strumenti/dettaglio.jsp?idT=1793102&tipoVis=descr&nome=Fornitura+materiale+librario+e+multimediale&frompage=rdoAperte.jsp&orderBy=pubblicazione&sort=desc&__pagina=87&__element=paginazione,"Tue, 05 Dec 2017 02:00:00 +0200"
1806165,CONSERVATORIO STATALE - D.CIMAROSA,Varie,2017-12-05,19/12/2017,2500.00,"SERVIZI DI MANUTENZIONE/ASSISTENZA ORDINARIA IMPIANTO ELETTRICO CONSERVATORIO, bando numero: 1806165",https://www.acquistinretepa.it/opencms/opencms/main/impresa/strumenti/dettaglio.jsp?idT=1806165&tipoVis=descr&nome=SERVIZI+DI+MANUTENZIONE%2FASSISTENZA+ORDINARIA+IMPIANTO+ELETTRICO+CONSERVATORIO&frompage=rdoAperte.jsp&orderBy=pubblicazione&sort=desc&__pagina=88&__element=paginazione,"Tue, 05 Dec 2017 02:00:00 +0200"
1806131,UNIVERSITA' DEGLI STUDI DEL SANNIO,Varie,2017-12-05,19/12/2017,1500.00,"RDO MEPA 20_17 incubatore per laboratorio optoelettronica, bando numero: 1806131",https://www.acquistinretepa.it/opencms/opencms/main/impresa/strumenti/dettaglio.jsp?idT=1806131&tipoVis=descr&nome=RDO+MEPA+20_17+incubatore+per+laboratorio+optoelettronica&frompage=rdoAperte.jsp&orderBy=pubblicazione&sort=desc&__pagina=88&__element=paginazione,"Tue, 05 Dec 2017 02:00:00 +0200"
1805201,AGRIS SARDEGNA-AGENZIA PER LA RICERCA IN AGRICOLTURA,Varie,2017-12-05,18/12/2017,24850.00,"FORNITURA IN TRE LOTTI DI ATTREZZATURE SCIENTIFICHE PER I LABORATORI DELL’AGENZIA AGRIS SARDEGNA, bando numero: 1805201",https://www.acquistinretepa.it/opencms/opencms/main/impresa/strumenti/dettaglio.jsp?idT=1805201&tipoVis=descr&nome=FORNITURA+IN+TRE+LOTTI+DI+ATTREZZATURE+SCIENTIFICHE+PER+I+LABORATORI+DELL%3FAGENZIA+AGRIS+SARDEGNA&frompage=rdoAperte.jsp&orderBy=pubblicazione&sort=desc&__pagina=88&__element=paginazione,"Tue, 05 Dec 2017 02:00:00 +0200"
1806071,CONSERVATORIO STATALE - D.CIMAROSA,Lavori di manutenzione,2017-12-05,19/12/2017,2500.00,"SERVIZI DI PICCOLA MANUTENZIONE DEGLI AMBIENTI DEL CONSERVATORIO, bando numero: 1806071",https://www.acquistinretepa.it/opencms/opencms/main/impresa/strumenti/dettaglio.jsp?idT=1806071&tipoVis=descr&nome=SERVIZI+DI+PICCOLA+MANUTENZIONE+DEGLI+AMBIENTI+DEL+CONSERVATORIO&frompage=rdoAperte.jsp&orderBy=pubblicazione&sort=desc&__pagina=88&__element=paginazione,"Tue, 05 Dec 2017 02:00:00 +0200"
1806036,UNIVERSITA' DEGLI STUDI DEL SANNIO,Varie,2017-12-05,19/12/2017,3100.00,"RDO MEPA 19_17 apparecchiatura per prove di estrazione, bando numero: 1806036",https://www.acquistinretepa.it/opencms/opencms/main/impresa/strumenti/dettaglio.jsp?idT=1806036&tipoVis=descr&nome=RDO+MEPA+19_17+apparecchiatura+per+prove+di+estrazione&frompage=rdoAperte.jsp&orderBy=pubblicazione&sort=desc&__pagina=88&__element=paginazione,"Tue, 05 Dec 2017 02:00:00 +0200"
1799270,MINISTERO DELL'INTERNO,Varie,2017-12-05,18/12/2017,7000.00,"MANUTENZIONE ORDINARIA 2018 ESTINTORI QUESTURA E UFFICI DIPENDENTI, bando numero: 1799270",https://www.acquistinretepa.it/opencms/opencms/main/impresa/strumenti/dettaglio.jsp?idT=1799270&tipoVis=descr&nome=MANUTENZIONE+ORDINARIA+2018+ESTINTORI+QUESTURA+E+UFFICI+DIPENDENTI&frompage=rdoAperte.jsp&orderBy=pubblicazione&sort=desc&__pagina=88&__element=paginazione,"Tue, 05 Dec 2017 02:00:00 +0200"
1803935,MINISTERO DELL'INTERNO,Varie,2017-12-05,19/12/2017,35305.73,"FORNITURA ABITI CIVILI PER PRSONALE POLIZIA DI STATO QUESTURA DI REGGIO CALABRIA, bando numero: 1803935",https://www.acquistinretepa.it/opencms/opencms/main/impresa/strumenti/dettaglio.jsp?idT=1803935&tipoVis=descr&nome=FORNITURA+ABITI+CIVILI+PER+PRSONALE+POLIZIA+DI+STATO+QUESTURA+DI+REGGIO+CALABRIA&frompage=rdoAperte.jsp&orderBy=pubblicazione&sort=desc&__pagina=88&__element=paginazione,"Tue, 05 Dec 2017 02:00:00 +0200"
1805725,AZIENDA SANITARIA PROVINCIALE DI ENNA,Varie,2017-12-05,20/12/2017,4000.00,"Fornitura in somministrazione eventuale per anni tre di benda elastica autoadesiva sustineaflex 10 cm x 4 m, bando numero: 1805725",https://www.acquistinretepa.it/opencms/opencms/main/impresa/strumenti/dettaglio.jsp?idT=1805725&tipoVis=descr&nome=Fornitura+in+somministrazione+eventuale+per+anni+tre+di+benda+elastica+autoadesiva+sustineaflex+10+cm+x+4+m&frompage=rdoAperte.jsp&orderBy=pubblicazione&sort=desc&__pagina=88&__element=paginazione,"Tue, 05 Dec 2017 02:00:00 +0200"
1805970,CONSERVATORIO STATALE - D.CIMAROSA,Varie,2017-12-05,19/12/2017,1500.00,"SERVIZI MANUTENZIONE/ASSISTENZA IMPIANTO IDRAULICO, bando numero: 1805970",https://www.acquistinretepa.it/opencms/opencms/main/impresa/strumenti/dettaglio.jsp?idT=1805970&tipoVis=descr&nome=SERVIZI+MANUTENZIONE%2FASSISTENZA+IMPIANTO+IDRAULICO&frompage=rdoAperte.jsp&orderBy=pubblicazione&sort=desc&__pagina=88&__element=paginazione,"Tue, 05 Dec 2017 02:00:00 +0200"
1797816,PROVINCIA DI PISA,Varie,2017-12-05,28/12/2017,38000.00,"SERVIZIO DI GESTIONE E MANUTENZIONE DEGLI IMPIANTI ELEVATORI A SERVIZIO DEI FABBRICATI DI COMPETENZA DELLA PROVINCIA, bando numero: 1797816",https://www.acquistinretepa.it/opencms/opencms/main/impresa/strumenti/dettaglio.jsp?idT=1797816&tipoVis=descr&nome=SERVIZIO+DI+GESTIONE+E+MANUTENZIONE+DEGLI+IMPIANTI+ELEVATORI+A+SERVIZIO+DEI+FABBRICATI+DI+COMPETENZA+DELLA+PROVINCIA&frompage=rdoAperte.jsp&orderBy=pubblicazione&sort=desc&__pagina=88&__element=paginazione,"Tue, 05 Dec 2017 02:00:00 +0200"
1805908,COMUNE DI FONTE NUOVA,Varie,2017-12-05,21/12/2017,437000.00,"Gestione attività previste nel progetto Home Care Premium 2017 finanziato dall'INPS Gestione Dipendneti Pubblici, bando numero: 1805908",https://www.acquistinretepa.it/opencms/opencms/main/impresa/strumenti/dettaglio.jsp?idT=1805908&tipoVis=descr&nome=Gestione+attivit%E0+previste+nel+progetto+Home+Care+Premium+2017+finanziato+dall%27INPS+Gestione+Dipendneti+Pubblici&frompage=rdoAperte.jsp&orderBy=pubblicazione&sort=desc&__pagina=89&__element=paginazione,"Tue, 05 Dec 2017 02:00:00 +0200"
1783338,MINISTERO DELLE INFRASTRUTTURE E DEI TRASPORTI,Varie,2017-12-05,20/12/2017,36000.00,"FORNITURA GENERI ALIMENTARI (VIVERI SECCHI) PER LA CAPITANERIA DI PORTO DI MILAZZO, bando numero: 1783338",https://www.acquistinretepa.it/opencms/opencms/main/impresa/strumenti/dettaglio.jsp?idT=1783338&tipoVis=descr&nome=FORNITURA+GENERI+ALIMENTARI+%28VIVERI+SECCHI%29+PER+LA+CAPITANERIA+DI+PORTO+DI+MILAZZO&frompage=rdoAperte.jsp&orderBy=pubblicazione&sort=desc&__pagina=89&__element=paginazione,"Tue, 05 Dec 2017 02:00:00 +0200"
1796583,AZIENDA SANITARIA LOCALE - CITTA' DI TORINO,Lavori di manutenzione,2017-12-05,27/12/2017,117114.79,"PROCEDURA NEGOZIATA, MEDIANTE RICHIESTA DI OFFERTA (RDO) SUL MEPA DI CONSIP, PER L’AFFIDAMENTO  DELLE OPERE  EDILI ED AFFINI PER LA MESSA IN SICUREZZA DEI SOFFITTI DA SVOLGERE PRESSO IL PADIGLIONE DEGENZE DEL PRESIDIO OSPEDALIERO MARTINI DELL’ASL CITTA’ DI TORINO - IMPORTO TOTALE PROGETTO EURO 117.114,79 +  EURO 3.000,00 DI ONERI DELLA SICUREZZA NON SOGGETTI A RIBASSO D’ASTA + IVA 10%. DURATA 90 GIORNI., bando numero: 1796583",https://www.acquistinretepa.it/opencms/opencms/main/impresa/strumenti/dettaglio.jsp?idT=1796583&tipoVis=descr&nome=PROCEDURA+NEGOZIATA%2C+MEDIANTE+RICHIESTA+DI+OFFERTA+%28RDO%29+SUL+MEPA+DI+CONSIP%2C+PER+L%3FAFFIDAMENTO++DELLE+OPERE++EDILI+ED+AFFINI+PER+LA+MESSA+IN+SICUREZZA+DEI+SOFFITTI+DA+SVOLGERE+PRESSO+IL+PADIGLIONE+DEGENZE+DEL+PRESIDIO+OSPEDALIERO+MARTINI+DELL%3FASL+CITTA%3F+DI+TORINO+-+IMPORTO+TOTALE+PROGETTO+EURO+117.114%2C79+%2B++EURO+3.000%2C00+DI+ONERI+DELLA+SICUREZZA+NON+SOGGETTI+A+RIBASSO+D%3FASTA+%2B+IVA+10%25.+DURATA+90+GIORNI.&frompage=rdoAperte.jsp&orderBy=pubblicazione&sort=desc&__pagina=89&__element=paginazione,"Tue, 05 Dec 2017 02:00:00 +0200"
