numero,enteCommittente,categoria,pubblicazione,scadenza,valore:number,descrizione,url,datarss
1816231,UNIVERSITA' DEGLI STUDI DI MILANO,Varie,2017-12-14,21/12/2017,4524.00,"Strumentazione Moroni_EKOBASIC 1500/2 TN.GL, bando numero: 1816231",https://www.acquistinretepa.it/opencms/opencms/main/impresa/strumenti/dettaglio.jsp?idT=1816231&tipoVis=descr&nome=Strumentazione+Moroni_EKOBASIC+1500%2F2+TN.GL&frompage=rdoAperte.jsp&orderBy=pubblicazione&sort=desc&__pagina=26&__element=paginazione,"Thu, 14 Dec 2017 02:00:00 +0200"
1818983,C.N.R. CONSIGLIO NAZIONALE DELLE RICERCHE,Varie,2017-12-14,19/12/2017,8000.00,"Acquisto workstation, bando numero: 1818983",https://www.acquistinretepa.it/opencms/opencms/main/impresa/strumenti/dettaglio.jsp?idT=1818983&tipoVis=descr&nome=Acquisto+workstation&frompage=rdoAperte.jsp&orderBy=pubblicazione&sort=desc&__pagina=26&__element=paginazione,"Thu, 14 Dec 2017 02:00:00 +0200"
1817567,COMUNE DI LONIGO,Varie,2017-12-14,21/12/2017,7600.00,"SERVIZIO DI GESTIONE ABBONAMENTI PER BIBLIOTECA C. E UFFICI COMUNALI ANNO 2018, bando numero: 1817567",https://www.acquistinretepa.it/opencms/opencms/main/impresa/strumenti/dettaglio.jsp?idT=1817567&tipoVis=descr&nome=SERVIZIO+DI+GESTIONE+ABBONAMENTI+PER+BIBLIOTECA+C.+E+UFFICI+COMUNALI+ANNO+2018&frompage=rdoAperte.jsp&orderBy=pubblicazione&sort=desc&__pagina=26&__element=paginazione,"Thu, 14 Dec 2017 02:00:00 +0200"
1819176,MINISTERO DELLA DIFESA,Varie,2017-12-14,21/12/2017,1893.44,"Fasc. 1253/17 – Fornitura di materiale per la riproduzione e la stampa di elaborati tecnici per il reparto RSTA di Marinarsen Taranto, bando numero: 1819176",https://www.acquistinretepa.it/opencms/opencms/main/impresa/strumenti/dettaglio.jsp?idT=1819176&tipoVis=descr&nome=Fasc.+1253%2F17+%3F+Fornitura+di+materiale+per+la+riproduzione+e+la+stampa+di+elaborati+tecnici+per+il+reparto+RSTA+di+Marinarsen+Taranto&frompage=rdoAperte.jsp&orderBy=pubblicazione&sort=desc&__pagina=27&__element=paginazione,"Thu, 14 Dec 2017 02:00:00 +0200"
1819158,COMUNE DI CENTO,Varie,2017-12-14,21/12/2017,17340.00,"Fornitura di 12 defibrillatori semiautomatici, incluso il servizio di assistenza full risk e verifica annuale, bando numero: 1819158",https://www.acquistinretepa.it/opencms/opencms/main/impresa/strumenti/dettaglio.jsp?idT=1819158&tipoVis=descr&nome=Fornitura+di+12+defibrillatori+semiautomatici%2C+incluso+il+servizio+di+assistenza+full+risk+e+verifica+annuale&frompage=rdoAperte.jsp&orderBy=pubblicazione&sort=desc&__pagina=27&__element=paginazione,"Thu, 14 Dec 2017 02:00:00 +0200"
1819149,AZIENDA OSPEDALIERA UNIVERSITARIA INTEGRATA VERONA,Varie,2017-12-14,19/12/2017,110000.00,"SERVIZIO MANUTENZIONE SW CITRIX XENAPP, bando numero: 1819149",https://www.acquistinretepa.it/opencms/opencms/main/impresa/strumenti/dettaglio.jsp?idT=1819149&tipoVis=descr&nome=SERVIZIO+MANUTENZIONE+SW+CITRIX+XENAPP&frompage=rdoAperte.jsp&orderBy=pubblicazione&sort=desc&__pagina=27&__element=paginazione,"Thu, 14 Dec 2017 02:00:00 +0200"
1819157,CITTA' METROPOLITANA DI NAPOLI,Varie,2017-12-14,03/01/2018,200000.00,"Bando P052/2017 Procedura telematica negoziata per l’affidamento dell’accordo quadro avente la manutenzione area a verde presso istituti scolastici Ambito 3 e 4 ., bando numero: 1819157",https://www.acquistinretepa.it/opencms/opencms/main/impresa/strumenti/dettaglio.jsp?idT=1819157&tipoVis=descr&nome=Bando+P052%2F2017+Procedura+telematica+negoziata+per+l%3Faffidamento+dell%3Faccordo+quadro+avente+la+manutenzione+area+a+verde+presso+istituti+scolastici+Ambito+3+e+4+.&frompage=rdoAperte.jsp&orderBy=pubblicazione&sort=desc&__pagina=27&__element=paginazione,"Thu, 14 Dec 2017 02:00:00 +0200"
1813616,UNIVERSITA' DEGLI STUDI DI PADOVA,Varie,2017-12-14,08/01/2018,240.00,"Pile LiFePO4, bando numero: 1813616",https://www.acquistinretepa.it/opencms/opencms/main/impresa/strumenti/dettaglio.jsp?idT=1813616&tipoVis=descr&nome=Pile+LiFePO4&frompage=rdoAperte.jsp&orderBy=pubblicazione&sort=desc&__pagina=27&__element=paginazione,"Thu, 14 Dec 2017 02:00:00 +0200"
1819117,CITTA' METROPOLITANA DI NAPOLI,Varie,2017-12-14,03/01/2018,200000.00,"Procedura telematica negoziata per l’affidamento dell’accordo quadro avente la manutenzione area a verde presso istituti scolastici Ambito 1 e 2., bando numero: 1819117",https://www.acquistinretepa.it/opencms/opencms/main/impresa/strumenti/dettaglio.jsp?idT=1819117&tipoVis=descr&nome=Procedura+telematica+negoziata+per+l%3Faffidamento+dell%3Faccordo+quadro+avente+la+manutenzione+area+a+verde+presso+istituti+scolastici+Ambito+1+e+2.&frompage=rdoAperte.jsp&orderBy=pubblicazione&sort=desc&__pagina=27&__element=paginazione,"Thu, 14 Dec 2017 02:00:00 +0200"
1816971,AZIENDA SANITARIA PROVINCIALE DI CATANZARO,Varie,2017-12-14,20/12/2017,7500.00,"Acquisto apparecchiature per u.o. pneumologia polt, bando numero: 1816971",https://www.acquistinretepa.it/opencms/opencms/main/impresa/strumenti/dettaglio.jsp?idT=1816971&tipoVis=descr&nome=Acquisto+apparecchiature+per+u.o.+pneumologia+polt&frompage=rdoAperte.jsp&orderBy=pubblicazione&sort=desc&__pagina=27&__element=paginazione,"Thu, 14 Dec 2017 02:00:00 +0200"
1784046,UNIVERSITA' DEGLI STUDI DI PADOVA,Varie,2017-12-14,15/01/2018,4000.00,"Fornitura di Schede di Circuti Stampati, bando numero: 1784046",https://www.acquistinretepa.it/opencms/opencms/main/impresa/strumenti/dettaglio.jsp?idT=1784046&tipoVis=descr&nome=Fornitura+di+Schede+di+Circuti+Stampati&frompage=rdoAperte.jsp&orderBy=pubblicazione&sort=desc&__pagina=27&__element=paginazione,"Thu, 14 Dec 2017 02:00:00 +0200"
1818837,AZIENDA SANITARIA UNICA REGIONALE MARCHE,Varie,2017-12-14,19/12/2017,1450.00,"MATERIALE DI CONSUMO PER SCONGELATORE PLASMA THERMOBAG, bando numero: 1818837",https://www.acquistinretepa.it/opencms/opencms/main/impresa/strumenti/dettaglio.jsp?idT=1818837&tipoVis=descr&nome=MATERIALE+DI+CONSUMO+PER+SCONGELATORE+PLASMA+THERMOBAG&frompage=rdoAperte.jsp&orderBy=pubblicazione&sort=desc&__pagina=27&__element=paginazione,"Thu, 14 Dec 2017 02:00:00 +0200"
1818885,AZIENDA SANITARIA UNICA REGIONALE MARCHE,Varie,2017-12-14,19/12/2017,6500.00,"APPLICATORI PLURIUSO SENZA CLIP COLON INT. Tipo HX-110QR cod.N1085330 della ditta  OLYMPUS o equivalente, bando numero: 1818885",https://www.acquistinretepa.it/opencms/opencms/main/impresa/strumenti/dettaglio.jsp?idT=1818885&tipoVis=descr&nome=APPLICATORI+PLURIUSO+SENZA+CLIP+COLON+INT.+Tipo+HX-110QR+cod.N1085330+della+ditta++OLYMPUS+o+equivalente&frompage=rdoAperte.jsp&orderBy=pubblicazione&sort=desc&__pagina=27&__element=paginazione,"Thu, 14 Dec 2017 02:00:00 +0200"
1818273,MINISTERO DELLA DIFESA,Varie,2017-12-13,27/12/2017,1922.00,"Servizio di revisione e collaudo estintori, bando numero: 1818273",https://www.acquistinretepa.it/opencms/opencms/main/impresa/strumenti/dettaglio.jsp?idT=1818273&tipoVis=descr&nome=Servizio+di+revisione+e+collaudo+estintori&frompage=rdoAperte.jsp&orderBy=pubblicazione&sort=desc&__pagina=28&__element=paginazione,"Wed, 13 Dec 2017 02:00:00 +0200"
1818515,MINISTERO DELLA DIFESA,Varie,2017-12-13,27/12/2017,350.00,"Fornitura materiale servizio antincendi, bando numero: 1818515",https://www.acquistinretepa.it/opencms/opencms/main/impresa/strumenti/dettaglio.jsp?idT=1818515&tipoVis=descr&nome=Fornitura+materiale+servizio+antincendi&frompage=rdoAperte.jsp&orderBy=pubblicazione&sort=desc&__pagina=28&__element=paginazione,"Wed, 13 Dec 2017 02:00:00 +0200"
1818758,MINISTERO DELLA DIFESA,Varie,2017-12-13,20/12/2017,5000.00,"FORNITURA MATERIALE PER SERVIZIO SORVEGLIANZA DI MARINARSEN AUGUSTA, bando numero: 1818758",https://www.acquistinretepa.it/opencms/opencms/main/impresa/strumenti/dettaglio.jsp?idT=1818758&tipoVis=descr&nome=FORNITURA+MATERIALE+PER+SERVIZIO+SORVEGLIANZA+DI+MARINARSEN+AUGUSTA&frompage=rdoAperte.jsp&orderBy=pubblicazione&sort=desc&__pagina=28&__element=paginazione,"Wed, 13 Dec 2017 02:00:00 +0200"
1818793,MINISTERO DELLA DIFESA,Varie,2017-12-13,20/12/2017,2500.00,"FORNITURA ELETTRO POMPA AUTOADESCANTE GIANNESCHI, bando numero: 1818793",https://www.acquistinretepa.it/opencms/opencms/main/impresa/strumenti/dettaglio.jsp?idT=1818793&tipoVis=descr&nome=FORNITURA+ELETTRO+POMPA+AUTOADESCANTE+GIANNESCHI&frompage=rdoAperte.jsp&orderBy=pubblicazione&sort=desc&__pagina=28&__element=paginazione,"Wed, 13 Dec 2017 02:00:00 +0200"
1818626,PORTO TURISTICO DI CAPRI SPA UNIPERSONALE,Varie,2017-12-13,22/12/2017,34054.88,"FORNITURA DI MATERIALI EDILI, FINITURE E ARREDI  LOTTO 1 – PAVIMENTI E RIVESTIMENTI, bando numero: 1818626",https://www.acquistinretepa.it/opencms/opencms/main/impresa/strumenti/dettaglio.jsp?idT=1818626&tipoVis=descr&nome=FORNITURA+DI+MATERIALI+EDILI%2C+FINITURE+E+ARREDI++LOTTO+1+%3F+PAVIMENTI+E+RIVESTIMENTI&frompage=rdoAperte.jsp&orderBy=pubblicazione&sort=desc&__pagina=28&__element=paginazione,"Wed, 13 Dec 2017 02:00:00 +0200"
1818960,COMUNE DI SAN LUCA,Varie,2017-12-13,20/12/2017,900.00,"Fornitura cancelleria, bando numero: 1818960",https://www.acquistinretepa.it/opencms/opencms/main/impresa/strumenti/dettaglio.jsp?idT=1818960&tipoVis=descr&nome=Fornitura+cancelleria&frompage=rdoAperte.jsp&orderBy=pubblicazione&sort=desc&__pagina=28&__element=paginazione,"Wed, 13 Dec 2017 02:00:00 +0200"
1818943,COMUNE DI VERRONE,Varie,2017-12-13,28/12/2017,15000.00,"AFFIDAMENTO DEL SERVIZIO DI PULIZIA DEGLI IMMOBILI COMUNALI ANNO 2018, bando numero: 1818943",https://www.acquistinretepa.it/opencms/opencms/main/impresa/strumenti/dettaglio.jsp?idT=1818943&tipoVis=descr&nome=AFFIDAMENTO+DEL+SERVIZIO+DI+PULIZIA+DEGLI+IMMOBILI+COMUNALI+ANNO+2018&frompage=rdoAperte.jsp&orderBy=pubblicazione&sort=desc&__pagina=28&__element=paginazione,"Wed, 13 Dec 2017 02:00:00 +0200"
1815523,MINISTERO DELLA DIFESA,Varie,2017-12-13,20/12/2017,3500.00,"Fornitura di aspiratori elicoidali per esigenze del Nucleo Impianti Elettrici di Marinarsen Augusta., bando numero: 1815523",https://www.acquistinretepa.it/opencms/opencms/main/impresa/strumenti/dettaglio.jsp?idT=1815523&tipoVis=descr&nome=Fornitura+di+aspiratori+elicoidali+per+esigenze+del+Nucleo+Impianti+Elettrici+di+Marinarsen+Augusta.&frompage=rdoAperte.jsp&orderBy=pubblicazione&sort=desc&__pagina=28&__element=paginazione,"Wed, 13 Dec 2017 02:00:00 +0200"
1818290,MINISTERO DELLA DIFESA,Varie,2017-12-13,20/12/2017,6000.00,"Lavori di Demolizione della pavimentazione in Linoleum con presenza di materiale contenente Amianto, bando numero: 1818290",https://www.acquistinretepa.it/opencms/opencms/main/impresa/strumenti/dettaglio.jsp?idT=1818290&tipoVis=descr&nome=Lavori+di+Demolizione+della+pavimentazione+in+Linoleum+con+presenza+di+materiale+contenente+Amianto&frompage=rdoAperte.jsp&orderBy=pubblicazione&sort=desc&__pagina=28&__element=paginazione,"Wed, 13 Dec 2017 02:00:00 +0200"
1818838,MINISTERO DELLA DIFESA,Varie,2017-12-13,20/12/2017,12700.00,"SERVIZIO DI RIPRISTINO DIESEL ALTERNATORE DI NAVE POLIFEMO, bando numero: 1818838",https://www.acquistinretepa.it/opencms/opencms/main/impresa/strumenti/dettaglio.jsp?idT=1818838&tipoVis=descr&nome=SERVIZIO+DI+RIPRISTINO+DIESEL+ALTERNATORE+DI+NAVE+POLIFEMO&frompage=rdoAperte.jsp&orderBy=pubblicazione&sort=desc&__pagina=28&__element=paginazione,"Wed, 13 Dec 2017 02:00:00 +0200"
1818882,MINISTERO DEI BENI E DELLE ATTIVITA' CULTURALI E DEL TURISMO,Varie,2017-12-13,20/12/2017,14350.00,"Progetto integrato per i percorsi formativi professionalizzanti della Scuola di alta formazione per il Restauro. Interventi di restauro, manutenzione e valorizzazione di opere lapidee, dipinti murali, stucchi, gessi, mosaici (PFP1). Dipinti su tela tavole scultura lignea policroma, arte contemporanea (PFP4) Materiali metallici, ceramici, vitrei, polimaterici (PFP4).Attivazione di procedura mediante r.d.o del M.E.P.A finalizzata all’acquisizione della fornitura di materiale per il restauro – PFP4  La gara verrà svolta con la procedura negoziata sotto soglia, come disciplinata dall’art 36 comma 2 lett. b) del d. lgs. 50/2016. Perizia 1/2014 Cap.1321 A.F.2014., bando numero: 1818882",https://www.acquistinretepa.it/opencms/opencms/main/impresa/strumenti/dettaglio.jsp?idT=1818882&tipoVis=descr&nome=Progetto+integrato+per+i+percorsi+formativi+professionalizzanti+della+Scuola+di+alta+formazione+per+il+Restauro.+Interventi+di+restauro%2C+manutenzione+e+valorizzazione+di+opere+lapidee%2C+dipinti+murali%2C+stucchi%2C+gessi%2C+mosaici+%28PFP1%29.+Dipinti+su+tela+tavole+scultura+lignea+policroma%2C+arte+contemporanea+%28PFP4%29+Materiali+metallici%2C+ceramici%2C+vitrei%2C+polimaterici+%28PFP4%29.Attivazione+di+procedura+mediante+r.d.o+del+M.E.P.A+finalizzata+all%3Facquisizione+della+fornitura+di+materiale+per+il+restauro+%3F+PFP4++La+gara+verr%E0+svolta+con+la+procedura+negoziata+sotto+soglia%2C+come+disciplinata+dall%3Fart+36+comma+2+lett.+b%29+del+d.+lgs.+50%2F2016.+Perizia+1%2F2014+Cap.1321+A.F.2014.&frompage=rdoAperte.jsp&orderBy=pubblicazione&sort=desc&__pagina=29&__element=paginazione,"Wed, 13 Dec 2017 02:00:00 +0200"
1818903,MINISTERO DELLA DIFESA,Varie,2017-12-13,20/12/2017,600.00,"RT18INF: ACQUISTO STECCOBENDE E COLLARI CERVICALI PER L'INFERMERIA DELLA CASERMA HUBER DI BOLZANO, bando numero: 1818903",https://www.acquistinretepa.it/opencms/opencms/main/impresa/strumenti/dettaglio.jsp?idT=1818903&tipoVis=descr&nome=RT18INF%3A+ACQUISTO+STECCOBENDE+E+COLLARI+CERVICALI+PER+L%27INFERMERIA+DELLA+CASERMA+HUBER+DI+BOLZANO&frompage=rdoAperte.jsp&orderBy=pubblicazione&sort=desc&__pagina=29&__element=paginazione,"Wed, 13 Dec 2017 02:00:00 +0200"
1818907,COMUNE DI ARZACHENA,Varie,2017-12-13,29/12/2017,9000.00,"ACQUISTO BLADE FILE SERVER, bando numero: 1818907",https://www.acquistinretepa.it/opencms/opencms/main/impresa/strumenti/dettaglio.jsp?idT=1818907&tipoVis=descr&nome=ACQUISTO+BLADE+FILE+SERVER&frompage=rdoAperte.jsp&orderBy=pubblicazione&sort=desc&__pagina=29&__element=paginazione,"Wed, 13 Dec 2017 02:00:00 +0200"
1815408,COMUNE DI POGGIO RUSCO,Varie,2017-12-13,20/12/2017,1600.00,"SERVIZIO DI TRASCRIZIONE - RESOCONTAZIONE SEDUTE CONSILIARI 2018, bando numero: 1815408",https://www.acquistinretepa.it/opencms/opencms/main/impresa/strumenti/dettaglio.jsp?idT=1815408&tipoVis=descr&nome=SERVIZIO+DI+TRASCRIZIONE+-+RESOCONTAZIONE+SEDUTE+CONSILIARI+2018&frompage=rdoAperte.jsp&orderBy=pubblicazione&sort=desc&__pagina=29&__element=paginazione,"Wed, 13 Dec 2017 02:00:00 +0200"
1818883,POLITECNICO DI TORINO,Varie,2017-12-13,21/12/2017,39970.00,"POLITECNICO DI TORINO - Amm. Centrale - Fornitura materiali per impianti tvcc e allarme antintrusione, bando numero: 1818883",https://www.acquistinretepa.it/opencms/opencms/main/impresa/strumenti/dettaglio.jsp?idT=1818883&tipoVis=descr&nome=POLITECNICO+DI+TORINO+-+Amm.+Centrale+-+Fornitura+materiali+per+impianti+tvcc+e+allarme+antintrusione&frompage=rdoAperte.jsp&orderBy=pubblicazione&sort=desc&__pagina=29&__element=paginazione,"Wed, 13 Dec 2017 02:00:00 +0200"
1818831,MINISTERO DELLA DIFESA,Varie,2017-12-13,21/12/2017,6557.38,"Fornitura di acqua minerale per le esigenze della Sala Convegno del Comando 51° Stormo – Aeroporti di Istrana e Treviso  - E.F. 2018, bando numero: 1818831",https://www.acquistinretepa.it/opencms/opencms/main/impresa/strumenti/dettaglio.jsp?idT=1818831&tipoVis=descr&nome=Fornitura+di+acqua+minerale+per+le+esigenze+della+Sala+Convegno+del+Comando+51%B0+Stormo+%3F+Aeroporti+di+Istrana+e+Treviso++-+E.F.+2018&frompage=rdoAperte.jsp&orderBy=pubblicazione&sort=desc&__pagina=29&__element=paginazione,"Wed, 13 Dec 2017 02:00:00 +0200"
1817842,UNIVERSITA' DEGLI STUDI DI PADOVA,Varie,2017-12-13,18/12/2017,485.00,"Kit PRRSV Thermo Fisher (Dotto/Drigo), bando numero: 1817842",https://www.acquistinretepa.it/opencms/opencms/main/impresa/strumenti/dettaglio.jsp?idT=1817842&tipoVis=descr&nome=Kit+PRRSV+Thermo+Fisher+%28Dotto%2FDrigo%29&frompage=rdoAperte.jsp&orderBy=pubblicazione&sort=desc&__pagina=29&__element=paginazione,"Wed, 13 Dec 2017 02:00:00 +0200"
1771940,MINISTERO DELLA GIUSTIZIA,Varie,2017-12-13,31/01/2018,47750.00,"RDO 9 -2017 Fornitura di una rete LAN per gli  Uffici Giudiziari di Campobasso, bando numero: 1771940",https://www.acquistinretepa.it/opencms/opencms/main/impresa/strumenti/dettaglio.jsp?idT=1771940&tipoVis=descr&nome=RDO+9+-2017+Fornitura+di+una+rete+LAN+per+gli++Uffici+Giudiziari+di+Campobasso&frompage=rdoAperte.jsp&orderBy=pubblicazione&sort=desc&__pagina=29&__element=paginazione,"Wed, 13 Dec 2017 02:00:00 +0200"
1818813,UNIONE DEI COMUNI VALDOSTANI GRAND PARADIS/UNITE' DES COMMUNES VALDOTAINES GRAND-PARADIS,Varie,2017-12-13,18/12/2017,5500.00,"MATERIALE MONOUSO E PULIZIA PER MICROCOMUNITA', bando numero: 1818813",https://www.acquistinretepa.it/opencms/opencms/main/impresa/strumenti/dettaglio.jsp?idT=1818813&tipoVis=descr&nome=MATERIALE+MONOUSO+E+PULIZIA+PER+MICROCOMUNITA%27&frompage=rdoAperte.jsp&orderBy=pubblicazione&sort=desc&__pagina=29&__element=paginazione,"Wed, 13 Dec 2017 02:00:00 +0200"
1806771,COMUNE DI PINEROLO,Varie,2017-12-13,21/12/2017,3000.00,"Servizio di formazione per addetti alle biblioteche del sistema bibliotecario pinerolese, bando numero: 1806771",https://www.acquistinretepa.it/opencms/opencms/main/impresa/strumenti/dettaglio.jsp?idT=1806771&tipoVis=descr&nome=Servizio+di+formazione+per+addetti+alle+biblioteche+del+sistema+bibliotecario+pinerolese&frompage=rdoAperte.jsp&orderBy=pubblicazione&sort=desc&__pagina=29&__element=paginazione,"Wed, 13 Dec 2017 02:00:00 +0200"
1818264,ARPA - UMBRIA,Varie,2017-12-13,18/12/2017,9600.00,"Licenze varie, bando numero: 1818264",https://www.acquistinretepa.it/opencms/opencms/main/impresa/strumenti/dettaglio.jsp?idT=1818264&tipoVis=descr&nome=Licenze+varie&frompage=rdoAperte.jsp&orderBy=pubblicazione&sort=desc&__pagina=30&__element=paginazione,"Wed, 13 Dec 2017 02:00:00 +0200"
1818786,UNIVERSITA' DEGLI STUDI DI NAPOLI FEDERICO II,Varie,2017-12-13,28/12/2017,5000.00,"CARTA A4 IN RISME, bando numero: 1818786",https://www.acquistinretepa.it/opencms/opencms/main/impresa/strumenti/dettaglio.jsp?idT=1818786&tipoVis=descr&nome=CARTA+A4+IN+RISME&frompage=rdoAperte.jsp&orderBy=pubblicazione&sort=desc&__pagina=30&__element=paginazione,"Wed, 13 Dec 2017 02:00:00 +0200"
1818766,POLITECNICO DI TORINO,Varie,2017-12-13,20/12/2017,19400.00,"POLITECNICO DI TORINO - Amm. Centrale -  Apparati per trattamento e distribuzione segnali A/V e  Pc Aule e postazioni ufficio multimedia, bando numero: 1818766",https://www.acquistinretepa.it/opencms/opencms/main/impresa/strumenti/dettaglio.jsp?idT=1818766&tipoVis=descr&nome=POLITECNICO+DI+TORINO+-+Amm.+Centrale+-++Apparati+per+trattamento+e+distribuzione+segnali+A%2FV+e++Pc+Aule+e+postazioni+ufficio+multimedia&frompage=rdoAperte.jsp&orderBy=pubblicazione&sort=desc&__pagina=30&__element=paginazione,"Wed, 13 Dec 2017 02:00:00 +0200"
1804864,ASL.CN2 ALBA-BRA,Varie,2017-12-13,28/12/2017,173400.00,"FORNITURA DI PRODOTTI ALIMENTARI VARI, bando numero: 1804864",https://www.acquistinretepa.it/opencms/opencms/main/impresa/strumenti/dettaglio.jsp?idT=1804864&tipoVis=descr&nome=FORNITURA+DI+PRODOTTI+ALIMENTARI+VARI&frompage=rdoAperte.jsp&orderBy=pubblicazione&sort=desc&__pagina=30&__element=paginazione,"Wed, 13 Dec 2017 02:00:00 +0200"
1817404,AZIENDA OSPEDALIERA S. G. MOSCATI AVELLINO,Varie,2017-12-13,11/01/2018,1200.00,"PARETE MOBILE ANTI X, bando numero: 1817404",https://www.acquistinretepa.it/opencms/opencms/main/impresa/strumenti/dettaglio.jsp?idT=1817404&tipoVis=descr&nome=PARETE+MOBILE+ANTI+X&frompage=rdoAperte.jsp&orderBy=pubblicazione&sort=desc&__pagina=30&__element=paginazione,"Wed, 13 Dec 2017 02:00:00 +0200"
1816341,AZIENDA OSPEDALIERA S. G. MOSCATI AVELLINO,Varie,2017-12-13,22/12/2017,500.00,"Acquisto cavi ecg 10 derivazioni per Cardiofax S ECG 1250, bando numero: 1816341",https://www.acquistinretepa.it/opencms/opencms/main/impresa/strumenti/dettaglio.jsp?idT=1816341&tipoVis=descr&nome=Acquisto+cavi+ecg+10+derivazioni+per+Cardiofax+S+ECG+1250&frompage=rdoAperte.jsp&orderBy=pubblicazione&sort=desc&__pagina=30&__element=paginazione,"Wed, 13 Dec 2017 02:00:00 +0200"
1818672,MINISTERO DELLA DIFESA,Varie,2017-12-13,19/12/2017,816.10,"ACQUISTO MATERIALI PER IMBALLAGGIO, bando numero: 1818672",https://www.acquistinretepa.it/opencms/opencms/main/impresa/strumenti/dettaglio.jsp?idT=1818672&tipoVis=descr&nome=ACQUISTO+MATERIALI+PER+IMBALLAGGIO&frompage=rdoAperte.jsp&orderBy=pubblicazione&sort=desc&__pagina=30&__element=paginazione,"Wed, 13 Dec 2017 02:00:00 +0200"
1814476,MINISTERO DELL'INTERNO,Varie,2017-12-13,19/12/2017,3100.00,"FORNITURA PNEUMATICI INVERNALI PER ESIGENZE ENTI DEL TRIVENETO SM 65/2017, bando numero: 1814476",https://www.acquistinretepa.it/opencms/opencms/main/impresa/strumenti/dettaglio.jsp?idT=1814476&tipoVis=descr&nome=FORNITURA+PNEUMATICI+INVERNALI+PER+ESIGENZE+ENTI+DEL+TRIVENETO+SM+65%2F2017&frompage=rdoAperte.jsp&orderBy=pubblicazione&sort=desc&__pagina=30&__element=paginazione,"Wed, 13 Dec 2017 02:00:00 +0200"
1818732,COMUNE DI LURATE CACCIVIO,Varie,2017-12-13,18/12/2017,58.00,"Rinnovo ThinMan Platinum Software Subscription, bando numero: 1818732",https://www.acquistinretepa.it/opencms/opencms/main/impresa/strumenti/dettaglio.jsp?idT=1818732&tipoVis=descr&nome=Rinnovo+ThinMan+Platinum+Software+Subscription&frompage=rdoAperte.jsp&orderBy=pubblicazione&sort=desc&__pagina=30&__element=paginazione,"Wed, 13 Dec 2017 02:00:00 +0200"
1817707,MINISTERO DELL'INTERNO,Varie,2017-12-13,20/12/2017,3720.00,"ACQUISTO RICAMBI PER VEICOLI ENTI TRIVENETO, bando numero: 1817707",https://www.acquistinretepa.it/opencms/opencms/main/impresa/strumenti/dettaglio.jsp?idT=1817707&tipoVis=descr&nome=ACQUISTO+RICAMBI+PER+VEICOLI+ENTI+TRIVENETO&frompage=rdoAperte.jsp&orderBy=pubblicazione&sort=desc&__pagina=30&__element=paginazione,"Wed, 13 Dec 2017 02:00:00 +0200"
1818665,POLITECNICO DI MILANO,Varie,2017-12-13,20/12/2017,3200.00,"RDA 16472 RDO 1818665 CIG Z1B214A32F Camera Parrot Sequoia DE MICHELE, bando numero: 1818665",https://www.acquistinretepa.it/opencms/opencms/main/impresa/strumenti/dettaglio.jsp?idT=1818665&tipoVis=descr&nome=RDA+16472+RDO+1818665+CIG+Z1B214A32F+Camera+Parrot+Sequoia+DE+MICHELE&frompage=rdoAperte.jsp&orderBy=pubblicazione&sort=desc&__pagina=31&__element=paginazione,"Wed, 13 Dec 2017 02:00:00 +0200"
1818592,MINISTERO DELLA DIFESA,Varie,2017-12-13,18/12/2017,5200.00,"FORNITURA MATERIALI PER MENSA E SALA CONVEGNO, bando numero: 1818592",https://www.acquistinretepa.it/opencms/opencms/main/impresa/strumenti/dettaglio.jsp?idT=1818592&tipoVis=descr&nome=FORNITURA+MATERIALI+PER+MENSA+E+SALA+CONVEGNO&frompage=rdoAperte.jsp&orderBy=pubblicazione&sort=desc&__pagina=31&__element=paginazione,"Wed, 13 Dec 2017 02:00:00 +0200"
1817551,COMUNE DI CERAMI,Varie,2017-12-13,27/12/2017,2889.50,"Richiesta migliore offerta per la fornitura di materiale elettrico, bando numero: 1817551",https://www.acquistinretepa.it/opencms/opencms/main/impresa/strumenti/dettaglio.jsp?idT=1817551&tipoVis=descr&nome=Richiesta+migliore+offerta+per+la+fornitura+di+materiale+elettrico&frompage=rdoAperte.jsp&orderBy=pubblicazione&sort=desc&__pagina=31&__element=paginazione,"Wed, 13 Dec 2017 02:00:00 +0200"
1818678,MINISTERO DELLA DIFESA,Lavori di manutenzione,2017-12-13,21/12/2017,50076.62,"Realizzazione piazzale per stoccaggio container presso il 17°Stormo., bando numero: 1818678",https://www.acquistinretepa.it/opencms/opencms/main/impresa/strumenti/dettaglio.jsp?idT=1818678&tipoVis=descr&nome=Realizzazione+piazzale+per+stoccaggio+container+presso+il+17%B0Stormo.&frompage=rdoAperte.jsp&orderBy=pubblicazione&sort=desc&__pagina=31&__element=paginazione,"Wed, 13 Dec 2017 02:00:00 +0200"
1818645,MINISTERO DELL'ISTRUZIONE DELL'UNIVERSITA' E DELLA RICERCA,Varie,2017-12-13,18/12/2017,110.00,"Materiale laboratorio arte, bando numero: 1818645",https://www.acquistinretepa.it/opencms/opencms/main/impresa/strumenti/dettaglio.jsp?idT=1818645&tipoVis=descr&nome=Materiale+laboratorio+arte&frompage=rdoAperte.jsp&orderBy=pubblicazione&sort=desc&__pagina=31&__element=paginazione,"Wed, 13 Dec 2017 02:00:00 +0200"
1818548,CITTA' METROPOLITANA DI NAPOLI,Varie,2017-12-13,19/12/2017,18445.00,"Acquisto software sala BIM users, adeguamento dei mezzi informatici alle normative vigenti sulla progettazione tecnica delle opere pubbliche, per l’implementazione delle proprie applicazioni mediante RDO aperta sul MEPA. Determina a contrarre. Obbligazione giuridica di spesa di euro 18.445,00 iva esclusa. CIG Z9A2149755, bando numero: 1818548",https://www.acquistinretepa.it/opencms/opencms/main/impresa/strumenti/dettaglio.jsp?idT=1818548&tipoVis=descr&nome=Acquisto+software+sala+BIM+users%2C+adeguamento+dei+mezzi+informatici+alle+normative+vigenti+sulla+progettazione+tecnica+delle+opere+pubbliche%2C+per+l%3Fimplementazione+delle+proprie+applicazioni+mediante+RDO+aperta+sul+MEPA.+Determina+a+contrarre.+Obbligazione+giuridica+di+spesa+di+euro+18.445%2C00+iva+esclusa.+CIG+Z9A2149755&frompage=rdoAperte.jsp&orderBy=pubblicazione&sort=desc&__pagina=31&__element=paginazione,"Wed, 13 Dec 2017 02:00:00 +0200"
1817895,AZIENDA SANITARIA PROVINCIALE DI CATANIA,Varie,2017-12-13,27/12/2017,202605.31,"ASP CT Fornitura in noleggio operativo,della durata di tre anni, di 80 postazioni letto completi di arredi ed attrezzature., bando numero: 1817895",https://www.acquistinretepa.it/opencms/opencms/main/impresa/strumenti/dettaglio.jsp?idT=1817895&tipoVis=descr&nome=ASP+CT+Fornitura+in+noleggio+operativo%2Cdella+durata+di+tre+anni%2C+di+80+postazioni+letto+completi+di+arredi+ed+attrezzature.&frompage=rdoAperte.jsp&orderBy=pubblicazione&sort=desc&__pagina=31&__element=paginazione,"Wed, 13 Dec 2017 02:00:00 +0200"
1817705,ENAC - ENTE NAZIONALE DELL'AVIAZIONE CIVILE,Varie,2017-12-13,12/01/2018,33000.00,"Fornitura Servizio FAX, bando numero: 1817705",https://www.acquistinretepa.it/opencms/opencms/main/impresa/strumenti/dettaglio.jsp?idT=1817705&tipoVis=descr&nome=Fornitura+Servizio+FAX&frompage=rdoAperte.jsp&orderBy=pubblicazione&sort=desc&__pagina=31&__element=paginazione,"Wed, 13 Dec 2017 02:00:00 +0200"
