numero,enteCommittente,categoria,pubblicazione,scadenza,valore:number,descrizione,url,datarss
1871162,AZIENDA OSPEDALIERA OSPEDALI RIUNITI SAN GIOVANNI DI DIO E RUGGI D'ARAGONA SALERNO,Varie,2018-02-27,19/03/2018,5000.00,"STRUMENTARIO CHIRURGICO DA DESTINARE ALLA UOC PRONTO SOCCORSO, bando numero: 1871162",https://www.acquistinretepa.it/opencms/opencms/main/impresa/strumenti/dettaglio.jsp?idT=1871162&tipoVis=descr&nome=STRUMENTARIO+CHIRURGICO+DA+DESTINARE+ALLA+UOC+PRONTO+SOCCORSO&frompage=rdoAperte.jsp&orderBy=pubblicazione&sort=desc&__pagina=21&__element=paginazione,"Tue, 27 Feb 2018 02:00:00 +0200"
1872618,AZIENDA OSPEDALIERA OSPEDALI RIUNITI SAN GIOVANNI DI DIO E RUGGI D'ARAGONA SALERNO,Varie,2018-02-27,16/03/2018,2000.00,"ACQUISIZIONE DI SENSORI DI FLUSSO DA APPLICARE AI RESPIRATORI SLA 5000 DA DESTINARE ALLA UOC DI NEONATOLOGIA, bando numero: 1872618",https://www.acquistinretepa.it/opencms/opencms/main/impresa/strumenti/dettaglio.jsp?idT=1872618&tipoVis=descr&nome=ACQUISIZIONE+DI+SENSORI+DI+FLUSSO+DA+APPLICARE+AI+RESPIRATORI+SLA+5000+DA+DESTINARE+ALLA+UOC+DI+NEONATOLOGIA&frompage=rdoAperte.jsp&orderBy=pubblicazione&sort=desc&__pagina=21&__element=paginazione,"Tue, 27 Feb 2018 02:00:00 +0200"
1875113,AZIENDA OSPEDALIERA OSPEDALI RIUNITI SAN GIOVANNI DI DIO E RUGGI D'ARAGONA SALERNO,Varie,2018-02-27,22/03/2018,20000.00,"ACQUISIZIONE DI MATERIALE DI CONSUMO PER ELETTROENCEFALOGRAFO ED ELETTRONEUROMIOGRAFO, bando numero: 1875113",https://www.acquistinretepa.it/opencms/opencms/main/impresa/strumenti/dettaglio.jsp?idT=1875113&tipoVis=descr&nome=ACQUISIZIONE+DI+MATERIALE+DI+CONSUMO+PER+ELETTROENCEFALOGRAFO+ED+ELETTRONEUROMIOGRAFO&frompage=rdoAperte.jsp&orderBy=pubblicazione&sort=desc&__pagina=21&__element=paginazione,"Tue, 27 Feb 2018 02:00:00 +0200"
1876217,ASL SALERNO,Varie,2018-02-27,05/03/2018,1100.00,"ACQUISTO AUTOCPAP E CONSUMABILI PAZ. R.S.L., bando numero: 1876217",https://www.acquistinretepa.it/opencms/opencms/main/impresa/strumenti/dettaglio.jsp?idT=1876217&tipoVis=descr&nome=ACQUISTO+AUTOCPAP+E+CONSUMABILI+PAZ.+R.S.L.&frompage=rdoAperte.jsp&orderBy=pubblicazione&sort=desc&__pagina=21&__element=paginazione,"Tue, 27 Feb 2018 02:00:00 +0200"
1875672,AZIENDA OSPEDALIERA OSPEDALI RIUNITI SAN GIOVANNI DI DIO E RUGGI D'ARAGONA SALERNO,Varie,2018-02-27,13/03/2018,10000.00,"TUTE/DIVISA MONOUSO SALA OPERATORIA, bando numero: 1875672",https://www.acquistinretepa.it/opencms/opencms/main/impresa/strumenti/dettaglio.jsp?idT=1875672&tipoVis=descr&nome=TUTE%2FDIVISA+MONOUSO+SALA+OPERATORIA&frompage=rdoAperte.jsp&orderBy=pubblicazione&sort=desc&__pagina=21&__element=paginazione,"Tue, 27 Feb 2018 02:00:00 +0200"
1875949,AZIENDA OSPEDALIERA OSPEDALI RIUNITI SAN GIOVANNI DI DIO E RUGGI D'ARAGONA SALERNO,Varie,2018-02-27,16/03/2018,2500.00,"ACQUISIZIONE DI KIT PER LA DETERMINAZIONE DELLA FIBROSI CISTICA, bando numero: 1875949",https://www.acquistinretepa.it/opencms/opencms/main/impresa/strumenti/dettaglio.jsp?idT=1875949&tipoVis=descr&nome=ACQUISIZIONE+DI+KIT+PER+LA+DETERMINAZIONE+DELLA+FIBROSI+CISTICA&frompage=rdoAperte.jsp&orderBy=pubblicazione&sort=desc&__pagina=22&__element=paginazione,"Tue, 27 Feb 2018 02:00:00 +0200"
1876395,AZIENDA OSPEDALIERA OSPEDALI RIUNITI SAN GIOVANNI DI DIO E RUGGI D'ARAGONA SALERNO,Varie,2018-02-27,16/03/2018,6000.00,"ACQUISIZIONE DI FILI DI SUTURA DA DESTINARE ALLA UOC DI PRONTO SOCCORSO, bando numero: 1876395",https://www.acquistinretepa.it/opencms/opencms/main/impresa/strumenti/dettaglio.jsp?idT=1876395&tipoVis=descr&nome=ACQUISIZIONE+DI+FILI+DI+SUTURA+DA+DESTINARE+ALLA+UOC+DI+PRONTO+SOCCORSO&frompage=rdoAperte.jsp&orderBy=pubblicazione&sort=desc&__pagina=22&__element=paginazione,"Tue, 27 Feb 2018 02:00:00 +0200"
1878487,UNIONE DEI COMUNI MODENESI AREA NORD,Varie,2018-02-27,08/03/2018,1100.00,"FORNITURA MATERIALE HW, bando numero: 1878487",https://www.acquistinretepa.it/opencms/opencms/main/impresa/strumenti/dettaglio.jsp?idT=1878487&tipoVis=descr&nome=FORNITURA+MATERIALE+HW&frompage=rdoAperte.jsp&orderBy=pubblicazione&sort=desc&__pagina=22&__element=paginazione,"Tue, 27 Feb 2018 02:00:00 +0200"
1876540,AZIENDA OSPEDALIERA OSPEDALI RIUNITI SAN GIOVANNI DI DIO E RUGGI D'ARAGONA SALERNO,Varie,2018-02-27,16/03/2018,5000.00,"ACQUISIZIONE DI MEDICAZIONE AVANZATA A BASE VEGETALE DA DESTINARE ALLA UOC DI RIANIMAZIONE, bando numero: 1876540",https://www.acquistinretepa.it/opencms/opencms/main/impresa/strumenti/dettaglio.jsp?idT=1876540&tipoVis=descr&nome=ACQUISIZIONE+DI+MEDICAZIONE+AVANZATA+A+BASE+VEGETALE+DA+DESTINARE+ALLA+UOC+DI+RIANIMAZIONE&frompage=rdoAperte.jsp&orderBy=pubblicazione&sort=desc&__pagina=22&__element=paginazione,"Tue, 27 Feb 2018 02:00:00 +0200"
1878438,UNIVERSITA' DEGLI STUDI DI MESSINA,2,2018-02-27,14/03/2018,9000.00,"Implementazione piattaforma e learning Progetto Fami AZ. 03, bando numero: 1878438",https://www.acquistinretepa.it/opencms/opencms/main/impresa/strumenti/dettaglio.jsp?idT=1878438&tipoVis=descr&nome=Implementazione+piattaforma+e+learning+Progetto+Fami+AZ.+03&frompage=rdoAperte.jsp&orderBy=pubblicazione&sort=desc&__pagina=22&__element=paginazione,"Tue, 27 Feb 2018 02:00:00 +0200"
1877393,AZIENDA OSPEDALIERA OSPEDALI RIUNITI SAN GIOVANNI DI DIO E RUGGI D'ARAGONA SALERNO,Varie,2018-02-27,20/03/2018,20000.00,"ACQUISIZIONE DI MEDICAZIONI TRASPARENTI PER IL FISSAGGIO DEI CATETERI VASCOLARI DA DESTINARE ALLA UOC DI EMATOLOGIA, bando numero: 1877393",https://www.acquistinretepa.it/opencms/opencms/main/impresa/strumenti/dettaglio.jsp?idT=1877393&tipoVis=descr&nome=ACQUISIZIONE+DI+MEDICAZIONI+TRASPARENTI+PER+IL+FISSAGGIO+DEI+CATETERI+VASCOLARI+DA+DESTINARE+ALLA+UOC+DI+EMATOLOGIA&frompage=rdoAperte.jsp&orderBy=pubblicazione&sort=desc&__pagina=22&__element=paginazione,"Tue, 27 Feb 2018 02:00:00 +0200"
1877767,AZIENDA OSPEDALIERA OSPEDALI RIUNITI SAN GIOVANNI DI DIO E RUGGI D'ARAGONA SALERNO,Varie,2018-02-27,07/03/2018,18000.00,"SONDINI MONOUSO PER PH-IMPEDENZA, bando numero: 1877767",https://www.acquistinretepa.it/opencms/opencms/main/impresa/strumenti/dettaglio.jsp?idT=1877767&tipoVis=descr&nome=SONDINI+MONOUSO+PER+PH-IMPEDENZA&frompage=rdoAperte.jsp&orderBy=pubblicazione&sort=desc&__pagina=22&__element=paginazione,"Tue, 27 Feb 2018 02:00:00 +0200"
1877954,ASL SALERNO,Varie,2018-02-27,05/03/2018,300.00,"Carta termica x ECG Esaote Personal C3 per il PO di Sapri, bando numero: 1877954",https://www.acquistinretepa.it/opencms/opencms/main/impresa/strumenti/dettaglio.jsp?idT=1877954&tipoVis=descr&nome=Carta+termica+x+ECG+Esaote+Personal+C3+per+il+PO+di+Sapri&frompage=rdoAperte.jsp&orderBy=pubblicazione&sort=desc&__pagina=22&__element=paginazione,"Tue, 27 Feb 2018 02:00:00 +0200"
1878508,UNIVERSITA' DEGLI STUDI DI GENOVA,Varie,2018-02-27,02/03/2018,550.00,"VIDEOCITOFONO  IN KIT MONOFAMILIARE (VEDERE SPECIFICA TECNICA), bando numero: 1878508",https://www.acquistinretepa.it/opencms/opencms/main/impresa/strumenti/dettaglio.jsp?idT=1878508&tipoVis=descr&nome=VIDEOCITOFONO++IN+KIT+MONOFAMILIARE+%28VEDERE+SPECIFICA+TECNICA%29&frompage=rdoAperte.jsp&orderBy=pubblicazione&sort=desc&__pagina=22&__element=paginazione,"Tue, 27 Feb 2018 02:00:00 +0200"
1878399,POLITECNICO DI TORINO,Varie,2018-02-27,05/03/2018,3670.00,"PC E ACCESSORI, bando numero: 1878399",https://www.acquistinretepa.it/opencms/opencms/main/impresa/strumenti/dettaglio.jsp?idT=1878399&tipoVis=descr&nome=PC+E+ACCESSORI&frompage=rdoAperte.jsp&orderBy=pubblicazione&sort=desc&__pagina=22&__element=paginazione,"Tue, 27 Feb 2018 02:00:00 +0200"
1876690,ASL SALERNO,Varie,2018-02-27,08/03/2018,3000.00,"ACQUISTO VENTILATORE BILEVEL TIPO PRISMAVENTI 40 CON MATERIALE DI CONSUMO PER 12 MESI COME DA PRESCRIZIONE - PARUOLO L., bando numero: 1876690",https://www.acquistinretepa.it/opencms/opencms/main/impresa/strumenti/dettaglio.jsp?idT=1876690&tipoVis=descr&nome=ACQUISTO+VENTILATORE+BILEVEL+TIPO+PRISMAVENTI+40+CON+MATERIALE+DI+CONSUMO+PER+12+MESI+COME+DA+PRESCRIZIONE+-+PARUOLO+L.&frompage=rdoAperte.jsp&orderBy=pubblicazione&sort=desc&__pagina=23&__element=paginazione,"Tue, 27 Feb 2018 02:00:00 +0200"
1872185,ASL SALERNO,Varie,2018-02-27,08/03/2018,1000.00,"Acquisto di nebulizzatore Pari Boy SX e accessori con mat. di consumo - Fimiani M., bando numero: 1872185",https://www.acquistinretepa.it/opencms/opencms/main/impresa/strumenti/dettaglio.jsp?idT=1872185&tipoVis=descr&nome=Acquisto+di+nebulizzatore+Pari+Boy+SX+e+accessori+con+mat.+di+consumo+-+Fimiani+M.&frompage=rdoAperte.jsp&orderBy=pubblicazione&sort=desc&__pagina=23&__element=paginazione,"Tue, 27 Feb 2018 02:00:00 +0200"
1850687,ASL SALERNO,Varie,2018-02-27,09/03/2018,3000.00,"FORNITURA DI DISPOSITIVI CENTRALI PERIFERICI PER U.O. DI RIANIMAZIONE DEL P.O. DI POLLA, bando numero: 1850687",https://www.acquistinretepa.it/opencms/opencms/main/impresa/strumenti/dettaglio.jsp?idT=1850687&tipoVis=descr&nome=FORNITURA+DI+DISPOSITIVI+CENTRALI+PERIFERICI+PER+U.O.+DI+RIANIMAZIONE+DEL+P.O.+DI+POLLA&frompage=rdoAperte.jsp&orderBy=pubblicazione&sort=desc&__pagina=23&__element=paginazione,"Tue, 27 Feb 2018 02:00:00 +0200"
1877774,AZIENDA SANITARIA PROVINCIALE DI TRAPANI,Varie,2018-02-27,16/03/2018,2000.00,"Procedura negoziata ex art 36 comma 2 lett. b) D.Lgs. 50/2016 per la fornitura di n. 1 lettino per endoscopia per il servizio di Endoscopia Digestiva del P.O. di Mazara del Vallo, bando numero: 1877774",https://www.acquistinretepa.it/opencms/opencms/main/impresa/strumenti/dettaglio.jsp?idT=1877774&tipoVis=descr&nome=Procedura+negoziata+ex+art+36+comma+2+lett.+b%29+D.Lgs.+50%2F2016+per+la+fornitura+di+n.+1+lettino+per+endoscopia+per+il+servizio+di+Endoscopia+Digestiva+del+P.O.+di+Mazara+del+Vallo&frompage=rdoAperte.jsp&orderBy=pubblicazione&sort=desc&__pagina=23&__element=paginazione,"Tue, 27 Feb 2018 02:00:00 +0200"
1877408,POLITECNICO DI TORINO,Varie,2018-02-27,12/03/2018,1200.00,"POLITECNICO DI TORINO - DIATI - Fornitura kit di microfresatura a controllo numerico (come da richiesta d'offerta), bando numero: 1877408",https://www.acquistinretepa.it/opencms/opencms/main/impresa/strumenti/dettaglio.jsp?idT=1877408&tipoVis=descr&nome=POLITECNICO+DI+TORINO+-+DIATI+-+Fornitura+kit+di+microfresatura+a+controllo+numerico+%28come+da+richiesta+d%27offerta%29&frompage=rdoAperte.jsp&orderBy=pubblicazione&sort=desc&__pagina=23&__element=paginazione,"Tue, 27 Feb 2018 02:00:00 +0200"
1878425,UNIVERSITA' DEGLI STUDI DELLA CAMPANIA - LUIGI VANVITELLI,Varie,2018-02-27,14/03/2018,700.00,"Fornitura di 500 g di resina Dowex 1X8 chloride form, 100-200 mesh, bando numero: 1878425",https://www.acquistinretepa.it/opencms/opencms/main/impresa/strumenti/dettaglio.jsp?idT=1878425&tipoVis=descr&nome=Fornitura+di+500+g+di+resina+Dowex+1X8+chloride+form%2C+100-200+mesh&frompage=rdoAperte.jsp&orderBy=pubblicazione&sort=desc&__pagina=23&__element=paginazione,"Tue, 27 Feb 2018 02:00:00 +0200"
1878395,UNIVERSITA' DEGLI STUDI DI ROMA LA SAPIENZA,2,2018-02-27,09/03/2018,550.00,"2 SERVIZI CATERING A BUFFET PER DIGEF (URGENTE), bando numero: 1878395",https://www.acquistinretepa.it/opencms/opencms/main/impresa/strumenti/dettaglio.jsp?idT=1878395&tipoVis=descr&nome=2+SERVIZI+CATERING+A+BUFFET+PER+DIGEF+%28URGENTE%29&frompage=rdoAperte.jsp&orderBy=pubblicazione&sort=desc&__pagina=23&__element=paginazione,"Tue, 27 Feb 2018 02:00:00 +0200"
1874426,POLITECNICO DI TORINO,Varie,2018-02-26,02/03/2018,9271.00,"Richiesta di acquisto per materiale da laboratorio, bando numero: 1874426",https://www.acquistinretepa.it/opencms/opencms/main/impresa/strumenti/dettaglio.jsp?idT=1874426&tipoVis=descr&nome=Richiesta+di+acquisto+per+materiale+da+laboratorio&frompage=rdoAperte.jsp&orderBy=pubblicazione&sort=desc&__pagina=23&__element=paginazione,"Mon, 26 Feb 2018 02:00:00 +0200"
1874110,POLITECNICO DI TORINO,Varie,2018-02-26,01/03/2018,4900.00,"Richiesta di acquisto testa bivite per estrusore, bando numero: 1874110",https://www.acquistinretepa.it/opencms/opencms/main/impresa/strumenti/dettaglio.jsp?idT=1874110&tipoVis=descr&nome=Richiesta+di+acquisto+testa+bivite+per+estrusore&frompage=rdoAperte.jsp&orderBy=pubblicazione&sort=desc&__pagina=23&__element=paginazione,"Mon, 26 Feb 2018 02:00:00 +0200"
1877796,POLITECNICO DI TORINO,Varie,2018-02-26,05/03/2018,23000.00,"Fornitura di prodotti chimici, bando numero: 1877796",https://www.acquistinretepa.it/opencms/opencms/main/impresa/strumenti/dettaglio.jsp?idT=1877796&tipoVis=descr&nome=Fornitura+di+prodotti+chimici&frompage=rdoAperte.jsp&orderBy=pubblicazione&sort=desc&__pagina=23&__element=paginazione,"Mon, 26 Feb 2018 02:00:00 +0200"
1878299,MINISTERO DELLA DIFESA,Varie,2018-02-26,05/03/2018,10000.00,"Caffè e Generi Alimentari per O.S.L. (01) - ripetizione gara, bando numero: 1878299",https://www.acquistinretepa.it/opencms/opencms/main/impresa/strumenti/dettaglio.jsp?idT=1878299&tipoVis=descr&nome=Caff%E8+e+Generi+Alimentari+per+O.S.L.+%2801%29+-+ripetizione+gara&frompage=rdoAperte.jsp&orderBy=pubblicazione&sort=desc&__pagina=24&__element=paginazione,"Mon, 26 Feb 2018 02:00:00 +0200"
1877531,POLITECNICO DI TORINO,Varie,2018-02-26,02/03/2018,1300.00,"DET_POLITECNICO DI TORINO_ ATTREZZATURA_INFORMATICA_FFIO, bando numero: 1877531",https://www.acquistinretepa.it/opencms/opencms/main/impresa/strumenti/dettaglio.jsp?idT=1877531&tipoVis=descr&nome=DET_POLITECNICO+DI+TORINO_+ATTREZZATURA_INFORMATICA_FFIO&frompage=rdoAperte.jsp&orderBy=pubblicazione&sort=desc&__pagina=24&__element=paginazione,"Mon, 26 Feb 2018 02:00:00 +0200"
1864169,C.N.R. CONSIGLIO NAZIONALE DELLE RICERCHE,Varie,2018-02-26,09/03/2018,1300.00,"FORNITURA DI FLUIDO DIATERMICO PER TERMOSTATO DI CIRCOLAZIONE CON TEMPERATURA DI ESERCIZIO 20 -160 °C 40 lt, bando numero: 1864169",https://www.acquistinretepa.it/opencms/opencms/main/impresa/strumenti/dettaglio.jsp?idT=1864169&tipoVis=descr&nome=FORNITURA+DI+FLUIDO+DIATERMICO+PER+TERMOSTATO+DI+CIRCOLAZIONE+CON+TEMPERATURA+DI+ESERCIZIO+20+-160+%B0C+40+lt&frompage=rdoAperte.jsp&orderBy=pubblicazione&sort=desc&__pagina=24&__element=paginazione,"Mon, 26 Feb 2018 02:00:00 +0200"
1869856,C.N.R. CONSIGLIO NAZIONALE DELLE RICERCHE,Varie,2018-02-26,09/03/2018,1600.00,"FORNITURA DI TERMOSTATO RISCALDANTE DI CIRCOLAZIONE  20°C - 150°C CAP  VOL MIN 10 LT, bando numero: 1869856",https://www.acquistinretepa.it/opencms/opencms/main/impresa/strumenti/dettaglio.jsp?idT=1869856&tipoVis=descr&nome=FORNITURA+DI+TERMOSTATO+RISCALDANTE+DI+CIRCOLAZIONE++20%B0C+-+150%B0C+CAP++VOL+MIN+10+LT&frompage=rdoAperte.jsp&orderBy=pubblicazione&sort=desc&__pagina=24&__element=paginazione,"Mon, 26 Feb 2018 02:00:00 +0200"
1865389,PORTO TURISTICO DI CAPRI SPA UNIPERSONALE,Varie,2018-02-26,15/03/2018,87230.00,"FORNITURA DI MATERIALI EDILI, FINITURE E ARREDI  LOTTO 2 – ARREDI, bando numero: 1865389",https://www.acquistinretepa.it/opencms/opencms/main/impresa/strumenti/dettaglio.jsp?idT=1865389&tipoVis=descr&nome=FORNITURA+DI+MATERIALI+EDILI%2C+FINITURE+E+ARREDI++LOTTO+2+%3F+ARREDI&frompage=rdoAperte.jsp&orderBy=pubblicazione&sort=desc&__pagina=24&__element=paginazione,"Mon, 26 Feb 2018 02:00:00 +0200"
1877902,ASM - AZIENDA SANITARIA LOCALE DI MATERA,Varie,2018-02-26,13/03/2018,550.00,"BICCHIERI MONOUSO DA 200CC, bando numero: 1877902",https://www.acquistinretepa.it/opencms/opencms/main/impresa/strumenti/dettaglio.jsp?idT=1877902&tipoVis=descr&nome=BICCHIERI+MONOUSO+DA+200CC&frompage=rdoAperte.jsp&orderBy=pubblicazione&sort=desc&__pagina=24&__element=paginazione,"Mon, 26 Feb 2018 02:00:00 +0200"
1878041,UNIVERSITA' DEGLI STUDI DI PARMA,2,2018-02-26,19/03/2018,153846.00,"SERVIZI DI CONTACT CENTER INTEGRATO PER L'UNIVERSITA' DI PARMA, bando numero: 1878041",https://www.acquistinretepa.it/opencms/opencms/main/impresa/strumenti/dettaglio.jsp?idT=1878041&tipoVis=descr&nome=SERVIZI+DI+CONTACT+CENTER+INTEGRATO+PER+L%27UNIVERSITA%27+DI+PARMA&frompage=rdoAperte.jsp&orderBy=pubblicazione&sort=desc&__pagina=24&__element=paginazione,"Mon, 26 Feb 2018 02:00:00 +0200"
1877314,C.N.R. CONSIGLIO NAZIONALE DELLE RICERCHE,Varie,2018-02-26,19/03/2018,202000.00,"FORNITURA DI ATTREZZATURE INFORMATICHE APPLE E GENERICHE, bando numero: 1877314",https://www.acquistinretepa.it/opencms/opencms/main/impresa/strumenti/dettaglio.jsp?idT=1877314&tipoVis=descr&nome=FORNITURA+DI+ATTREZZATURE+INFORMATICHE+APPLE+E+GENERICHE&frompage=rdoAperte.jsp&orderBy=pubblicazione&sort=desc&__pagina=24&__element=paginazione,"Mon, 26 Feb 2018 02:00:00 +0200"
1878148,C.N.R. CONSIGLIO NAZIONALE DELLE RICERCHE,2,2018-02-26,09/03/2018,500.00,"Assistenza audio-video da prestare nell’Auditorium del CNR  di Pisa, bando numero: 1878148",https://www.acquistinretepa.it/opencms/opencms/main/impresa/strumenti/dettaglio.jsp?idT=1878148&tipoVis=descr&nome=Assistenza+audio-video+da+prestare+nell%3FAuditorium+del+CNR++di+Pisa&frompage=rdoAperte.jsp&orderBy=pubblicazione&sort=desc&__pagina=24&__element=paginazione,"Mon, 26 Feb 2018 02:00:00 +0200"
1878131,MINISTERO DELL'ISTRUZIONE DELL'UNIVERSITA' E DELLA RICERCA,Varie,2018-02-26,12/03/2018,1500.00,"Rilevatore presenze di personale nella scuola, bando numero: 1878131",https://www.acquistinretepa.it/opencms/opencms/main/impresa/strumenti/dettaglio.jsp?idT=1878131&tipoVis=descr&nome=Rilevatore+presenze+di+personale+nella+scuola&frompage=rdoAperte.jsp&orderBy=pubblicazione&sort=desc&__pagina=24&__element=paginazione,"Mon, 26 Feb 2018 02:00:00 +0200"
1877886,POLITECNICO DI TORINO,Varie,2018-02-26,09/03/2018,4800.00,"POLITECNICO DI TORINO - DIATI - Fornitura forno a muffola e sistema di filtrazione, bando numero: 1877886",https://www.acquistinretepa.it/opencms/opencms/main/impresa/strumenti/dettaglio.jsp?idT=1877886&tipoVis=descr&nome=POLITECNICO+DI+TORINO+-+DIATI+-+Fornitura+forno+a+muffola+e+sistema+di+filtrazione&frompage=rdoAperte.jsp&orderBy=pubblicazione&sort=desc&__pagina=25&__element=paginazione,"Mon, 26 Feb 2018 02:00:00 +0200"
1877753,MINISTERO DELL'ISTRUZIONE DELL'UNIVERSITA' E DELLA RICERCA,Varie,2018-02-26,24/03/2018,13712.00,"Laboratorio tecnologico, bando numero: 1877753",https://www.acquistinretepa.it/opencms/opencms/main/impresa/strumenti/dettaglio.jsp?idT=1877753&tipoVis=descr&nome=Laboratorio+tecnologico&frompage=rdoAperte.jsp&orderBy=pubblicazione&sort=desc&__pagina=25&__element=paginazione,"Mon, 26 Feb 2018 02:00:00 +0200"
1877914,ASM - AZIENDA SANITARIA LOCALE DI MATERA,Varie,2018-02-26,15/03/2018,29400.00,"Fornitura TONER/CARTUCCE RICOSTRUITI per stampanti varie, bando numero: 1877914",https://www.acquistinretepa.it/opencms/opencms/main/impresa/strumenti/dettaglio.jsp?idT=1877914&tipoVis=descr&nome=Fornitura+TONER%2FCARTUCCE+RICOSTRUITI+per+stampanti+varie&frompage=rdoAperte.jsp&orderBy=pubblicazione&sort=desc&__pagina=25&__element=paginazione,"Mon, 26 Feb 2018 02:00:00 +0200"
1868324,MINISTERO DELL'INTERNO,Varie,2018-02-26,07/03/2018,900.00,"Acquisto microfoni palmari Cap.2816 residui 2017 E.F. 2018, bando numero: 1868324",https://www.acquistinretepa.it/opencms/opencms/main/impresa/strumenti/dettaglio.jsp?idT=1868324&tipoVis=descr&nome=Acquisto+microfoni+palmari+Cap.2816+residui+2017+E.F.+2018&frompage=rdoAperte.jsp&orderBy=pubblicazione&sort=desc&__pagina=25&__element=paginazione,"Mon, 26 Feb 2018 02:00:00 +0200"
1863258,C.N.R. CONSIGLIO NAZIONALE DELLE RICERCHE,2,2018-02-26,12/03/2018,20000.00,"NOLEGGIO AUTOMEZZO SENZA CONDUCENTE 48 MESI A CAPITOLATO - CANONE MENSILE, bando numero: 1863258",https://www.acquistinretepa.it/opencms/opencms/main/impresa/strumenti/dettaglio.jsp?idT=1863258&tipoVis=descr&nome=NOLEGGIO+AUTOMEZZO+SENZA+CONDUCENTE+48+MESI+A+CAPITOLATO+-+CANONE+MENSILE&frompage=rdoAperte.jsp&orderBy=pubblicazione&sort=desc&__pagina=25&__element=paginazione,"Mon, 26 Feb 2018 02:00:00 +0200"
1877562,POLITECNICO DI MILANO,Varie,2018-02-26,01/03/2018,1800.00,"Fornitura 1300 palloni gonfiabili personalizzati -LR-, bando numero: 1877562",https://www.acquistinretepa.it/opencms/opencms/main/impresa/strumenti/dettaglio.jsp?idT=1877562&tipoVis=descr&nome=Fornitura+1300+palloni+gonfiabili+personalizzati+-LR-&frompage=rdoAperte.jsp&orderBy=pubblicazione&sort=desc&__pagina=25&__element=paginazione,"Mon, 26 Feb 2018 02:00:00 +0200"
1872105,AZIENDA OSPEDALIERO-UNIVERSITARIA OSPEDALI RIUNITI UMBERTO I - G.M. LANCISI - G. SALESI,Varie,2018-02-26,13/03/2018,27492.00,"AOR ANCONA FORNITURA BIENNALE CONTENITORE MAGNETICO PER SMALTIMENTO/CONTA AGHI E LAME FORMATO MAXI, bando numero: 1872105",https://www.acquistinretepa.it/opencms/opencms/main/impresa/strumenti/dettaglio.jsp?idT=1872105&tipoVis=descr&nome=AOR+ANCONA+FORNITURA+BIENNALE+CONTENITORE+MAGNETICO+PER+SMALTIMENTO%2FCONTA+AGHI+E+LAME+FORMATO+MAXI&frompage=rdoAperte.jsp&orderBy=pubblicazione&sort=desc&__pagina=25&__element=paginazione,"Mon, 26 Feb 2018 02:00:00 +0200"
1876327,ASL NO,Varie,2018-02-26,07/03/2018,13000.00,"Fornitura di Facciale filtrante certificato per la protezione da agenti biologici con valvola, bando numero: 1876327",https://www.acquistinretepa.it/opencms/opencms/main/impresa/strumenti/dettaglio.jsp?idT=1876327&tipoVis=descr&nome=Fornitura+di+Facciale+filtrante+certificato+per+la+protezione+da+agenti+biologici+con+valvola&frompage=rdoAperte.jsp&orderBy=pubblicazione&sort=desc&__pagina=25&__element=paginazione,"Mon, 26 Feb 2018 02:00:00 +0200"
1867249,"ISTITUTO ZOOPROFILATTICO SPERIMENTALE DEL PIEMONTE, LIGURIA E VALLE D'AOSTA",Varie,2018-02-26,19/03/2018,56107.00,"FORNITURA ANNUALE, CON EVENTUALE PROROGA DI 6 MESI ED UTILIZZO DEL QUINTO D’OBBLIGO, DI KIT ELISA AUJESZKY, bando numero: 1867249",https://www.acquistinretepa.it/opencms/opencms/main/impresa/strumenti/dettaglio.jsp?idT=1867249&tipoVis=descr&nome=FORNITURA+ANNUALE%2C+CON+EVENTUALE+PROROGA+DI+6+MESI+ED+UTILIZZO+DEL+QUINTO+D%3FOBBLIGO%2C+DI+KIT+ELISA+AUJESZKY&frompage=rdoAperte.jsp&orderBy=pubblicazione&sort=desc&__pagina=25&__element=paginazione,"Mon, 26 Feb 2018 02:00:00 +0200"
1878040,ISPETTORATO NAZIONALE DEL LAVORO,10,2018-02-26,25/03/2018,2300.00,"MANUTENZIONE IMPIANTI, bando numero: 1878040",https://www.acquistinretepa.it/opencms/opencms/main/impresa/strumenti/dettaglio.jsp?idT=1878040&tipoVis=descr&nome=MANUTENZIONE+IMPIANTI&frompage=rdoAperte.jsp&orderBy=pubblicazione&sort=desc&__pagina=25&__element=paginazione,"Mon, 26 Feb 2018 02:00:00 +0200"
1877396,AZIENDA SANITARIA PROVINCIALE DI ENNA,Varie,2018-02-26,14/03/2018,5500.00,"SONDE PER GASTROSTOMIA, bando numero: 1877396",https://www.acquistinretepa.it/opencms/opencms/main/impresa/strumenti/dettaglio.jsp?idT=1877396&tipoVis=descr&nome=SONDE+PER+GASTROSTOMIA&frompage=rdoAperte.jsp&orderBy=pubblicazione&sort=desc&__pagina=26&__element=paginazione,"Mon, 26 Feb 2018 02:00:00 +0200"
1874893,AZIENDA OSPEDALIERA UNIVERSITARIA FEDERICO II,Varie,2018-02-26,14/03/2018,13900.00,"LD BARICITINIB CPR, bando numero: 1874893",https://www.acquistinretepa.it/opencms/opencms/main/impresa/strumenti/dettaglio.jsp?idT=1874893&tipoVis=descr&nome=LD+BARICITINIB+CPR&frompage=rdoAperte.jsp&orderBy=pubblicazione&sort=desc&__pagina=26&__element=paginazione,"Mon, 26 Feb 2018 02:00:00 +0200"
1877988,AZIENDA OSPEDALIERA CITTA' DELLA SALUTE E DELLA SCIENZA DI TORINO,Varie,2018-02-26,26/03/2018,50000.00,"-FORNITURA DI  LICENZE D'USO DEL SOFTWARE APPLICATIVO PER LA GESTIONE DI UNA CARTELLA INFORMATIZZATA PER LA DIABETOLOGIA, bando numero: 1877988",https://www.acquistinretepa.it/opencms/opencms/main/impresa/strumenti/dettaglio.jsp?idT=1877988&tipoVis=descr&nome=-FORNITURA+DI++LICENZE+D%27USO+DEL+SOFTWARE+APPLICATIVO+PER+LA+GESTIONE+DI+UNA+CARTELLA+INFORMATIZZATA+PER+LA+DIABETOLOGIA&frompage=rdoAperte.jsp&orderBy=pubblicazione&sort=desc&__pagina=26&__element=paginazione,"Mon, 26 Feb 2018 02:00:00 +0200"
1877974,COMUNE DI SOMMACAMPAGNA,Varie,2018-02-26,13/03/2018,27000.00,"ATTREZZATURE ED ARREDI PALESTRA CASELLE, bando numero: 1877974",https://www.acquistinretepa.it/opencms/opencms/main/impresa/strumenti/dettaglio.jsp?idT=1877974&tipoVis=descr&nome=ATTREZZATURE+ED+ARREDI+PALESTRA+CASELLE&frompage=rdoAperte.jsp&orderBy=pubblicazione&sort=desc&__pagina=26&__element=paginazione,"Mon, 26 Feb 2018 02:00:00 +0200"
1877735,COMUNE DI LA SPEZIA,Varie,2018-02-26,16/03/2018,63115.00,"VIRTUALIZZAZIONE AMBIENTE INTERNET - PROGETTI FESR POR, bando numero: 1877735",https://www.acquistinretepa.it/opencms/opencms/main/impresa/strumenti/dettaglio.jsp?idT=1877735&tipoVis=descr&nome=VIRTUALIZZAZIONE+AMBIENTE+INTERNET+-+PROGETTI+FESR+POR&frompage=rdoAperte.jsp&orderBy=pubblicazione&sort=desc&__pagina=26&__element=paginazione,"Mon, 26 Feb 2018 02:00:00 +0200"
1877961,AZIENDA U.S.L. TOSCANA NORD - OVEST,Varie,2018-02-26,05/03/2018,900.00,"Portabiciclette per Ospedale delle Apuane, bando numero: 1877961",https://www.acquistinretepa.it/opencms/opencms/main/impresa/strumenti/dettaglio.jsp?idT=1877961&tipoVis=descr&nome=Portabiciclette+per+Ospedale+delle+Apuane&frompage=rdoAperte.jsp&orderBy=pubblicazione&sort=desc&__pagina=26&__element=paginazione,"Mon, 26 Feb 2018 02:00:00 +0200"
1877910,A.S.M. RIETI S.P.A,Varie,2018-02-26,15/03/2018,145000.00,"SPAZZATRICE STRADALE ASPIRANTE O COMBINATA MECCANICA/ASPIRANTE 4/5 MC - Precedente RDO 1861969, bando numero: 1877910",https://www.acquistinretepa.it/opencms/opencms/main/impresa/strumenti/dettaglio.jsp?idT=1877910&tipoVis=descr&nome=SPAZZATRICE+STRADALE+ASPIRANTE+O+COMBINATA+MECCANICA%2FASPIRANTE+4%2F5+MC+-+Precedente+RDO+1861969&frompage=rdoAperte.jsp&orderBy=pubblicazione&sort=desc&__pagina=26&__element=paginazione,"Mon, 26 Feb 2018 02:00:00 +0200"
1877847,ASL NAPOLI 1 CENTRO,Varie,2018-02-26,12/03/2018,96043.50,"Fornitura di cancellaria e stampanti occorrenti per tutte le unità operative aziendali ASL NAPOLI 1(LT), bando numero: 1877847",https://www.acquistinretepa.it/opencms/opencms/main/impresa/strumenti/dettaglio.jsp?idT=1877847&tipoVis=descr&nome=Fornitura+di+cancellaria+e+stampanti+occorrenti+per+tutte+le+unit%E0+operative+aziendali+ASL+NAPOLI+1%28LT%29&frompage=rdoAperte.jsp&orderBy=pubblicazione&sort=desc&__pagina=26&__element=paginazione,"Mon, 26 Feb 2018 02:00:00 +0200"
